,Unnamed: 0,Nr,URL,Title,Category,Subcategory,Saved,LastUpOn,Description,Zustand,FirstPrice,FirstAvailable,MinAmount,Location,Hersteller,Properties,FirstPriceNumeric,FirstAvailableNumeric,LastPriceNumeric,LastAvailableNumeric,LastPrice,LastAvailable,Sold,SoldAfter,Imagefile,Title_en,material_emb,German_Raw,German_Code,first_level,second_level,third_level,SoldAfterDays,StockChange
2574,2574,97518,https://restado.de/baustoff/antik-riemchen-terracotta-ziegel-boden-fliese-kueche-bad-lounge-alte-mauersteine-landhaus-shabby-chic/,Antik Riemchen Terracotta Ziegel boden fliese Küche Bad Lounge alt…,Innenausbau,Bodenbeläge,2023-01-09,,"++++++Sonderpreis statt 59 nur 39 EUR/ m² ++++++++  original historische Backsteine zu dünnen Bodenziegeln geschnitten.  Nachdem zwei Riemchen von den Außenseiten  abgeschnitten wurden, drehen wir den Stein um 90 Grad und schneiden nochmals 2 Seiten, mit authentischer Oberfläche ab.  Die Seiten werden besäumt, bzw. abgerundet.  Die ökologisch wertvolle Wiederverwendung wird somit nochmals optimaler ausgenutzt, der Preis kann reduziert werden.  Preis je 1 m²  Transportkosten auf Anfrage.  Bezugnahme auf Art-Nr: Bd Zg rt Preußisch 4-22  Antik-Stein auch auf social media  Page: baustoffe-antik.de",Gebraucht,35€ / m²,300 m² verfügbar,(3 m² Mindestabnahme),D-06120 Halle (Saale),,{},35.0,300.0,35.0,300.0,35€ / m²,300 m² verfügbar,0.0,,"['https://restado.de/wp-content/uploads/products/2022/04/9b3a3f86-20170114_151740.jpg', 'https://restado.de/wp-content/uploads/products/2022/04/0630fc09-rm-rt-radow-29er-11-20-4.jpg', 'https://restado.de/wp-content/uploads/products/2022/04/8c1677f7-rm-rt-preussisch-mu-flae-27.4.22-3.jpg', 'https://restado.de/wp-content/uploads/products/2022/04/755c1432-erklaer-pruskje-1-2-schnitt.jpg', 'https://restado.de/wp-content/uploads/products/2022/04/dc2ae35c-rm-rt-preussisch-mu-flae-27.4.22.jpg', 'https://restado.de/wp-content/uploads/products/2022/04/5f5331f0-vk-64-21-rm-rt-rado.jpg', 'https://restado.de/wp-content/uploads/products/2022/04/064f53b9-collage-herstellung-deutsch.jpg', 'https://restado.de/wp-content/uploads/products/2022/04/aa366670-rm-rt-radow-29er-11-20.jpg', 'https://restado.de/wp-content/uploads/products/2022/04/2a1ff190-mehr-ref-auf-baust-antik-17.jpg']",Antique Strap Terracotta Brick Floor Tile Kitchen Bathroom Lounge Old…,Porcelain,Porcelain tiles,Pr_35_93_96_63,Furnishings,Furnishings,Furnishings,,0.0
2576,2576,93345,https://restado.de/baustoff/parador-vinylboden-basic-4-3-eiche-natur-landhausdiele/,Parador Vinylboden Basic 4.3 Eiche Natur Landhausdiele,Innenausbau,Bodenbeläge,2023-01-09,,"Parador Vinylboden Basic 4.3 Eiche Natur Landhausdiele  Hochwertiger Designboden in klassischer Holzoptik Nutzungsklasse 23/31 für Wohnräume mit hoher und gewerbliche Räume mit geringer Nutzung Für die Verlegung in Feuchträumen und auf Fußbodenheizung geeignet Aufgrund des fortschrittlichen Klicksystems besonders leicht und schnell verlegbar Ca. 4,3 mm Dielenstärke • Paketinhalt: 2,383qm  Vinylboden wurde für Sanierungszwecke der Eigentumswohnung gekauft. Wiederverkauf da Sanierung nicht durchgeführt wird. Die Ware ist originalverpackt und wurde bei Zimmertemperatur im ausgebauten Kellerraum gelagert. Mindestabnahme 30qm Verkaufspreis im Baustoffhandel aktuell 66,70€ pro Paket = 2,383qm.",Neu,21€ (VB) / m²,85 m² verfügbar,(30 m² Mindestabnahme),D-68519 Viernheim,,{},21.0,85.0,21.0,85.0,21€ (VB) / m²,85 m² verfügbar,0.0,,"['https://restado.de/wp-content/uploads/products/2022/03/bd5943c4-228549f9-2151-49a0-af74-dc837e8f6852.png', 'https://restado.de/wp-content/uploads/products/2022/03/69946863-f33ae5da-a99f-4044-bfb1-f1bc23cfe1a7.png']",Parador vinyl floor Basic . natural oak wideplank,American white oak,Wood floor sealers,Pr_35_31_77_96,Furnishings,"Floors, Ceiling",Furnishings,,0.0
2577,2577,92960,https://restado.de/baustoff/berryalloc-pure-click-55-designboden-eiche-lime-939s-wood/,BerryAlloc Pure Click 55 Designboden Eiche Lime 939S Wood,Innenausbau,Bodenbeläge,2023-01-09,,"Original verpackt: 121,184 m² flexibles 360 Grad Klicksystem neueste Rigid Core Technologie noch authentischer: Synchronprägung sehr hohe Nutzungklasse 33, 42 Garantie privat: lebenslang integ. Schalldämmung: -10 d Nutzungsklasse23/33/42 Belagstärke> 5 mm Nutzschicht0.55 Trittschalldämmung10 dB",Neu,"28,95€ / m²",120 m² verfügbar,(2 m² Mindestabnahme),D-12099 Berlin,Berry Alloc Rigid Vinyl ,{},28.95,120.0,28.95,120.0,"28,95€ / m²",120 m² verfügbar,0.0,,['https://restado.de/wp-content/uploads/products/2022/03/4f535786-59-1.jpg'],BerryAlloc Pure Click Designboden Eiche Lime Wood,Wood,Wood lathings,Pr_20_85_46_96,Furnishings,Furnishings,Furnishings,,0.0
2590,2590,91680,https://restado.de/baustoff/fussleisten-eiche/,Fußleisten Eiche,Innenausbau,Bodenbeläge,2023-01-09,,"Fußleisten aus Eiche, unbehandelt und schlicht",Neu,5€ / lfm,160 lfm verfügbar,(20 lfm Mindestabnahme),D-35390 Giessen,,"{""Material"": ""Holz""}",5.0,160.0,5.0,160.0,5€ / lfm,160 lfm verfügbar,0.0,,['https://restado.de/wp-content/uploads/products/2022/02/f0c2461a-img_0970-scaled.jpg'],Oak skirting boards,Oak,Wood skirtings,Pr_35_90_43_98,Furnishings,"Floors, Ceiling","Non-rigid sheet, mat and strip covering and finish products",,0.0
2596,2596,81928,https://restado.de/baustoff/fussleisten-echtholz-weiss-lackiert/,"Fußleisten, Echtholz, weiß lackiert",Innenausbau,Bodenbeläge,2023-01-09,,"Es handelt sich um weiß lackierte Echtholz-Profilleisten mit Bohrlöchern, 6 cm hoch, 2 cm stark.13 Stücke zwischen 3,55 und 1,54 m lang.",Gebraucht,0€ (VB) / lfm,35 lfm verfügbar,(10 lfm Mindestabnahme),D-40235 Düsseldorf,Profilleiste Kiefer,{},0.0,35.0,0.0,35.0,0€ (VB) / lfm,35 lfm verfügbar,0.0,,['https://restado.de/wp-content/uploads/products/2021/11/a11d0c82-fa70a550-8c64-4bda-8750-e4d3888b392e.jpeg'],"Skirting boards , real wood , painted white",Wood,Wood skirtings,Pr_35_90_43_98,Furnishings,Furnishings,Furnishings,,0.0
2604,2604,79064,https://restado.de/baustoff/flotex-teppichfliesen-bodenbelag-buero-top-qualitaet-gereinigt/,"Flotex Teppichfliesen, Bodenbelag, Büro, Top Qualität",Innenausbau,Bodenbeläge,2023-01-09,,"Ca. 4000 m2 professionell gereinigte Teppichfliesen  Firma: Forbo Flooring Systems Ltd.  Produkt: Flotex „Color Acoustic Plus“ Teppichfliesen  Maße der Fliese: 5,0 mm Dicke, 50 x 50 cm  12 Fliesen = 3 m2, 4,8 kg pro m2  Farbe: red 211008, grey 211046  Professionelle Reinigung mit Aufpreis möglich: Auf dem letzten Foto ist der Unterschied vor und nach der Reinigung zu sehen  Besonderheiten:  - Weniger Lärm: Schallabsorption von 0,10 aw - Pflegeleicht und waschbar - Sehr gute Rutschfestigkeit - Mechanische Nassreinigung möglich - Made in UK (Top Qualität/ Langlebigkeit)  (Digitale Broschüre/ Zusatzblatt/ Reinigungsbescheinigung auf Anfrage)  Bis Ende September verfügbar",Aufbereitet,20€ (VB) / m²,4.000 m² verfügbar,(10 m² Mindestabnahme),D-40213 Düsseldorf,Forbo Flooring Systems ,"{""Serie"": ""Flotex Color Acoustic Plus"", ""Format"": ""Fliese""}",20.0,4000.0,20.0,4000.0,20€ (VB) / m²,4.000 m² verfügbar,0.0,,"['https://restado.de/wp-content/uploads/products/2021/07/1a5942be-img_1688-scaled.jpg', 'https://restado.de/wp-content/uploads/products/2021/07/40c1708c-img_1701-scaled.jpg', 'https://restado.de/wp-content/uploads/products/2021/07/afdb7462-16-zweiter-flur-ergebnis-links-nicht-gereinigt-rechts-gereinigt-im-garnpadverfahren-scaled.jpg', 'https://restado.de/wp-content/uploads/products/2021/07/b7d5f364-bildschirmfoto-2021-07-20-um-18.08.06.png']","Flotex carpet tiles , floor covering , office , top quality",Porcelain,"Carpets, carpet tiles, coverings, underlays and mats",Pr_35_57_11,Furnishings,Furnishings,"Non-rigid sheet, mat and strip covering and finish products",,0.0
2609,2609,77917,https://restado.de/baustoff/sisal-teppiche-versch-groessen/,"Sisal-Teppiche, versch. Größen",Innenausbau,Bodenbeläge,2023-01-09,,"gebraucht, sehr gut erhalten / fast neu, naturfarben, verschiedene Maße, ca.-Maße in cm: 3x3,15 m 2,45 x 10 m 2,45 x 11 m 7 x 5 m 2 x 1,85 m 2,45 x 4 m 3,65 x 5,65 m per qm 20,- Euro bei Komplettübernahme Sonderpreis!!!",Neuwertig,1€ (VB) / Stück,1 Stück verfügbar,(1 Stück Mindestabnahme),D-22765 Hamburg,,{},1.0,1.0,1.0,1.0,1€ (VB) / Stück,1 Stück verfügbar,0.0,,['https://restado.de/wp-content/uploads/products/2021/06/b53a2607-35.jpg'],"Sisal carpets , various sizes",Single-sized aggregates,Pile carpets,Pr_35_57_11_64,Furnishings,Furnishings,Furnishings,,0.0
2614,2614,67234,https://restado.de/baustoff/antik-riemchen-bodenfliesen-terracotta-ziegelboden-kuechen-boden-alte-mauersteine-landhaus-shabby-chic/,Antik Riemchen Bodenfliesen Terracotta Ziegelboden Küchen Boden al…,Innenausbau,Bodenbeläge,2023-01-09,1691798400000.0,"Bodenziegel geschnitten aus original historischen Reichsformat Klinkern.  Die Ziegelsteine stammen aus dem Handrückbau historischer Gebäude.  Preis je 1 m², bei Abnahme von min. 20 m² Mindermengen 45 €/ m²  Ergiebigkeit 52 Stck/ m².  Maß je Riemchen: 25x6,5x 2 cm  Transportkosten auf Anfrage.  Bezugnahme auf Art-Nr: Rm rt glatt Tom 12-20  ***Antik-Stein auch auf Facebook, Pinterest & youtube***  page: baustoffe-antik.de",Gebraucht,45€ / m²,200 m² verfügbar,(20 m² Mindestabnahme),D-06120 Halle (Saale),,{},45.0,200.0,45.0,200.0,45€ / m²,200 m² verfügbar,1.0,18576000000.0,"['https://restado.de/wp-content/uploads/products/2020/12/547955bb-20170114_151740-galerie.jpg', 'https://restado.de/wp-content/uploads/products/2020/12/51ed5ef4-bd-pl-rt-25x65-glatt-glaerie.jpg', 'https://restado.de/wp-content/uploads/products/2020/12/d7b452e2-rm-glatt-rot-doelau.jpg', 'https://restado.de/wp-content/uploads/products/2020/12/c1d96db3-collage-herstellung-deutsch.jpg', 'https://restado.de/wp-content/uploads/products/2020/12/fd3c13fd-20170114_151740-3.jpg']",Antique Strap Floor Tiles Terracotta Brick Floor Kitchen Floor Al…,Porcelain,Ceramic tiles,Pr_35_93_96_19,Furnishings,"Floors, Ceiling","Floor plates, gratings and edgings",215.0,0.0
2618,2618,55921,https://restado.de/baustoff/laminat-haro-tritty-100/,Laminat HARO TRITTY 100,Innenausbau,Bodenbeläge,2023-01-09,,"Haro TRITTY 100 Gran Via 4V, Eiche weiß gekalkt, Holznachbildung 8x243x2200 mm",Neu,15€ (VB) / m²,20 m² verfügbar,(2 m² Mindestabnahme),D-51063 Cologne,Haro,"{""Holznachbildung"": ""Eiche"", ""Laminatstärke"": ""8,0 mm""}",15.0,20.0,15.0,20.0,15€ (VB) / m²,20 m² verfügbar,0.0,,"['https://restado.de/wp-content/uploads/products/2020/07/e11d6add-df8c4d19-b685-49ab-8fa3-460046b6659f.jpeg.webp', 'https://restado.de/wp-content/uploads/products/2020/07/4bcb837f-92366e98-8177-4baa-a9af-54591716ab45-scaled.jpeg.webp']",Laminate,Wood,Paper laminators,Pr_40_70_58_60,Furnishings,"Floors, Ceiling","Non-rigid sheet, mat and strip covering and finish products",,0.0
2620,2620,51789,https://restado.de/baustoff/shaggy-frise-teppich-dunkelgruen-bw-4m-breite-cozy-nr-225857/,Shaggy Frisé Teppich dunkelgrün BW 4m Breite / Cozy Nr. 225857,Innenausbau,Bodenbeläge,2023-01-09,,"hochfloriger Frisé Teppichboden Bahnenware in 4m Breite, getuftet dunkelgrün Brandklasse Cfl-s1 Material 100% Polyamid Gesamtgewicht ca. 2800gr/qm Gesamtstärke 14mm Nutzungsklasse 22 fußbodenheizungsgeeignet Art-Nr. 225857  Preis inkl. MwSt. Transportkosten auf Anfrage, je nach Abnahmemenge",Neu,"20,45€ (VB) / m²",135 m² verfügbar,(4 m² Mindestabnahme),D-40472 Düsseldorf,,"{""Serie"": ""Cozy"", ""Format"": ""Bahnenware"", ""Farbton"": ""grün"", ""Rollenbreite (m)"": ""4,0"", ""Teppichart"": ""Velousteppich""}",20.45,135.0,20.45,135.0,"20,45€ (VB) / m²",135 m² verfügbar,0.0,,['https://restado.de/wp-content/uploads/products/2020/04/9b4a70c5-225857.jpg.webp'],Shaggy Frisé carpet dark green m width / Cozy No .,Wool,Tufted carpets,Pr_35_57_11_91,Furnishings,Furnishings,Furnishings,,0.0
2622,2622,50816,https://restado.de/baustoff/laminat-5/,Laminat,Innenausbau,Bodenbeläge,2023-01-09,,Klicksystem an Längs- und Querseite,Neu,50€ (VB) Paketpreis,10 m² verfügbar,(10 m² Mindestabnahme),D-71263 Weil der Stadt,,"{""Für Fussbodenheizung geeignet"": ""Ja"", ""Holznachbildung"": ""Buche"", ""Beanspruchungsklasse"": ""23 (stark, Wohnbereich)"", ""Laminatstärke"": ""6,0 mm""}",50.0,10.0,50.0,10.0,50€ (VB) Paketpreis,10 m² verfügbar,0.0,,[],Laminate,Wood,Paper laminators,Pr_40_70_58_60,Furnishings,"Floors, Ceiling","Non-rigid sheet, mat and strip covering and finish products",,0.0
2636,2636,8482,https://restado.de/baustoff/designbelag-tarkett-id-inspiration-55-click-rustic-oak-medium-grey/,Designbelag Tarkett iD-Inspiration 55 Click Rustic Oak - medium gre…,Innenausbau,Bodenbeläge,2023-01-09,,"Guten Tag,  zum Verkauf stehen, wegen eines Fehlkaufes, 44 Pakete Tarkett Designbodenbelag. Es handelt sich um komplett ungeöffnete Pakete in dem Muster: Rustic Oak - medium grey. Der Bodenbelag ist für den Wohn-, als auch für den Geschäftsbereich zugelassen.  Neupreis: ca. 2100 € inkl. Mwst.  Produkteigenschaften Tarkett iD Inspiration 55 Click Vinyl Designbelag Wood zum Klicken Rustic Oak medium grey  Planke Format: 1211 x 190 mm Gesamtstärke: 4,5 mm Nutzschicht: 0,55 mm Nutzungsklasse: 42 Paket: 1,61 m² Brandverhalten: Bfl-S1 Antistatisch Trittschall: 5 dB Fußbodenheizung geeignet Rutschhemmklasse: R9  Hierbei handelt es sich um ein Privatkauf. Umtausch und Rückgabe sind ausgeschlossen.  Versand gegen Aufpreis möglich!  Bezahlung: PayPal Bar bei Abholung Überweisung",Neu,23€ / m²,70 m² verfügbar,(1 m² Mindestabnahme),Neu,,{},23.0,70.0,23.0,70.0,23€ / m²,70 m² verfügbar,0.0,,[],Designbelag Tarkett iD-Inspiration Click Rustic Oak - medium gre…,European oak,Wood architraves,Pr_35_90_43_87,Furnishings,Furnishings,Furnishings,,0.0
2735,2735,119825,https://restado.de/baustoff/vox-armierungsgewebe/,VOX Armierungsgewebe,Innenausbau,Trockenbau,2023-01-09,,Flächengewicht 160 g/m² Maschenweite: ca. 4 x 4 mm 1m x 50m (50m²)  PUTZGEWEBE AUßEN & INNEN - Das große Glasfasergewebe ist verrottungsfest & dauerelastisch und kann somit ideal als Innenputzgewebe oder Armierungsgewebe für den Außenputz verwendet werden.,Neu,39€ / Stück,9 Stück verfügbar,(1 Stück Mindestabnahme),D-78224 Singen,VOX,{},39.0,9.0,39.0,9.0,39€ / Stück,9 Stück verfügbar,0.0,,['https://restado.de/wp-content/uploads/products/2023/02/5c9e13b2-0c21-4cbd-9714-0d3af1133b41.jpeg'],reinforcement fabric,Polyester,Stainless steel fabric reinforcement,Pr_20_96_71_84,Furnishings,"Blocks, Panels, Fences, Bricks","Non-rigid sheet, mat and strip covering and finish products",,0.0
2765,2765,86640,https://restado.de/baustoff/knauf-gipsplatte/,KNAUF Gipsplatte,Innenausbau,Trockenbau,2023-01-09,,"RESTWARE!EINKAUFSPREIS! Es werden Feuerschutzplatten von der Firma Knauf verkauft. Die Ware ist unbeschädigt und befindet sich auf Lager. Auf Wunsch können die Platten im Umkreis geliefert werden. 6 Pal a 40 Stück + 27 Stück Knauf Feuerschutzplatte GKF HRAK 15mm 1250x2000 -2,95 € der m² 1 ST=2,5m²  65 Stück Knauf Diamant GKFI 18mm 625x2500mm - 7,80 € der m² 1 ST=1,56 m²  Bei Interesse bitte Telefonisch unter 09771 9069 808 anrufen.",Neu,"7,80€ (VB) / Stück",65 Stück verfügbar,(10 Stück Mindestabnahme),D-97616 Salz,Knauf,"{""Format"": ""625x2500 mm"", ""Kantenausbildung"": ""HRAK"", ""Anwendungsbereich"": ""Brandschutz"", ""Plattenstärke"": ""18 mm""}",7.8,65.0,7.8,65.0,"7,80€ (VB) / Stück",65 Stück verfügbar,0.0,,['https://restado.de/wp-content/uploads/products/2021/11/27776945-59.jpg'],plasterboard,Wood,Plasterboard panels,Pr_25_71_35_63,Furnishings,"Floors, Ceiling",Walling units,,0.0
2766,2766,86507,https://restado.de/baustoff/knauf-gipsplatten/,Knauf Gipsplatten,Innenausbau,Trockenbau,2023-07-21,,"RESTWARE! Es werden Feuerschutzplatten von der Firma Knauf verkauft. Die Ware ist unbeschädigt und befindet sich auf Lager. Auf Wunsch können die Platten im Umkreis geliefert werden.  6 Pal a 40 Stück + 27 Stück Knauf Feuerschutzplatte GKF HRAK 15mm 1250x2000 -2,95 € der m² 1 ST=2,5m²",Neu,0€ /,,(inkl. 19% MwSt.),D-97616 Salz,Knauf,"{""Format"": ""2000 x 1250 mm"", ""Anwendungsbereich"": ""Brandschutz"", ""Plattenstärke"": ""15 mm""}",0.0,0.0,0.0,0.0,0€ /,,0.0,,['https://restado.de/wp-content/uploads/products/2021/11/1c12c9eb-57.jpg'],Knauf Plasterboards,Bituminous material,Gypsum plasterboards,Pr_25_71_35_65,Furnishings,"Blocks, Panels, Fences, Bricks",Walling units,,0.0
2845,2845,107986,https://restado.de/baustoff/decorpaneele-natuerliche-eiche/,Decorpaneele NATÜRLICHE EICHE,Innenausbau,Sonstiges,2023-01-09,,"Top Design Lösung  +Unsere Decorpaneele, gibt es nicht im Baumarkt !  Lammelen schritt 1,2cm , 2,7cm Breite Lameelen und Dicke ist 1,3cm  +Haus, Wohnung, Büro, Musikstudio, Einzelhandel, Hotels. +Einfache Montage Wand, Decke. +Super Ergebnis  Produktbeschreibung   Size: 600x2400mm 1.44m2  Ca.2 Wochen Lieferzeit auf Bestellung  Besuchen Sie unsere Webseite und erfahren Sie mehr:  https://www.akustik-paneele.com/",Neu,120€ (VB) / Stück,106 Stück verfügbar,(1 Stück Mindestabnahme),D-47226 Duisburg,Lettland,"{""Produkt"": ""Decorpaneele NATÜRLICHE EICHE""}",120.0,106.0,120.0,106.0,120€ (VB) / Stück,106 Stück verfügbar,0.0,,['https://restado.de/wp-content/uploads/products/2022/06/82fdfb64-natureiche.jpg'],Decor panels,Decorative aggregates,Decorative metal panels,Pr_25_71_50_24,Furnishings,"Blocks, Panels, Fences, Bricks",Glass blocks and panels,,0.0
2847,2847,107990,https://restado.de/baustoff/decor-paneele-bronze/,Decor Paneele Bronze,Innenausbau,Sonstiges,2023-01-09,,"Top Design Lösung  +Unsere Decorpaneele, gibt es nicht im Baumarkt !  Lammelen schritt 1,2cm , 2,7cm Breite Lameelen und Dicke ist 1,3cm  +Haus, Wohnung, Büro, Musikstudio, Einzelhandel, Hotels. +Einfache Montage Wand, Decke. +Super Ergebnis  Produktbeschreibung   Size: 600x2400mm 1.44m2  Ca.2 Wochen Lieferzeit auf Bestellung  Besuchen Sie unsere Webseite und erfahren Sie mehr:  https://www.akustik-paneele.com/",Neu,120€ (VB) / Stück,110 Stück verfügbar,(1 Stück Mindestabnahme),D-47226 Duisburg,Lettland,"{""Produkt"": ""Decor Paneele Bronze""}",120.0,110.0,120.0,110.0,120€ (VB) / Stück,110 Stück verfügbar,0.0,,['https://restado.de/wp-content/uploads/products/2022/06/37825cbe-bronze.jpg'],Decor Panele Bronze,Bronze,Decorative metal panels,Pr_25_71_50_24,Furnishings,"Blocks, Panels, Fences, Bricks",Glass blocks and panels,,0.0
2853,2853,104133,https://restado.de/baustoff/holzdekor-spanplatten-na-arezzo-walnut-fundermax-star-favorit/,Holzdekor-Spanplatten NA Arezzo Walnut (FUNDERMAX Star Favorit),Innenausbau,Sonstiges,2023-01-09,,"ür Selbstabholer in 14469 Potsdam: Hier werden angeboten Holzdekor-Spanplatten NA Arezzo Walnut (FUNDERMAX Star Favorit), Stärke 19mm (sie beidseitig mit dem Dekor belegt + teilweise auch die Kanten).  15x ca. (b)2,05m/(h)2,20m = 67,65qm 12x ca. (b)2,05m/(h)1,34m = 32,96qm + Abschnitte/ Reste  Diese Dekor-Platten wurden als Kulissenwände für ein Film-Set verwenden - sie standen 2 Wochen im Einsatz. Die Maße variieren leicht. Vor allem zu den Rändern muß man mit Schraub- und Nagellöchern rechnen, aber pro Element ist eine große Fläche pro Platte ""unberührt"". Wir hatten 16 Elemente aufgestellt, jeweils mit einem unterem Teil-A (B ca. 205cm; H ca. 220cm ) und einem oberen Teil-B (B ca. 205cm; H ca. 134cm). Vier der oberen Teile-B wurden gekürzt, ein Teil-A hat einen Ausschnitt für einen TV bekommen.  Der original Verkaufspreis beträgt 27€/qm (brutto). Wir bieten wir es für 20€/qm (VB) an. Insgesamt sind es ca. 100qm  Abholdatum: Montag, 30.5.22 abends oder Dienstag, 31.05.22 morgens",Neuwertig,20€ (VB) / Stück,27 Stück verfügbar,(10 Stück Mindestabnahme),D-14469 Potsdam,FUNDERMAX Star Favorit,"{""Produkt"": ""Holzdekor-Spanplatten NA Arezzo Walnut""}",20.0,27.0,20.0,27.0,20€ (VB) / Stück,27 Stück verfügbar,0.0,,['https://restado.de/wp-content/uploads/products/2022/05/c97cc25e-kh9ee2lu.jpeg'],Wood decor chipboard Arezzo Walnut Star Favorit,Walnut,Wood chips,Pr_45_31_63_97,Furnishings,Furnishings,Furnishings,,0.0
2861,2861,93366,https://restado.de/baustoff/holzverkleidung-weinkeller/,Holzverkleidung Weinkeller,Innenausbau,Sonstiges,2023-01-09,,Holzverkleidung für einen Weinkeller,Gebraucht,250€ (VB) / Stück,4 Stück verfügbar,(1 Stück Mindestabnahme),D-80797 Munich,Unbekannt,"{""Produkt"": ""Holzverkleidung Weinkeller""}",250.0,4.0,250.0,4.0,250€ (VB) / Stück,4 Stück verfügbar,0.0,,['https://restado.de/wp-content/uploads/products/2022/03/ccdb553b-img_2643-scaled.jpg'],Wood paneling wine cellar,Spandrel glass,Decorative timber panels,Pr_25_71_57_24,Furnishings,Furnishings,Glass blocks and panels,,0.0
2866,2866,91163,https://restado.de/baustoff/antike-eichenstuehle-17-stueck/,Antike Eichenstühle 17 Stück,Innenausbau,Sonstiges,2023-01-09,,"Scheunenfund: 17 Stück antike Holzstühle aus Eiche. Guter Zustand - stabile Verbindungen - Sitzpolster müssten erneuert und das Holz gereinigt werden. Der Einzelstuhl auf dem Foto ist bereis gereinigt. Nur Abholung, bzw. Versand auf Anfrage. Preis pro Stück 18 EUR. TEL 00352 621 551 207",Gebraucht,306€ (VB) Paketpreis,17 Stück verfügbar,(17 Stück Mindestabnahme),D-54298 Igel,,"{""Produkt"": ""Holzstuhl""}",306.0,17.0,306.0,17.0,306€ (VB) Paketpreis,17 Stück verfügbar,0.0,,"['https://restado.de/wp-content/uploads/products/2022/02/8deae1cb-47aa5700-f5fd-4fbe-bb5c-48908de41d6e-scaled.jpeg', 'https://restado.de/wp-content/uploads/products/2022/02/ff00120b-8661b97f-a28e-471e-afc6-a47460c33adc-scaled.jpeg', 'https://restado.de/wp-content/uploads/products/2022/02/1fb2250b-df53ab4d-b0f9-4b1a-8e06-b38fbe982dd6-scaled.jpeg']",Antique oak chairs pieces,European oak,Dining chairs,Pr_40_50_12_22,Furnishings,Furnishings,Furnishings,,0.0
2867,2867,89166,https://restado.de/baustoff/steckregale-metall/,Steckregale Metall,Innenausbau,Sonstiges,2023-01-09,1692576000000.0,"600xSpanplatten (Regalflächen) Höhe:890 mm Breite:440 mm  55xSteckregal Verbindungsglied klein Höhe: 900 mm  55xSteckregal Verbindungsglied groß Höhe: 1190 mm  126xSteckregal Seitenmodul Höhe:900 mm Tiefe: 35 mm Breite: 450 mm  Angaben gemäß § 5 TMG: Concular UG (haftungsbeschränkt),  Sattelstraße 38b, 70327 Stuttgart  Geschäftsführer: Dominik Campanella, Julius Schäufele",Neuwertig,20€ (VB) / Stück,63 Stück verfügbar,(1 Stück Mindestabnahme),D-14055 Berlin,,{},20.0,63.0,20.0,63.0,20€ (VB) / Stück,63 Stück verfügbar,1.0,19353600000.0,,Metal shelves,Metal,Shelves,Pr_40_30_78_78,Furnishings,Furnishings,Furnishings,224.0,0.0
2871,2871,85263,https://restado.de/baustoff/ca-12-tonnen-bueromoebel-rollcontainer-schreibtische-und-schraenke/,"Ca. 12 Tonnen Büromöbel (Rollcontainer, Schreibtische und Schrän…",Innenausbau,Sonstiges,2023-01-09,, ,Gebraucht,6.000€ (VB) Paketpreis,12 Tonnen verfügbar,(12 Tonnen Mindestabnahme),D-72770 Reutlingen,,{},6000.0,12.0,6000.0,12.0,6.000€ (VB) Paketpreis,12 Tonnen verfügbar,0.0,,,"Approximately tons of office furniture roll containers , desks and cabinets…",Rolled glass,Office desks,Pr_40_50_21_59,Furnishings,Furnishings,Furnishings,,0.0
2875,2875,84877,https://restado.de/baustoff/massivholz-bretter-von-schrank/,Massivholz Bretter von Schrank,Innenausbau,Sonstiges,2023-01-09,, ,Gebraucht,22€ (VB) Paketpreis,22 Stück verfügbar,(22 Stück Mindestabnahme),D-26209 Hatten,Danmöbel Massivholzschrank,"{""Produkt"": ""Diverse Bretter""}",22.0,22.0,22.0,22.0,22€ (VB) Paketpreis,22 Stück verfügbar,0.0,,['https://restado.de/wp-content/uploads/products/2021/10/3beb0549-img_20211026_113754-scaled.jpg'],Solid wood boards of cupboard,Wood,Cupboards,Pr_40_30_87_20,Furnishings,Furnishings,Furnishings,,0.0
2883,2883,80883,https://restado.de/baustoff/einbaukueche/,"Einbauküchen, verschiedene Maße",Innenausbau,Sonstiges,2023-01-09,,"5 Einbauküchen mit unterschiedlichen Maßen Bauart gleich. Arbeitsplatte: Spanplatte mit Holzdekor inkl. Spühlmaschine/Kühlschrank  1) 1860x620 x900 mm Geschirrspüler Siemens und Amica Kühlschränke ( hxtxb: 1440x560x545mm), Hängeschränke: 695mm hoch, 375mm tief, 1193mm lang  4x 2) 2470x620x900 mm Zusatzinformationen Spülmaschine und Kühlschrank inkl. (ohne technische Informationen), Hängeschränke 375mm tief 700mm hoch 1790mm breit  ",Gebraucht,600€ (VB) / Stück,5 Stück verfügbar,(1 Stück Mindestabnahme),D-40213 Düsseldorf,,"{""Produkt"": ""Einbauküche""}",600.0,5.0,600.0,5.0,600€ (VB) / Stück,5 Stück verfügbar,0.0,,"['https://restado.de/wp-content/uploads/products/2021/08/99b3395e-küche-scaled.jpg', 'https://restado.de/wp-content/uploads/products/2021/08/0d1afa9e-küche6-scaled.jpg', 'https://restado.de/wp-content/uploads/products/2021/08/8a0c7831-küche4-scaled.jpg']","Fitted kitchens , various dimensions",Architectural glass,Floor-standing kitchen cupboards,Pr_40_30_87_31,Furnishings,Furnishings,Furnishings,,0.0
