,Nr,URL,Title,Category,Subcategory,Saved,LastUpOn,Description,Zustand,FirstPrice,FirstAvailable,MinAmount,Location,Hersteller,Properties,FirstPriceNumeric,FirstAvailableNumeric,LastPriceNumeric,LastAvailableNumeric,LastPrice,LastAvailable,Sold,SoldAfter,Imagefile,material_emb,German_Raw,German_Code,first_level,second_level,third_level,SoldAfterDays,StockChange
1565,3258,https://restado.de/baustoff/osb3-verlegeplatten-dicke-18-mm-mit-nut-und-feder-plattengre-2-500-x-675-mm-grundpreis-qm-500-eur/,Verlegeplatten Dicke mm mit Nut und Feder,Dach,Konstruktiver Holzbau,2023-01-09,,"Alle Materialien sind in einwandfreiem Zustand. Transportbedingte kleine Schäden nicht ausgeschlossen.  Details:  OSB-3/EN300 Verlegeplatten 18x675x2500mm = 1,69qm insgesamt 21,94qm bzw. 13 Stück   Gerne können auch einzelne Posten abgenommen werden. Abtransport ist selber zu organisieren, ich befördere die Materialien lediglich an den Bordstein zum Abtransport.  Am besten einfach anrufen",Neu,"8,50€ (VB) / Stück",13 Stück verfügbar,(1 Stück Mindestabnahme),Neu,,{},8.5,13.0,8.5,13.0,"8,50€ (VB) / Stück",13 Stück verfügbar,0.0,,[],Ceramic,Formwork props,Pr_20_85_86_30,Structural elements,"Blocks, Panels, Fences, Bricks",Prefabricated buildings and structures,,0.0
1603,126465,https://restado.de/baustoff/altholz-von-abriss-2/,Altholz von Abriss,Dach,Konstruktiver Holzbau,2023-04-19,1687046400000.0,,,,,,,,{},0.0,0.0,0.0,0.0,,,1.0,5184000000.0,"['https://restado.de/wp-content/uploads/products/2023/05/350db118-img_1138.jpg', 'https://restado.de/wp-content/uploads/products/2023/05/34ecc66a-img_1151.jpg', 'https://restado.de/wp-content/uploads/products/2023/05/0d766c77-img_1167.jpg', 'https://restado.de/wp-content/uploads/products/2023/05/ad00a652-img_1137.jpg']",Ceramic,Formwork props,Pr_20_85_86_30,Structural elements,"Blocks, Panels, Fences, Bricks",Prefabricated buildings and structures,60.0,0.0
1604,126142,https://restado.de/baustoff/altholz-von-abriss/,Altholz von Abriss,Dach,Konstruktiver Holzbau,2023-04-05,,,,,,,,,{},0.0,0.0,0.0,0.0,,,0.0,,"['https://restado.de/wp-content/uploads/products/2023/05/5c176041-img_1140.jpg', 'https://restado.de/wp-content/uploads/products/2023/05/d664e718-img_1112.jpg', 'https://restado.de/wp-content/uploads/products/2023/05/d65db89b-img_1139.jpg', 'https://restado.de/wp-content/uploads/products/2023/05/2aef665a-img_1133-1-rotated.jpg', 'https://restado.de/wp-content/uploads/products/2023/05/79e32248-img_1154-rotated.jpg', 'https://restado.de/wp-content/uploads/products/2023/05/a46d8bab-img_1136.jpg', 'https://restado.de/wp-content/uploads/products/2023/05/56fccdaa-img_1135.jpg', 'https://restado.de/wp-content/uploads/products/2023/05/febb41db-img_1160.jpg', 'https://restado.de/wp-content/uploads/products/2023/05/82c0264f-img_1159-rotated.jpg', 'https://restado.de/wp-content/uploads/products/2023/05/51fc58cc-img_1111.jpg']",Ceramic,Formwork props,Pr_20_85_86_30,Structural elements,"Blocks, Panels, Fences, Bricks",Prefabricated buildings and structures,,0.0
3562,129118,https://restado.de/baustoff/osb-3-platten/,OSB/-Platten,Dach,Konstruktiver Holzbau,2023-07-23,,"OSB/3-Platten, 22 mm Stark, 625x2500 mm Abmessung, Nut und Feder, Neuware",Neu,15€ (VB) / Stück,,(1 Stück Mindestabnahme),D-76646 Bruchsal,,{},15.0,,15.0,,,,0.0,,['https://restado.de/wp-content/uploads/products/2023/06/2d7352f5-image_a4d3e935-d2f7-4d99-bccd-39113dc4017b.jpg'],Ceramic,Formwork props,Pr_20_85_86_30,Structural elements,"Blocks, Panels, Fences, Bricks",Prefabricated buildings and structures,,
3786,130977,https://restado.de/baustoff/alter-holzdachstuhl/,alter Holzdachstuhl,Dach,Konstruktiver Holzbau,2023-09-27,,Der komplette Dachstuhl ist für die Abgabe gedacht. Möchte jemand den ganzen Dachstuhl und kann ihn abbauen so bekommt dieser das Holz für 10€ das Stück,Gebraucht,3.000€ (VB) Paketpreis,,"(inkl. 19% MwSt., falls anwendbar)",D-67105 Schifferstadt,Eichenbalken als Vollholz,{},3000.0,,3000.0,,,,0.0,,['https://restado.de/wp-content/uploads/products/2023/07/2a5e0b37-20230719_141415-scaled.jpg'],Ceramic,Formwork props,Pr_20_85_86_30,Structural elements,"Blocks, Panels, Fences, Bricks",Prefabricated buildings and structures,,
