,Unnamed: 0,Nr,URL,Title,Category,Subcategory,Saved,LastUpOn,Description,Zustand,FirstPrice,FirstAvailable,MinAmount,Location,Hersteller,Properties,FirstPriceNumeric,FirstAvailableNumeric,LastPriceNumeric,LastAvailableNumeric,LastPrice,LastAvailable,Sold,SoldAfter,Imagefile,Title_en,material_emb,German_Raw,German_Code,first_level,second_level,third_level,SoldAfterDays,StockChange
490,490,64766,https://restado.de/baustoff/roto-rollladen-mit-kurbel-zro-r6-r8-09-11m-anthrazit/,"Roto Rollladen mit Kurbel ZRO R6/R8 09/11M, anthrazit",Fenster,Dachfenster,2023-01-09,1675555200000.0, ,Neu,170€ / Stück,1 Stück verfügbar,(1 Stück Mindestabnahme),D-93326 Abensberg,Roto,{},170.0,1.0,170.0,1.0,170€ / Stück,1 Stück verfügbar,1.0,2332800000.0,['https://restado.de/wp-content/uploads/products/2020/11/e8d32b6a-rotozrot6_r8-09_11m-scaled.jpg'],"Roto roller shutter with crank , anthracite",Anthracite,Roller shutters,Pr_30_59_84_73,Other,Other,Other,27.0,0.0
530,530,120115,https://restado.de/baustoff/drutex-fenster-ink-aufsatz-rollladen/,Drutex Fenster ink. Aufsatz Rollladen,Fenster,Aussenfenster,2023-01-09,1677369600000.0,Verkaufen wie neu Fenster    Auch andere Maßen vorhanden  Bei Interesse bitte melden,Neuwertig,400€ (VB) / Stück,8 Stück verfügbar,(1 Stück Mindestabnahme),D-40880 Ratingen,Drutex,"{""Farbe Fensterflügel"": ""Weiss"", ""Verglasungs-Art"": ""3-fach"", ""Ausführung"": ""1-flügelig"", ""Farbe Fensterrahmen"": ""Weiss"", ""U-Wert"": ""0,73-0,77 w/m2k""}",400.0,8.0,400.0,8.0,400€ (VB) / Stück,8 Stück verfügbar,1.0,4147200000.0,"['https://restado.de/wp-content/uploads/products/2023/02/e7c73b65-3c25165b-ecea-4688-9a17-be8dcc3fe006.png', 'https://restado.de/wp-content/uploads/products/2023/02/57191d0a-7f34fdb8-8a91-4e45-a060-3957e4a92415-scaled.jpeg', 'https://restado.de/wp-content/uploads/products/2023/02/b1c46ffd-580ae2be-3f9a-4485-85eb-53051b0da6a4.png']",Drutex window incl . Roller shutter attachment,Polypropylene (PP),Roller shutters,Pr_30_59_84_73,Other,Other,Other,48.0,0.0
533,533,119884,https://restado.de/baustoff/fenster-pvc-festverglasung-inkl-rollladen-218-x-206/,"Fenster PVC Festverglasung inkl. Rollladen 2,18 x 2,06",Fenster,Aussenfenster,2023-01-09,1677974400000.0, ,Neu,25€ (VB) / Stück,1 Stück verfügbar,(1 Stück Mindestabnahme),D-53111 Bonn,Saint Gobain,"{""Anschlag"": ""fest"", ""Element-Breite"": ""2,16"", ""Element-Höhe"": ""2,06"", ""Material Fensterflügel"": ""Kunststoff"", ""Farbe Fensterflügel"": ""weiß"", ""Verglasungs-Art"": ""2-fach"", ""Öffnungsart"": ""fest"", ""Ausführung"": ""fest"", ""Material Fensterrahmen"": ""Kunststoff"", ""Farbe Fensterrahmen"": ""weiß"", ""U-Wert"": ""1,3""}",25.0,1.0,25.0,1.0,25€ (VB) / Stück,1 Stück verfügbar,1.0,4752000000.0,['https://restado.de/wp-content/uploads/products/2023/02/b8abda8e-23-01-18-1.jpg'],Window fixed glazing including roller shutters . x .,Mosaic glass,Roller shutters,Pr_30_59_84_73,Other,Other,Other,55.0,0.0
803,803,54541,https://restado.de/baustoff/koemmerling-fenster-neu-auf-wunsch-mit-rlladenkadten/,Kömmerling Fenster neu auf Wunsch Mit Rolladenkasten,Fenster,Aussenfenster,2023-01-09,1675641600000.0,"Verkaufen neues Fenster, leider falsch bestellt. 3 fach verglast.  Mit Rollladenkasten (noch nicht endmontiert).  Fenster auf Wunsch Ohne Rolladenkasten Verkaufbar mit etwas reduziertem Preis",Neu,1.000€ (VB) / Stück,1 Stück verfügbar,(1 Stück Mindestabnahme),D-21614 Buxtehude,Kömmerling,"{""Anschlag"": ""DIN Links"", ""Element-Breite"": ""1,01 m"", ""Material Fensterflügel"": ""Kunststoff"", ""Farbe Fensterflügel"": ""Weiß"", ""Verglasungs-Art"": ""3-fach"", ""Öffnungsart"": ""Dreh-/Kippflügel"", ""Ausführung"": ""1-flügelig"", ""Material Fensterrahmen"": ""Kunststoff"", ""Farbe Fensterrahmen"": ""Weiß""}",1000.0,1.0,1000.0,1.0,1.000€ (VB) / Stück,1 Stück verfügbar,1.0,2419200000.0,['https://restado.de/wp-content/uploads/products/2020/06/fb1601e7-img_20200605_084314-scaled.jpg'],New Kömmerling window with roller shutter box on request,Mosaic glass,Roller shutters,Pr_30_59_84_73,Other,Other,Other,28.0,0.0
829,829,33992,https://restado.de/baustoff/komplettes-set-fenster-mit-tlw-aufsatzrollaeden-und-terrassentueren/,"Neues, komplettes Set ( Fenster - mit tlw Aufsatzrolläden - und Te…",Fenster,Aussenfenster,2023-01-09,1678147200000.0,"Verkaufen insgesamt 59 Elemente (Fenster und Terassentüren). Eine genaue Auflistung, sowie Daten im beigefügten PDF  Die Fenster sind aktuell gelagert in einem LKW-Auflieger eines Spediteurs in 2821 Walpersbach.  Die Fenster können auch direkt durch den Spediteur auf eine Baustelle geliefert oder alternativ dort abgeholt werden.  Das komplette Set hat einen Einkaufswert von EUR 15.000 exkl. USt.  Abholung und Lieferung durch Vorrauskasse.",Neu,14.986€ (VB) Paketpreis,59 Stück verfügbar,(59 Stück Mindestabnahme),AT-2821 Lanzenkirchen,WindowStar,"{""Anschlag"": ""DIN Rechts und DIN Links"", ""Element-Breite"": ""Unterschiedlich"", ""Öffnungsart"": ""verschiedene Öffnungsarten"", ""Ausführung"": ""mehrere Ausführungen""}",14986.0,59.0,14986.0,59.0,14.986€ (VB) Paketpreis,59 Stück verfügbar,1.0,4924800000.0,[],"New , complete set window - with some top roller shutters - and part…",Mosaic glass,Roller shutters,Pr_30_59_84_73,Other,"Door, Windows, Gates",Glass blocks and panels,57.0,0.0
