,Unnamed: 0,Nr,URL,Title,Category,Subcategory,Saved,LastUpOn,Description,Zustand,FirstPrice,FirstAvailable,MinAmount,Location,Hersteller,Properties,FirstPriceNumeric,FirstAvailableNumeric,LastPriceNumeric,LastAvailableNumeric,LastPrice,LastAvailable,Sold,SoldAfter,Imagefile,Title_en,material_emb,German_Raw,German_Code,first_level,second_level,third_level,SoldAfterDays,StockChange
1891,1891,63327,https://restado.de/baustoff/kronleuchter-recycelt-2/,"Kronleuchter, recycelt",Haustechnik & Sanitär,Elektroarbeiten,2023-01-09,1684713600000.0,"Wunderschöner Deckenleuchter als massiver Messingring (1,8/0.8cm), mit 6 aufgesetzten Fassungen (E-27) auf kleinen Messing-Tellern und im Inneren des Rings findet sich ein unaufgeregter Schmuck -als gewelltes Messingband. Und weil die Tüllen fehlten, haben wir von der Glasmanufaktur Irene Borgardt/Buntentor neue anfertigen lassen. Dabei handelt es sich um sogenante ""Erlenmeyer-Kolben"" aus dem Laborbedarf. Die Böden hat sie herausgetrennt, die Ränder sind feuerpoliert und der ganze Kolben ist gesandstrahlt! Diese Kolben passen -unserem Gestaltungsempfinden nach- sehr gut in Größe und Farbton zu dem schönen Stück Leuchtenhandwerk und stammen auch noch aus der Wiederverwendung! D.h. passt alles. Die E-Leitungen sollten jedoch erneuert werden, die Pendelstange misst z.Zt. 120cm, könnte auch gekürzt werden.  Material: Messing Farbe: natur Baujahr: 1930 Höhe: 120,00 cm Gewicht: 6,00 kg  Durchmesser:: 68,00cm Lieferung nach Absprache.",Neuwertig,280€ / Stück,1 Stück verfügbar,(1 Stück Mindestabnahme),D-28217 Bremen,,{},280.0,1.0,280.0,1.0,280€ / Stück,1 Stück verfügbar,1.0,11491200000.0,,"Chandelier , recycled",Lignite,Chandeliers,Pr_70_70_48_13,Furnishings,"Floors, Ceiling",Furnishings,133.0,0.0
1893,1893,63325,https://restado.de/baustoff/kronleuchter-recycelt/,"Kronleuchter, recycelt",Haustechnik & Sanitär,Elektroarbeiten,2023-01-09,1682553600000.0,"Einem mehrarmiger Deckenleuchter, der handwerklich sehr hochwertig hergestellt ist, allerdings bzgl. der Gestaltung nicht so wirklich zeitlos gelungen ist, wurde ein neues Leben eingehaucht: Statt Glühbirnen oder auch Energiesparlampen spenden jetzt Kerzen einige LUXeinheiten und der Design-Kick sind die gläsernen Tüllen, die von der Glasmanufaktur Irene Borgardt aus dem Buntentor aus der klassischen Mineralwasserflasche gesägt und entgratet hat. Also nix Spermüll sondern sinnvolle, lichtspendende Wiederverwendung!  Material: Messing,Glas Farbe: natur,farblos Baujahr: 1980 Höhe: 80,00 cm Gewicht: 5,00 kg  Durchmesser:: 77,00cm Lieferung nach Absprache.",Neuwertig,90€ / Stück,1 Stück verfügbar,(1 Stück Mindestabnahme),D-28217 Bremen,,{},90.0,1.0,90.0,1.0,90€ / Stück,1 Stück verfügbar,1.0,9331200000.0,,"Chandelier , recycled",Lignite,Chandeliers,Pr_70_70_48_13,Furnishings,"Floors, Ceiling",Furnishings,108.0,0.0
1894,1894,63323,https://restado.de/baustoff/kronleuchter/,Kronleuchter,Haustechnik & Sanitär,Elektroarbeiten,2023-03-13,1687996800000.0,"Dieser acht-armige Kronleuchter besticht durch sein klassisches und trotzdem verspieltes design. Die Halterungen für die Glühbirnen sehen von weitem aus wie echte Kerzen.  Material: Stahl Farbe: silber/weiß Höhe: 47,00 cm Gewicht: 5,00 kg  Durchmesser:: 67,00cm Lieferung nach Absprache.",Neuwertig,90€ / Stück,1 Stück verfügbar,(1 Stück Mindestabnahme),D-28217 Bremen,,{},90.0,1.0,90.0,1.0,90€ / Stück,1 Stück verfügbar,1.0,9331200000.0,,chandelier,Crystal glass,Chandeliers,Pr_70_70_48_13,Furnishings,"Floors, Ceiling",Furnishings,108.0,0.0
1899,1899,63341,https://restado.de/baustoff/leuchter/,Leuchter,Haustechnik & Sanitär,Elektroarbeiten,2023-01-09,1684281600000.0,"Dieser antike Leuchter hat 8 Arme und einen doppelköpfigen Adler an der Aufhängung.  Material: messing Farbe: messing Gewicht: 4,00 kg  Durchmesser:: 70,00cm Lieferung nach Absprache.",Neuwertig,80€ / Gesamt,1 Gesamt verfügbar,(1 Gesamt Mindestabnahme),D-28217 Bremen,,{},80.0,1.0,80.0,1.0,80€ / Gesamt,1 Gesamt verfügbar,1.0,11059200000.0,,chandelier,Crystal glass,Chandeliers,Pr_70_70_48_13,Furnishings,"Floors, Ceiling",Furnishings,128.0,0.0
3452,3452,126838,https://restado.de/baustoff/whirlwanne-villeroy-boch/,Whirlwanne Villeroy & Boch,Haustechnik & Sanitär,Sanitär,2023-05-05,,,,,,,,,,,,,,,,0.0,,['https://restado.de/wp-content/uploads/products/2023/05/fbcaac57-img-20230527-wa0010.jpg'],Whirlwanne Villeroy & Boch,Wychert,Chandeliers,Pr_70_70_48_13,Other,Other,Other,,
