,Unnamed: 0,Nr,URL,Title,Category,Subcategory,Saved,LastUpOn,Description,Zustand,FirstPrice,FirstAvailable,MinAmount,Location,Hersteller,Properties,FirstPriceNumeric,FirstAvailableNumeric,LastPriceNumeric,LastAvailableNumeric,LastPrice,LastAvailable,Sold,SoldAfter,Imagefile,Title_en,material_emb,German_Raw,German_Code,first_level,second_level,third_level,SoldAfterDays,StockChange
882,882,7835,https://restado.de/baustoff/holzfenster-eiche-gelt/,"Holzfenster, Eiche geölt",Fenster,Aussenfenster,2023-01-09,1676160000000.0,"Holzfenster, Eiche geölt, 1m x 1,25m, 1.flg Wegen Umbau verkaufen wir ein 5 Jahre altes Holzfenster in tadellosem Zustand inklusive Rahmen.  Details: Maße: 1,0m x 1,25m Stärke: 68mm Lackierung: nach RAL Wärmeschutz: Isolierglas Ug 1.1 Material: Eiche, geölt Neupreis: 1.500 Euro VHB: 325 Euro Selbstabholung (Ein zweites Fenster mit den Maßen 1,0m x 1,0m wird in einem weiteren parallel laufenden Angebot angeboten)",Neuwertig,325€ / Stück,1 Stück verfügbar,(inkl. 19% MwSt.),Neuwertig,,{},325.0,1.0,325.0,1.0,325€ / Stück,1 Stück verfügbar,1.0,2937600000.0,[],"Wooden windows , oiled oak",European oak,Wood oils,Pr_35_31_95_97,Furnishings,Furnishings,Glass blocks and panels,34.0,0.0
883,883,7829,https://restado.de/baustoff/holzfenster-3/,"Holzfenster, Eiche geölt",Fenster,Aussenfenster,2023-01-09,1677196800000.0,"Holzfenster, Eiche geölt, 1m x 1m, 1 flg. Wegen Umbau verkaufen wir ein 5 Jahre altes Holzfenster in tadellosem Zustand inklusive Rahmen.  Details: Maße: 1,0m x 1,0m Stärke: 68mm Lackierung: nach RAL Wärmeschutz: Isolierglas Ug 1.1 Material: Eiche, geölt Neupreis: 1.400 Euro VHB: 300 Euro Selbstabholung  (Ein zweites Fenster mit den Maßen 1,0m x 1,25m wird in einem weiteren parallel laufenden Angebot angeboten)",Neuwertig,300€ / Stück,1 Stück verfügbar,(1 Stück Mindestabnahme),Neuwertig,,{},300.0,1.0,300.0,1.0,300€ / Stück,1 Stück verfügbar,1.0,3974400000.0,[],"Wooden windows , oiled oak",European oak,Wood oils,Pr_35_31_95_97,Furnishings,Furnishings,Glass blocks and panels,46.0,0.0
2536,2536,92865,https://restado.de/baustoff/ziro-eiche-colorado-angeraeuchert-handgehobelt-geoelt/,Ziro: Eiche Colorado (angeräuchert) handgehobelt geölt,Innenausbau,Parkett,2023-01-09,,"Original verpackt: 18 VPE = 50,58 m² 1-Stab Landhausdielen mit 15 mm Gesamtstärke Ziro Casella SL Eiche Colorado (angeräuchert) handgehobelt geölt Kantenbeschaffenheit: Fase (4-seitig) Materialstärke: 15 mm Nutzschicht: 4,00 mm Breite: 189 mm Länge: 1860 mm Paketinhalt: 2,812 m²/Packung Warmwasser Fußbodenheizung: geeignet bis max. 27°C Feuchtraumeignung: Nein",Neu,"60,95€ (VB) / m²",50 m² verfügbar,(3 m² Mindestabnahme),D-12099 Berlin,,{},60.95,50.0,60.95,50.0,"60,95€ (VB) / m²",50 m² verfügbar,0.0,,['https://restado.de/wp-content/uploads/products/2022/03/b9d8991b-57-3.jpg'],"Ziro : Colorado oak smoked , hand planed and oiled",American white oak,Wood oils,Pr_35_31_95_97,Other,Other,Other,,0.0
3418,3418,123342,https://restado.de/baustoff/bauwerk-formpark-rombico-eiche-geoelt/,Bauwerk - Formpark Rombico Eiche geölt,Innenausbau,Parkett,2023-08-05,,"Hochwertiges Eichen Parkett geölt von Bauwerk Insgesamt 151 qm, lagernd und sofort verfügbar.  Formpark Rombico Eiche 14 Farbe: Mandorla, gebürstet, naturgeölt Maße: 735 x 130 x 9,5 mm  Preis netto beträgt 125.- €/qm. Sie sparen 43.-€/qm zum momentanen Listenpreis lt. Hersteller.  https://www.bauwerk-parkett.com/ch-de/parkett-und-zubehoer/parkett/formpark/formpark-rombico.html",Neu,"148,75€ (VB) / m²",151 m² verfügbar,(20 m² Mindestabnahme),D-70736 Fellbach,,{},148.75,151.0,148.75,151.0,"148,75€ (VB) / m²",151 m² verfügbar,0.0,,"['https://restado.de/wp-content/uploads/products/2023/03/6bd2baef-mtex_med_88086.jpg', 'https://restado.de/wp-content/uploads/products/2023/03/b043a531-bildschirmfoto-2023-03-31-um-10.29.43.png', 'https://restado.de/wp-content/uploads/products/2023/03/c6f7f9b3-bildschirmfoto-2023-03-31-um-10.31.37.png']",Building - Formpark Rombico oiled oak,Oak,Wood oils,Pr_35_31_95_97,Other,Other,Other,,0.0
3460,3460,126719,https://restado.de/baustoff/parkett-eiche-lounge-unsichtbar-geoelt/,Parkett Eiche Lounge unsichtbar geölt,Innenausbau,Parkett,2023-05-12,,,,,,,,,,,,,,,,0.0,,[],Parquet oak lounge invisibly oiled,European oak,Wood oils,Pr_35_31_95_97,Other,Other,Other,,
3511,3511,128214,https://restado.de/baustoff/living-by-haro-fertigparkett-eiche-rustikal-geoelt/,Fertigparkett Eiche Vintage geölt,Innenausbau,Parkett,2023-07-06,1697760000000.0,,,,,,,,,,,,,,,1.0,9158400000.0,"['https://restado.de/wp-content/uploads/products/2023/06/701b04bc-33-copy.png', 'https://restado.de/wp-content/uploads/products/2023/06/8b4541f9-121-copy.png']",Ready-made oak vintage oiled parquet,European oak,Wood oils,Pr_35_31_95_97,Other,Other,Shaft-lining products,106.0,
3512,3512,128010,https://restado.de/baustoff/parkett-eiche-natur-geoelt/,"Parkett Eiche Natur, geölt",Innenausbau,Parkett,2023-06-05,1697673600000.0,,,,,,,,,,,,,,,1.0,11750400000.0,"['https://restado.de/wp-content/uploads/products/2023/06/6aa4dc2c-parkett_1-scaled.jpg', 'https://restado.de/wp-content/uploads/products/2023/06/84005f80-parkett_2-scaled.jpg']","Natural oak parquet , oiled",European oak,Wood oils,Pr_35_31_95_97,Furnishings,Furnishings,Furnishings,136.0,
3899,3899,137234,https://restado.de/baustoff/lalegno-parkett-eiche-geoelt-und-uv-versiegelt/,Lalegno Parkett Eiche geölt und UV versiegelt,Innenausbau,Trockenbau,2023-08-27,,"Verkaufe hier 50 m2 Fischgrät Parkett von der Firma Lalegno, das Parkett hatte einen Neupreis von 120€ pro Quadratmeter.  Das Parkett hat eine Nutzschicht von 4 mm, ist bereits geölt und UV versiegelt. Das bedeutet nur verkleben und hinlegen. Beim Abholen vom Parkett kann sich auch gerne ein Bild vor Ort gemacht werden, wie das ganze verlegt aussieht. Ihr findet aber auch auf dem letzten Bild einen Raum mit dem ausgelegten Parkett.  Gegen Aufpreis von 250€ kann das Parkett auch geliefert werden.",Neu,3.000€ (VB) Paketpreis,,"(inkl. 19% MwSt., falls anwendbar)",D-37412 Elbingerode,,{},3000.0,,3000.0,,,,0.0,,"['https://restado.de/wp-content/uploads/products/2023/10/0b3e1799-3403-4193-969d-57e6f95bc6a0-450x448.webp', 'https://restado.de/wp-content/uploads/products/2023/10/bf633baf-5d94-455a-85fd-3b9ea6e0c844-448x450.webp']",Lalegno parquet oak oiled and sealed,French oak,Wood oils,Pr_35_31_95_97,Other,Other,Other,,
