,Unnamed: 0,Nr,URL,Title,Category,Subcategory,Saved,LastUpOn,Description,Zustand,FirstPrice,FirstAvailable,MinAmount,Location,Hersteller,Properties,FirstPriceNumeric,FirstAvailableNumeric,LastPriceNumeric,LastAvailableNumeric,LastPrice,LastAvailable,Sold,SoldAfter,Imagefile,Title_en,material_emb,German_Raw,German_Code,first_level,second_level,third_level,SoldAfterDays,StockChange
2328,2328,5618,https://restado.de/baustoff/handlauf-fuer-gelaender-holz-fuer-moebelbau-kerzenstaender-upcycling/,"Handlauf für Geländer, Holz für Möbelbau, Kerzenständer, Upcyc…",Rohbau,Sonstiges,2023-01-09,,"Die Multplex-Platten hatten eine Stärke von 90 mm. Daraus wurden die Handläufe geformt. Sie eignen sich für die Weiterverwendung als Handlauf und weitere Zwecke, z.B. Möbelbau, Upcycling - oder eine Serienproduktion für Kerzenständer. 7 Handläufe: 219 x 9 cm 8 Handläufe 142 x 9 cm Weitere Details siehe Foto oder Besichtigung in der Bauteilbörse Hannover. Der Preis von 9 Euro bezieht sich auf den Stückpreis. Bei Abnahme der Gesamtmenge erhalten Sie ein individuelles Angebot. Breite:    Höhe:    Länge/Tiefe:    Gewicht / Stk.:    Baujahr:   Material:  Buche-Multiplex Farbe:  hellbraun/Buche Verfügbar ab: sofort", gut,135€ Paketpreis,15 Stk. verfügbar,(15 Stk. Mindestabnahme),gut,,{},135.0,15.0,135.0,15.0,135€ Paketpreis,15 Stk. verfügbar,0.0,,[],"Handrail for railings , wood for furniture construction , candlestick , upcyc ...",Wood,Wood handrails,Pr_25_30_36_96,"Roof, Slabs, Stairs","Blocks, Panels, Fences, Bricks",Handrails,,0.0
2724,2724,61423,https://restado.de/baustoff/gelaender-staketen-gedrechselte-holzstangen/,"Geländer Staketen, gedrechselte Holzstangen",Innenausbau,Innentreppen,2023-01-09,1682726400000.0, ,Gebraucht,10€ (VB) / Stück,16 Stück verfügbar,(2 Stück Mindestabnahme),D-72488 Sigmaringen,,"{""Material Geländer"": ""Holz"", ""Material Handlauf"": ""Holz""}",10.0,16.0,10.0,16.0,10€ (VB) / Stück,16 Stück verfügbar,1.0,9504000000.0,['https://restado.de/wp-content/uploads/products/2020/10/6c5b19ce-img_21801-scaled.jpg'],"Railing stakes , turned wooden poles",Wood,Wood handrails,Pr_25_30_36_96,"Roof, Slabs, Stairs","Blocks, Panels, Fences, Bricks",Handrails,110.0,0.0
3120,3120,65294,https://restado.de/baustoff/balkongelaender/,Balkongeländer,Garten & Freianlagen,Zaun & Mauersysteme,2023-06-23,1697328000000.0,"Ein historisches, geschwungenes Balkongeländer mit Blumenkasten aus genietetem Flachstahl, 27mm, der Brüstungwinkel mißt 30x30mm, sonstige Maße: geschwungen 213 cm, gerade 100, Gesamtbreite: 313cm, Tiefe:50cm. Maß des umlaufenden Blumenkasten beträgt ca 20x20cm.  Material: Metall Farbe: silbergrau Baujahr: 1910 Höhe: 77,00 cm Breite: 313,00 cm Länge/Tiefe: 3,00 cm Gewicht: 55,00 kg  Lieferung nach Absprache.",Neuwertig,180€ / Stück,1 Stück verfügbar,(1 Stück Mindestabnahme),D-28217 Bremen,,{},180.0,1.0,180.0,1.0,180€ / Stück,1 Stück verfügbar,1.0,9849600000.0,['https://restado.de/wp-content/uploads/products/2020/04/58f2dddc-img-20200416-wa0005.jpg.webp'],Balcony railing,Prismatic glass,Wood handrails,Pr_25_30_36_96,"Roof, Slabs, Stairs","Blocks, Panels, Fences, Bricks",Handrails,114.0,0.0
3129,3129,65321,https://restado.de/baustoff/gelaenderstuecke/,Geländerstücke,Garten & Freianlagen,Zaun & Mauersysteme,2023-01-09,1683158400000.0,"Diese Geländerstücke stammen von einer Rollstuhlrampe aus einer Grundschule. Steigung ca. 6%. Der Handlauf ist leider nicht mehr erhalten, dafür aber die Pfosten samt Bolzen und Hutmuttern. Der Preis gilt für je 1 Teilstück mit 1 Pfosten. Geländerstücke und Pfosten stehen auf der Rampe, die Bolzen sind im Kabuff.  Material: Metall Farbe: grau Höhe: 74,00 cm Breite: 114,00 cm Gewicht: 10,00 kg  Lieferung nach Absprache.",Neuwertig,40€ / Stück,7 Stück verfügbar,(1 Stück Mindestabnahme),D-28217 Bremen,,{},40.0,7.0,40.0,7.0,40€ / Stück,7 Stück verfügbar,1.0,9936000000.0,,Railing pieces,Wood,Wood handrails,Pr_25_30_36_96,"Roof, Slabs, Stairs","Blocks, Panels, Fences, Bricks",Handrails,115.0,0.0
3214,3214,95263,https://restado.de/baustoff/holzbalkongelaender/,Holzbalkongeländer,Garten & Freianlagen,Sonstiges,2023-01-09,,"Holzbalkongeländer (Fichte/Tanne), guter Zustand, 8 Jahre alt, wegen grundlegendem Umbau zu verkaufen. Inkl. Befestigung (Holz) für Blumenkästen. Selbstabbau und Selbstabholung Neupreis 2014 1462,- € (siehe Datenblatt)",Gebraucht,640€ (VB) Paketpreis,8 lfm verfügbar,(8 lfm Mindestabnahme),D-04565 Regis-Breitingen,,{},640.0,8.0,640.0,8.0,640€ (VB) Paketpreis,8 lfm verfügbar,0.0,,"['https://restado.de/wp-content/uploads/products/2022/04/a121781c-holzbalkon1.jpg', 'https://restado.de/wp-content/uploads/products/2022/05/3c1ef3e2-holzbalkon5.jpg', 'https://restado.de/wp-content/uploads/products/2022/05/f77cf896-balkon_rechnung.jpg']",Wooden balcony railing,Wood,Wood handrails,Pr_25_30_36_96,"Roof, Slabs, Stairs","Blocks, Panels, Fences, Bricks",Handrails,,0.0
