,Unnamed: 0,Nr,URL,Title,Category,Subcategory,Saved,LastUpOn,Description,Zustand,FirstPrice,FirstAvailable,MinAmount,Location,Hersteller,Properties,FirstPriceNumeric,FirstAvailableNumeric,LastPriceNumeric,LastAvailableNumeric,LastPrice,LastAvailable,Sold,SoldAfter,Imagefile,Title_en,material_emb,German_Raw,German_Code,first_level,second_level,third_level,SoldAfterDays,StockChange
1064,1064,87401,https://restado.de/baustoff/terrassenplatten-von-kbh-delgado-greige-nunanciert-70x35cm-und-5cm-staerke-c-4qm-je-platte/,"Terrassenplatten von KBH, DELGADO greige nunanciert, 70x35cm und 5c…",Fliesen & Steine,Naturstein,2023-01-09,1678233600000.0,https://www.k-b-h.de/de/steine/produkte/terrassenplatten/delgado/kbh-feinoberflaeche/,Neu,45€ (VB) / Stück,9 Stück verfügbar,(1 Stück Mindestabnahme),D-82110 Germering,K-B-H,"{""Farbe"": ""greige-nunanciert"", ""Bezeichnung"": ""Beton"", ""Länge (cm)"": ""70"", ""Breite (cm)"": ""35"", ""Dicke (cm)"": ""5"", ""Oberfläche"": ""tellergestrahlt & gebürstet"", ""Serie"": ""DELGADO"", ""Kalibriert"": ""Ja""}",45.0,9.0,45.0,9.0,45€ (VB) / Stück,9 Stück verfügbar,1.0,5011200000.0,"['https://restado.de/wp-content/uploads/products/2021/12/a2586993-img_9222-scaled.jpg', 'https://restado.de/wp-content/uploads/products/2021/12/b18ffc6b-3b87-4aa2-8a11-b0af7f77b249.jpg', 'https://restado.de/wp-content/uploads/products/2021/12/4cfdd907-img_9221-scaled.jpg']","Terrace tiles from , greige nuanced , xcm and c…",Granite,Porcelain tiles,Pr_35_93_96_63,"Roof, Slabs, Stairs","Blocks, Panels, Fences, Bricks","Floor plates, gratings and edgings",58.0,0.0
1124,1124,69702,https://restado.de/baustoff/hochwertiger-marmor-marmorfliesen-light-emperador/,Hochwertiger Marmor-Marmorfliesen „Light Emperador“,Fliesen & Steine,Naturstein,2023-01-09,1676937600000.0,"Beste Qualität zum fairen Preis  Hochwertiger Marmor „Light Emperador“- Made in Spain  Farbe: Creme  Oberfläche: poliert  1. Wahl - Zertifiziert  Maße (cm): 60 cm x 30 cm x 2cm  Palette: 17,10 m² / 1 Tonne  Materialstärke: 2cm   Bitte geben Sie bei Anfragen Ihre Adresse mit an.  Haben Sie Fragen? Wir beraten Sie gern.",Neu,"93,40€ / m²",200 m² verfügbar,(1 m² Mindestabnahme),Neu,,{},93.4,200.0,93.4,200.0,"93,40€ / m²",200 m² verfügbar,1.0,3715200000.0,"['https://restado.de/wp-content/uploads/products/2021/02/bb061499-s-l1600-24.jpg', 'https://restado.de/wp-content/uploads/products/2021/02/789b5caf-s-l500-7.jpg']",High Quality “ Light Emperador ” Marble Marble Tiles,Marble,Porcelain tiles,Pr_35_93_96_63,Other,Other,Other,43.0,0.0
1198,1198,117534,https://restado.de/baustoff/wandfliese-tuerkis-glaenzend-6x24cm/,Wandfliese türkis glänzend 6x24cm,Fliesen & Steine,Fliesen,2023-01-09,,Ich biete hier Steinzeugfliesen im Format 6x24 in türkis glänzend an.   Es sind 3 qm vorhanden.  Bei Fragen bitte einfach melden.  https://www.fliesenprofi.de/wandfliesen/retro-vintage-wandfliesen/fliese-glasiert-unregelmaessige-oberflaeche-look-avio-tuerkis-glaenzend-6x24cm-ragno-by-marazzi,Neu,22€ / m²,3 m² verfügbar,(1 m² Mindestabnahme),D-04703 Leisnig,Ragno Marazzi,"{""Farbe"": ""türkis"", ""Länge (cm)"": ""24"", ""Breite (cm)"": ""6"", ""Serie"": ""Loo Avio""}",22.0,3.0,22.0,3.0,22€ / m²,3 m² verfügbar,0.0,,['https://restado.de/wp-content/uploads/products/2022/12/9996c3a7-img_4717-scaled.jpeg'],Wall tile turquoise glossy xcm,Porcelain,Porcelain tiles,Pr_35_93_96_63,Other,Other,Masonry walling units,,0.0
1202,1202,116589,https://restado.de/baustoff/feinsteinzeug-fliesen-2/,feinsteinzeug fliesen,Fliesen & Steine,Fliesen,2023-01-09,,"Überschussmenge aus einem grossen, hochpreisigen Bauprojekt: Sehr schöne Feinsteinzeug Fliesen, produziert in Italien, zertifiziert für Boden- und Wandanwendung. Angeboten werden 127m2 auf 2 Europaletten, lieferbar in ganz Deutschland oder Österreich. Lieferkosten können für Ihre Adresse individuell kalkuliert werden. Es wird nur die ganze Menge verkauft. (Grössere Menge eventuell auf Anfrage verfügbar.) ",Neu,1.778€ Paketpreis,127 m² verfügbar,(127 m² Mindestabnahme),AT-5101 Bergheim,,"{""Farbe"": ""Elfenbein / Silber"", ""Bezeichnung"": ""Feinsteinzeug"", ""Länge (cm)"": ""60"", ""Breite (cm)"": ""30"", ""Serie"": ""1A Ware"", ""Dicke (mm)"": ""6"", ""Rutschfestigkeitsklasse"": ""R10"", ""Wasseraufnahmevermögen"": ""> 0,1%"", ""Abriebfestigkeit"": ""4""}",1778.0,127.0,1778.0,127.0,1.778€ Paketpreis,127 m² verfügbar,0.0,,"['https://restado.de/wp-content/uploads/products/2022/11/ffc68d6b-strada_ig_6-scaled.jpg', 'https://restado.de/wp-content/uploads/products/2022/11/96276937-strada_ig_8-scaled.jpg']",porcelain stoneware tiles,Porcelain,Porcelain tiles,Pr_35_93_96_63,Other,Other,"Floor plates, gratings and edgings",,0.0
1221,1221,107431,https://restado.de/baustoff/historische-fliesen-salvador-dali-set-6-keramiken/,Historische Fliesen Salvador Dalí Set 6 Keramiken,Fliesen & Steine,Fliesen,2023-01-09,1689724800000.0,"Salvador Dalí Fliesen Keramiken La Suite Catalane. Die Herstellung der Dalí Keramik-Objekte bei EL SIGLO baut auf althergebrachten Traditionen auf, die im Laufe der Zeit weiterentwickelt und zu einem hohen Qualitätsniveau geführt wurden.  Die gereinigte Grundmasse wird portioniert und im Formrahmen auf das Objektformat ausgewalzt. Nach dem Trocknen erhält die Form ihren ersten Brand. Jetzt wird die Oberfläche mit einer Glasur überzogen, auf die nach dem Trocknen das Motiv von Hand übertragen wird. Nun erfolgt eine zweite Glasur, der sogenannte Glattbrand und die sorgfältige Kontrolle jedes einzelnen Stückes. Objekte, die den hohen Ansprüchen Dalís nicht genügten, wurden rigoros aussortiert und vernichtet. Jede Kacheln ist daher ein Einzelstück, da Farbe und Brenngrad sowie Fixierung durch Glasur jeweils individuell erfolgte und leichte exklusive Abweichungen daher jedes Kunstwerk einzigartig macht.   Ich verkaufe eine Holzkiste mit 6 Keramiken von Salvador Dalí von 1954 - seit über 65 Jahren ungeöffnet- verpackt in Holzwolle. Auf Wunsch bleibt die original Kiste verschlossen, ich kann dann nicht garantieren, dass alle Keramiken unbeschädigt sind.  Bei Übergabe kann die Kiste aber auch geöffnet und überprüft werden.   Privatverkauf, keine Garantie oder Gewährleistung!",Neuwertig,600€ (VB) / Stück,2 Stück verfügbar,(1 Stück Mindestabnahme),D-15754 Heidesee,EL SIGLO,"{""Bezeichnung"": ""Keramikfliese"", ""Länge (cm)"": ""20"", ""Breite (cm)"": ""20"", ""Dicke (cm)"": ""1""}",600.0,2.0,600.0,2.0,600€ (VB) / Stück,2 Stück verfügbar,1.0,16502400000.0,"['https://restado.de/wp-content/uploads/products/2022/06/f2a9790c-img_3200.jpg', 'https://restado.de/wp-content/uploads/products/2022/06/f2a9790c-img_3202.jpg', 'https://restado.de/wp-content/uploads/products/2023/07/19c3f32b-e817dee5-ad50-4d6d-99e4-f64e2e41fd7a-scaled.jpeg', 'https://restado.de/wp-content/uploads/products/2022/06/4e7c762f-img_3196.jpg', 'https://restado.de/wp-content/uploads/products/2022/06/42cd0e5d-img_3203.jpg', 'https://restado.de/wp-content/uploads/products/2022/06/4da5b3e0-img_3193.jpg', 'https://restado.de/wp-content/uploads/products/2022/06/26600101-img_3198.jpg', 'https://restado.de/wp-content/uploads/products/2023/07/b3d08dd1-4082f4e7-f4dc-43c5-a4d1-bc78a96422d0-scaled.jpeg']",Historical Tiles Salvador Dalí Set Ceramics,Porcelain,Porcelain tiles,Pr_35_93_96_63,Other,Other,Other,191.0,0.0
1237,1237,89392,https://restado.de/baustoff/feinsteinzeug-1m-x-1m-harzgewebebeschichtet-3mm/,Feinsteinzeug 1m x 1m Harzgewebebeschichtet 3mm,Fliesen & Steine,Fliesen,2023-01-09,,"Es gibt noch eine 2 die hat eine Beschädigung und wird für die hälfte verkauft, desweiteren gibt es zwei 3x1m Platten eine Beschädigt und eine in Ordnung",Neu,50€ (VB) / Stück,2 Stück verfügbar,(1 Stück Mindestabnahme),D-50968 Cologne,,"{""Farbe"": ""RAL 260 40 40 Königsblau"", ""Bezeichnung"": ""Feinsteinzeug"", ""Länge (cm)"": ""100"", ""Breite (cm)"": ""100"", ""Dicke (cm)"": ""0,3""}",50.0,2.0,50.0,2.0,50€ (VB) / Stück,2 Stück verfügbar,0.0,,['https://restado.de/wp-content/uploads/products/2022/01/4b82277b-whatsapp-image-2022-01-17-at-15.35.586.jpeg'],Porcelain stoneware m x m resin fabric coated mm,Porcelain,Porcelain tiles,Pr_35_93_96_63,Other,Other,Unit covering and finish products,,0.0
1243,1243,85021,https://restado.de/baustoff/feinsteinzeug-fliesen/,Feinsteinzeug Fliesen,Fliesen & Steine,Fliesen,2023-01-09,,"Restposten Angebote!!!  Verschiedene Formate, Muster sowie Farben. Italienische 1a Wahl.  Alle Fliesen auf Einkaufpreis!!!",Neu,10€ (VB) / m²,1.000 m² verfügbar,(1 m² Mindestabnahme),D-72770 Reutlingen,,"{""Farbe"": ""verschiedene"", ""Bezeichnung"": ""Feinsteinzeug"", ""Länge (cm)"": ""60, 75, 90, 120"", ""Breite (cm)"": ""30, 45, 60, 75, 120"", ""Dicke (mm)"": ""10, 11"", ""Rutschfestigkeitsklasse"": ""R10"", ""Wasseraufnahmevermögen"": ""1a""}",10.0,1000.0,10.0,1000.0,10€ (VB) / m²,1.000 m² verfügbar,0.0,,['https://restado.de/wp-content/uploads/products/2021/10/fd934dfb-whatsapp-image-2021-10-29-at-12.19.10-1.jpeg'],Porcelain stoneware tiles,Porcelain,Porcelain tiles,Pr_35_93_96_63,Other,Other,"Floor plates, gratings and edgings",,0.0
1253,1253,78777,https://restado.de/baustoff/porcelaingres-urban-2/,Porcelaingres Urban,Fliesen & Steine,Fliesen,2023-01-09,,Die Fliesen waren für unsere Terrasse gedacht. Aus Konstruktionsgründen sind wir nun aber auf Holz umgeschwenkt. Die Fliesen sind originalverpackt und auf Palette. Die Fliesen haben die gleiche Optik wie in die in unserer anderen Anzeige angebotenen Fliesen des Herstellers.,Neu,4.485€ Paketpreis,65 m² verfügbar,(65 m² Mindestabnahme),D-23684 Scharbeutz,Porcelaingres,"{""Farbe"": ""Anthrazit"", ""Bezeichnung"": ""Feinsteinzeug"", ""Länge (cm)"": ""60"", ""Breite (cm)"": ""60"", ""Serie"": ""Urban"", ""Dicke (mm)"": ""20"", ""Rutschfestigkeitsklasse"": ""R11""}",4485.0,65.0,4485.0,65.0,4.485€ Paketpreis,65 m² verfügbar,0.0,,['https://restado.de/wp-content/uploads/products/2021/07/e83d3bc7-fliesepng.png'],Porcelaingres Urban,Porcelain,Porcelain tiles,Pr_35_93_96_63,Other,"Floors, Ceiling",Other,,0.0
1254,1254,78762,https://restado.de/baustoff/porcelaingres-urban/,Porcelaingres Urban,Fliesen & Steine,Fliesen,2023-01-09,,"Die Fliesen stehen originalverpackt auf Palette auf unserer Auffahrt. Da sich das Bauvorhaben geändert hat, werden sie nun nicht mehr benötigt.  Die Fliesen werden nur als gesamter Posten abgegeben.",Neu,2.250€ Paketpreis,50 m² verfügbar,(50 m² Mindestabnahme),D-23684 Scharbeutz,Porcelaingres,"{""Farbe"": ""Anthrazit"", ""Bezeichnung"": ""Feinsteinzeug"", ""Länge (cm)"": ""60"", ""Breite (cm)"": ""60"", ""Serie"": ""Urban"", ""Dicke (mm)"": ""8"", ""Rutschfestigkeitsklasse"": ""R10""}",2250.0,50.0,2250.0,50.0,2.250€ Paketpreis,50 m² verfügbar,0.0,,['https://restado.de/wp-content/uploads/products/2021/07/b26ce1ec-fliesepng.png'],Porcelaingres Urban,Porcelain,Porcelain tiles,Pr_35_93_96_63,Other,"Floors, Ceiling",Other,,0.0
1259,1259,77769,https://restado.de/baustoff/wandfliesen-unique-weiss-seidenmatt-20x60-agrob-buchtal/,Wandfliesen Unique weiß seidenmatt 20x60 Agrob Buchtal,Fliesen & Steine,Fliesen,2023-04-08,,"Hallo,  wir bauen gerade und leider haben wir zuviele Fliesen bestellt. Die hier angebotene Fliese ist eine weiße Wandfliese in 20x60 Format von Agrob Buchtal. Wir haben 14 Pakete übrig, á 0,96m². Neu, ungebraucht, original verpackt.  Aktueller Preis pro Paket sind 27€.  15€ pro Paket.  Kann in Ober-Mörlen abgeholt werden.",Neu,16€ (VB) / Paket,14 Paket verfügbar,(1 Paket Mindestabnahme),D-61239 Ober-Mörlen,Agrob Buchtal,"{""Farbe"": ""weiß seidenmatt"", ""Bezeichnung"": ""Steingutfliesen"", ""Länge (cm)"": ""60"", ""Breite (cm)"": ""20"", ""Dicke (cm)"": ""0,9"", ""Serie"": ""GEOA3F""}",16.0,14.0,16.0,14.0,16€ (VB) / Paket,14 Paket verfügbar,0.0,,['https://restado.de/wp-content/uploads/products/2021/06/81b16e41-img_0180-scaled.jpg'],Wall tiles Unique white satin matt x Agrob Buchtal,Porcelain,Porcelain tiles,Pr_35_93_96_63,"Wall, Barriers, Pannels",Other,Masonry walling units,,0.0
1271,1271,70485,https://restado.de/baustoff/feinsteinzeug-bodenfliesen-treppenstufen/,"Feinsteinzeug, Bodenfliesen, Treppenstufen,",Fliesen & Steine,Fliesen,2023-01-09,,"Beste Qualität zum fairen Preis  Treppenstufen aus Feinsteinzeug in einem Stück - Made in Spain  Dank modernster Technik ist der Hersteller in der Lage Treppenstufen bis zu einer Länge von 1,60m herzustellen.  Die Oberflächen der Treppen gibt es in poliert (für den Innenbereich, R10) oder gebürstet (für den Außenbereich R11).  Die Preise beziehen sich für eine Tritt- und Setzstufe in der Länge: 1,20 m x Breite: 0,32 m wie folgt:  2 - 20 Stück je Stück Tritt und Setzstufe: 91,80 €  22 - 40 Stück je Stück Tritt und Setzstufe : 86,40 €  42 - 60 Stück je Stück Tritt und Setzstufe : 81,00€   Weitere Grössen für Tritt- und Setzstufen wie folgt möglich:  Trittstufen: Setzstufen: Länge: 0,60 m x Breite: 0,32 m Länge: 0,60 m x Höhe: 0,15 m Länge: 1,00 m x Breite: 0,32 m Länge: 1,00 m x Höhe: 0,15 m Länge: 1,20 m x Breite: 0,32 m Länge: 1,20 m x Höhe: 0,15 m Länge: 1,60 m x Breite: 0,32 m Länge: 1,60 m x Höhe: 0,15 m  NEU: Massanfertigung der Trittstufenbreite und Setzstufenhöhe gegen geringen Aufpreis möglich!  Formatplatten in folgenden Größen lieferbar:  30 cm x 30 cm, 40 cm x 40 cm, 40 cm x 60 cm  Farben: wie Abbildung  Produkt ist sofort verfügbar  Lieferzeitraum: 15 Tage  NUR 91,80 € /1 Stück Tritt + Setzstufe Länge in 1,20m  Preis inkl. MwSt., zzgl. Versand    Eine Anlieferung mit Spedition ist möglich.   Bitte geben Sie bei Anfragen Ihre Adresse mit an.  Haben Sie Fragen? Wir beraten Sie gern. ",Neu,"91,80€ / Stück",100 Stück verfügbar,(1 Stück Mindestabnahme),D-01558 Grossenhain,,{},91.8,100.0,91.8,100.0,"91,80€ / Stück",100 Stück verfügbar,0.0,,['https://restado.de/wp-content/uploads/products/2021/02/79b5fbd0-s-l1600-42.jpg'],"Porcelain stoneware , floor tiles , stair treads ,",Porcelain,Porcelain tiles,Pr_35_93_96_63,"Roof, Slabs, Stairs","Stairs, Ramps, Lift, Hardware",Furnishings,,0.0
1274,1274,70473,https://restado.de/baustoff/bodenfliesen-rektifiziertes-feinsteinzeug/,"Bodenfliesen, rektifiziertes Feinsteinzeug",Fliesen & Steine,Fliesen,2023-01-09,,"Beste Qualität zum fairen Preis  Feinsteinzeug - Made in Spain  Farbe: Holzoptik  Oberfläche: matt  1. Wahl - Frostsicher-zertifiziert-Tausalzbeständig  Maße: 120x20x1 cm und in anderen Größen siehe Foto lieferbar  Menge: 20,16 m²- Mindestbestellmenge/ 520 kg  Materialstärke: 1 cm kalibriert  NUR 44,80 € / 1m² ab einer Palette   Bitte geben Sie bei Anfragen Ihre Adresse mit an.  Haben Sie Fragen? Wir beraten Sie gern.",Neu,"44,80€ / m²",100 m² verfügbar,(1 m² Mindestabnahme),D-01558 Grossenhain,,{},44.8,100.0,44.8,100.0,"44,80€ / m²",100 m² verfügbar,0.0,,['https://restado.de/wp-content/uploads/products/2021/02/7a5a4df3-s-l500-11.jpg'],"Floor tiles , rectified porcelain stoneware",Porcelain,Porcelain tiles,Pr_35_93_96_63,"Roof, Slabs, Stairs","Floors, Ceiling","Floor plates, gratings and edgings",,0.0
1275,1275,70381,https://restado.de/baustoff/feinsteinzeug-fliesen-bodenfliesen/,"Feinsteinzeug Fliesen, Bodenfliesen",Fliesen & Steine,Fliesen,2023-01-09,," Beste Qualität zum fairen Preis  Treppenstufen aus Feinsteinzeug in einem Stück - Made in Spain   Die Oberflächen der Treppen gibt es in poliert (für den Innenbereich, R10) oder gebürstet (für den Außenbereich R11).  Die Preise beziehen sich für eine Tritt- und Setzstufe in der Länge: 1,60 m x Breite: 0,32 m wie folgt:  2 - 20 Stück je Stück Tritt und Setzstufe: 102,60 €  22 - 40 Stück je Stück Tritt und Setzstufe : 97,20 €  42 - 60 Stück je Stück Tritt und Setzstufe : 91,80€   Weitere Grössen für Tritt- und Setzstufen wie folgt möglich:  Trittstufen: Setzstufen: Länge: 0,60 m x Breite: 0,32 m Länge: 0,60 m x Höhe: 0,15 m Länge: 1,00 m x Breite: 0,32 m Länge: 1,00 m x Höhe: 0,15 m Länge: 1,20 m x Breite: 0,32 m Länge: 1,20 m x Höhe: 0,15 m Länge: 1,60 m x Breite: 0,32 m Länge: 1,60 m x Höhe: 0,15 m  NEU: Massanfertigung der Trittstufenbreite und Setzstufenhöhe gegen geringen Aufpreis möglich!  Formatplatten in folgenden Größen lieferbar:  30 cm x 30 cm, 40 cm x 40 cm, 40 cm x 60 cm  Farben: wie Abbildung  Produkt ist sofort verfügbar  Lieferzeitraum: 15 Tage  27,00 € /1 Musterpaket   Dieser Preis gilt ab unserem Lager Parkstraße 3 in 01558 Großenhain.  Eine Anlieferung mit Spedition ist möglich.  Bitte geben Sie bei Anfragen Ihre Adresse mit an.  Haben Sie Fragen? Wir beraten Sie gern.",Neu,27€ / Paket,50 Paket verfügbar,(1 Paket Mindestabnahme),D-01558 Grossenhain,,"{""Bezeichnung"": ""Feinsteinzeug""}",27.0,50.0,27.0,50.0,27€ / Paket,50 Paket verfügbar,0.0,,['https://restado.de/wp-content/uploads/products/2021/02/ae0b361e-s-l500-4.jpg'],"Porcelain stoneware tiles , floor tiles",Porcelain,Porcelain tiles,Pr_35_93_96_63,"Roof, Slabs, Stairs","Floors, Ceiling","Floor plates, gratings and edgings",,0.0
1283,1283,67055,https://restado.de/baustoff/feinsteinzeug-bodenfliesen-30x30cm-grau/,Feinsteinzeug Bodenfliesen 30x30cm grau,Fliesen & Steine,Fliesen,2023-01-09,, ,Neu,256€ Paketpreis,64 Stück verfügbar,(64 Stück Mindestabnahme),D-84085 Langquaid,,"{""Farbe"": ""Grau"", ""Bezeichnung"": ""Feinsteinzeug"", ""Länge (cm)"": ""30"", ""Breite (cm)"": ""30"", ""Dicke (mm)"": ""4""}",256.0,64.0,256.0,64.0,256€ Paketpreis,64 Stück verfügbar,0.0,,"['https://restado.de/wp-content/uploads/products/2020/12/14766446-shpock_image_1608746689022.jpg', 'https://restado.de/wp-content/uploads/products/2020/12/d6f8f53f-shpock_image_1608746726370.jpg']",Porcelain stoneware floor tiles xcm gray,Porcelain,Porcelain tiles,Pr_35_93_96_63,Other,Other,Other,,0.0
1301,1301,58597,https://restado.de/baustoff/feinsteinzeug-nebbia/,Feinsteinzeug Nebbia,Fliesen & Steine,Fliesen,2023-01-09,,Betonoptik Poliert für Innen und Aussen. Versandkosten nach Absprache,Neu,"29,90€ / m²",168 m² verfügbar,(10 m² Mindestabnahme),D-72770 Reutlingen,,"{""Farbe"": ""Grey"", ""Bezeichnung"": ""Feinsteinzeug"", ""Länge (cm)"": ""60"", ""Breite (cm)"": ""60"", ""Dicke (mm)"": ""10"", ""Rutschfestigkeitsklasse"": ""R10"", ""Wasseraufnahmevermögen"": ""1a"", ""Abriebfestigkeit"": ""1"", ""Verdrängungsraum"": ""V4""}",29.9,168.0,29.9,168.0,"29,90€ / m²",168 m² verfügbar,0.0,,['https://restado.de/wp-content/uploads/products/2020/09/f8a53078-feinsteinzeug-nebbia-grey-60x60-1.png'],Nebbia porcelain stoneware,Porcelain,Porcelain tiles,Pr_35_93_96_63,Furnishings,Furnishings,Furnishings,,0.0
1302,1302,57865,https://restado.de/baustoff/fliesen-in-holzoptik/,Fliesen in Holzoptik,Fliesen & Steine,Fliesen,2023-01-09,,"84,672 qm von 3000 Roble 25 x 100,8 - Holzoptik Fliese  39,117 qm von 3000 Roble 16,6 x 100,8 - Holzoptik Fliese  Diese wunderschöne Holzoptik Fliese wirkt wie bei einem echten Holz wie gehobelt und ist leicht strukturiert.  Anbei auch ein Bild wie die Fliesen bei uns verlegt sind. Der Lichteinfall lässt die Fliese auf dem Foto farblich etwas anders wirken.  Kann gerne vor Ort angeschaut werden.  Produktattribute der Fliese: Keine Baumarktware! gewellte, strukturierte Oberfläche natürliche, hellbraune Farbe matte, pflegeleichte Oberfläche geschnittene Kanten für Verlegung einer schmalen Fuge  Neupreis: 7.401,71 € Originalrechnung vorhanden Gesamtgewicht ca. 3.310,00 kg  Privatverkauf - keine Garantie oder Gewährleistung",Neu,40€ (VB) / m²,123 m² verfügbar,(1 m² Mindestabnahme),D-74538 Rosengarten,,{},40.0,123.0,40.0,123.0,40€ (VB) / m²,123 m² verfügbar,0.0,,"['https://restado.de/wp-content/uploads/products/2020/08/2f410f36-img_1597677867613_68850.jpg.webp', 'https://restado.de/wp-content/uploads/products/2020/08/d4a3c8c2-img_1597677888349_60635.jpg']",Wood look tiles,Wood,Porcelain tiles,Pr_35_93_96_63,"Roof, Slabs, Stairs",Furnishings,Glass blocks and panels,,0.0
1305,1305,55915,https://restado.de/baustoff/feinsteinzeugfliesen-mit-rillen-2/,Feinsteinzeugfliesen mit Rillen,Fliesen & Steine,Fliesen,2023-01-09,,"Rutschhemmend und trittsicher, geeignet für Bereiche mit Rutschgefahr (Geschäftsräume des Einzel- und Großhandels, Schwimmbäder, Sanitärräume).",Neu,12€ (VB) / m²,80 m² verfügbar,(1 m² Mindestabnahme),D-51063 Cologne,,"{""Farbe"": ""Grau"", ""Bezeichnung"": ""Feinsteinzeug"", ""Länge (cm)"": ""60,4"", ""Breite (cm)"": ""30,2""}",12.0,80.0,12.0,80.0,12€ (VB) / m²,80 m² verfügbar,0.0,,['https://restado.de/wp-content/uploads/products/2020/07/343bef21-f1c2188c-f300-43d6-b6b1-d74d1b2c8495.jpeg.webp'],Porcelain stoneware tiles with grooves,Porcelain,Porcelain tiles,Pr_35_93_96_63,Other,Other,"Floor plates, gratings and edgings",,0.0
1309,1309,53633,https://restado.de/baustoff/terrassenfliesen-60-x-60-feinsteinzeugfliesen-ragno/,Terrassenfliesen 60 x 60 Feinsteinzeugfliesen Ragno,Fliesen & Steine,Fliesen,2023-01-09,,"Feinsteinzeugplatten Ragno 60X60 R4HP XT20 Polvere FS R11 Abr. 5 rektifiziert (hellgrau) von Raab Karcher,",Neu,153€ Paketpreis,17 Stück verfügbar,(17 Stück Mindestabnahme),D-63303 Dreieich,,"{""Farbe"": ""hellgrau"", ""Bezeichnung"": ""Feinsteinzeug"", ""Länge (cm)"": ""60"", ""Breite (cm)"": ""60"", ""Serie"": ""Feinsteinzeugplatten Ragno 60X60 R4HP XT20 Polvere FS R11 Abr. 5 rektifiziert (hellgrau) von Raab Karcher,"", ""Dicke (mm)"": ""20 mm"", ""Rutschfestigkeitsklasse"": ""R11"", ""Abriebfestigkeit"": ""5""}",153.0,17.0,153.0,17.0,153€ Paketpreis,17 Stück verfügbar,0.0,,['https://restado.de/wp-content/uploads/products/2020/05/b4add7fb-01c104c591af0ea3f2ff312fddfd13603a4487d20f.jpg.webp'],Terrace tiles x porcelain stoneware tiles Ragno,Porcelain,Porcelain tiles,Pr_35_93_96_63,"Roof, Slabs, Stairs",Furnishings,"Floor plates, gratings and edgings",,0.0
1361,1361,26402,https://restado.de/baustoff/feinsteinzeug-fuer-terasse-godelmann-chianto-cotto-grau/,Feinsteinzeug für Terasse - Godelmann Chianto cotto grau,Fliesen & Steine,Fliesen,2023-01-09,,"Godelmann Chianto cotto grau in den Massen 120x40x2 cm - 10 Platten (ca. 5 qm) auch einzeln zu vergeben (0,48 qm pro Stück). 1-A Ware, gekauft direkt vom Hersteller Godelmann, Neupreis ca. 50 EUR/qm. Gekauft am 23.05.2018  Verkauf einzeln (am liebsten komplett) gegen Gebot...",Neu,25€ (VB) / Stück,10 Stück verfügbar,(1 Stück Mindestabnahme),D-83126 Flintsbach,,{},25.0,10.0,25.0,10.0,25€ (VB) / Stück,10 Stück verfügbar,0.0,,[],Porcelain stoneware for terrace - Godelmann Chianto cotto grey,Porcelain,Porcelain tiles,Pr_35_93_96_63,Furnishings,Furnishings,Furnishings,,0.0
1380,1380,6408,https://restado.de/baustoff/feinsteinzeug-fliesen-60x60x1cm-mudgy-italien/,"Feinsteinzeug Fliesen - 60x60x1cm ""MUDGY"" Italien",Fliesen & Steine,Fliesen,2023-01-09,,"Artikeltyp: Fliese Einsatzbereich: Innen, Außen Anwendungsbereich: Boden / Wand Räume: Badezimmer, Flur / Diele, Küche, Wohnzimmer, Terrasse Material: Feinsteinzeug Grundfarbe: Grau Fliesenoberfläche: Matt Form: Quadratisch Nennmaß Breite: 60 cm Nennmaß Länge: 60 cm Herstellmaß ca.: 60 cm x 60 cm Stärke: 1 cm Packunginhalt: 3 Fliesen ( 1,1 m² ) Sortierung: 1. Wahl Eigenschaft: Frostsicher, Rutschhemmend Eignung: Fußbodenheizung ( Ja ) Nutzung: Privat, Gewerblich / Objektbereich  Ob im Außenbereich oder in Badezimmer, Wohnraum und Küche – die Bodenfliese ""MUDGY"" 60x60 cm ist vielseitig wie kaum ein anderer Bodenbelag. Durch die Optik des grauen Feinsteinzeugs entsteht eine moderne Atmosphäre.  Die Ware kann unter Umständen im Umkreis von ca. 100 km gegen Aufpreis geliefert werden. Im Regelfall ist jedoch eine Selbstabholung erwünscht.  Alle offenen Fragen werden unter Tel.: 0152 - 33 58 28 82 beantwortet. Lagerort: Augsburg ( Lechhausen )",Neu,17€ (VB) / m²,200 m² verfügbar,(1 m² Mindestabnahme),12 Monate Gewährleistung,,{},17.0,200.0,17.0,200.0,17€ (VB) / m²,200 m² verfügbar,0.0,,[],Porcelain stoneware tiles - xxcm `` '' Italy,Porcelain,Porcelain tiles,Pr_35_93_96_63,Other,Other,Other,,0.0
1381,1381,6404,https://restado.de/baustoff/feinsteinzeug-fliesen-61x61x1cm-city-moka-italien/,Feinsteinzeug Fliesen - 61x61x1cm,Fliesen & Steine,Fliesen,2023-01-09,,"Artikeltyp: Fliese Einsatzbereich: Innen, Außen Anwendungsbereich: Boden / Wand Räume: Badezimmer, Flur / Diele, Küche, Wohnzimmer, Terrasse Material: Feinsteinzeug glasiert Grundfarbe: Braun Fliesenoberfläche: Matt Form: Quadratisch Nennmaß Breite: 61 cm Nennmaß Länge: 61 cm Herstellmaß ca.: 61 cm x 61 cm Stärke: 1 cm Packunginhalt: 4 Fliesen ( 1,49 m² ) Sortierung: 1. Wahl Eigenschaft: Frostsicher, Rutschhemmend Eignung: Fußbodenheizung ( Ja ) Nutzung: Privat, Gewerblich / Objektbereich  Ob im Außenbereich oder in Badezimmer, Wohnraum und Küche - die Bodenfliese ""CITY MOKA"" 61x61 cm ist vielseitig wie kaum ein anderer Bodenbelag. Durch die Optik des braunen Feinsteinzeugs entsteht eine moderne Atmosphäre.  Die Ware kann unter Umständen im Umkreis von ca. 100 km gegen Aufpreis geliefert werden. Im Regelfall ist jedoch eine Selbstabholung erwünscht.  Alle offenen Fragen werden unter Tel.: 0152 - 33 58 28 82 beantwortet. Lagerort: Augsburg ( Lechhausen )",Neu,15€ (VB) / m²,108 m² verfügbar,(1 m² Mindestabnahme),12 Monate Gewährleistung,,{},15.0,108.0,15.0,108.0,15€ (VB) / m²,108 m² verfügbar,0.0,,[],Porcelain stoneware tiles - xxcm,Porcelain,Porcelain tiles,Pr_35_93_96_63,Other,Other,Masonry walling units,,0.0
