,Unnamed: 0,Nr,URL,Title,Category,Subcategory,Saved,LastUpOn,Description,Zustand,FirstPrice,FirstAvailable,MinAmount,Location,Hersteller,Properties,FirstPriceNumeric,FirstAvailableNumeric,LastPriceNumeric,LastAvailableNumeric,LastPrice,LastAvailable,Sold,SoldAfter,Imagefile,Title_en,material_emb,German_Raw,German_Code,first_level,second_level,third_level,SoldAfterDays,StockChange
1241,1241,85249,https://restado.de/baustoff/1-kiste-wand-gestaltung-echt-ziegel-stein-antik-riemchen-used-look-shabby-chic-deko-gemuetlich-raum/,1 Kiste Wand Gestaltung echt Ziegel Stein Antik Riemchen used look …,Fliesen & Steine,Fliesen,2023-01-09,,"Unsere Ziegelverblender werden aus originalen alten Mauersteine geschnitten   Es werden NUR die zwei Außenseiten  vom Stein verwendet.   Preis je 1 Kiste, ca. 0,65 m²  Ergiebigkeit 52 Stck/ m².  Maße: 25x6,5x2 cm  sicherer Versand in stabilen Kisten  Transportkosten auf Anfrage.  Sofort lieferbar.   Bezugnahme auf Art-Nr: Rm rt Tom 9-21   Antik-Stein auch auf Facebook, Pinterest & youtube",Gebraucht,36€ / Paket,100 Paket verfügbar,(5 Paket Mindestabnahme),D-06120 Halle (Saale),,{},36.0,100.0,36.0,100.0,36€ / Paket,100 Paket verfügbar,0.0,,"['https://restado.de/wp-content/uploads/products/2021/11/f8c41693-collage-herstellung-deutsch.jpg', 'https://restado.de/wp-content/uploads/products/2021/11/b2a9dc97-malik-10-10-19.jpg', 'https://restado.de/wp-content/uploads/products/2021/11/62b269fb-vk-61-19-rm-rt-neutz-3-19.jpg', 'https://restado.de/wp-content/uploads/products/2021/11/5a05ff1c-vieles-mehr-schamotte.jpg', 'https://restado.de/wp-content/uploads/products/2021/11/d410f5ff-rm-rt-kiste-25.10.21.jpg', 'https://restado.de/wp-content/uploads/products/2021/11/1f7967d2-vk-90-19-rm-rt-tom-19-2.jpeg']",box of wall design real brick stone antique straps used look ...,Leather,Wall hangings,Pr_40_50_05_95,Furnishings,"Blocks, Panels, Fences, Bricks",Furnishings,,0.0
1244,1244,82724,https://restado.de/baustoff/ragno-terracruda-wandfliesen/,Ragno Terracruda Wandfliesen,Fliesen & Steine,Fliesen,2023-01-09,,"rektifiziert.  Die 6 Fliesen sind noch originalverpackt, wir haben leider etwas zu viel geordert.",Neu,90€ Paketpreis,6 Stück verfügbar,(6 Stück Mindestabnahme),D-80637 Munich,,"{""Farbe"": ""Luce"", ""Bezeichnung"": ""Steingutfliesen"", ""Länge (cm)"": ""120"", ""Breite (cm)"": ""40"", ""Dicke (cm)"": ""0,6"", ""Serie"": ""Terracruda""}",90.0,6.0,90.0,6.0,90€ Paketpreis,6 Stück verfügbar,0.0,,"['https://restado.de/wp-content/uploads/products/2021/10/e8a2fbdd-img_1838-scaled.jpg', 'https://restado.de/wp-content/uploads/products/2021/10/98550ab1-img_1838-scaled.jpg']",Ragno Terracruda wall tiles,Terracotta,Terrazzo tiles,Pr_35_93_96_90,"Wall, Barriers, Pannels","Blocks, Panels, Fences, Bricks",Masonry walling units,,0.0
1246,1246,82833,https://restado.de/baustoff/inschriften-stempel-stein-wand-verkleidung-deko-alter-ziegel-backstein-fliese-feldbrand-gruender-zeit/,Inschriften Stempel Stein Wand Verkleidung Deko alter Ziegel Backst…,Fliesen & Steine,Fliesen,2023-01-09,,"Wanddekoration aus einem original alter Ziegelstein, mit Inschrift, geschnitten.  Um 1860-1880 in Österreich-Ungarn hergestellt.  Einmaliges historisches Zeitdokument.  Maße ca. 29x15x2 cm.   Für Sammler, jedoch auch gut in Kombination mit unseren weiteren Antikriemchen.  Viele weitere Antik Riemchen und Bodenplatten aus alten Ziegeln an unserem Bergelager.  Antik-Stein auch auf youtube, facebook, twitter, instagram und pinterest.  page: www.baustoffe-antik.de",Gebraucht,39€ / Stück,1 Stück verfügbar,(1 Stück Mindestabnahme),D-06120 Halle (Saale),,{},39.0,1.0,39.0,1.0,39€ / Stück,1 Stück verfügbar,0.0,,"['https://restado.de/wp-content/uploads/products/2021/09/a8fd6b51-vk-39-17-rm-rt-som17.jpg', 'https://restado.de/wp-content/uploads/products/2021/09/705b7c85-mehr-ref-auf-baust-antik-17.jpg', 'https://restado.de/wp-content/uploads/products/2021/09/e4951961-vk-76-18-rm-rt-tom-hart-4.jpg', 'https://restado.de/wp-content/uploads/products/2021/09/56dca8a5-inschriftenstein-29.9.21.jpg', 'https://restado.de/wp-content/uploads/products/2021/09/baf869d6-vk-p021-18-rm-rt-doel-11-17.jpg']",Inscriptions Stamp Stone Wall Cladding Decoration Old Brick Backst…,Coade stone,Decorative stone finishing battens,Pr_25_71_22_84,Other,"Blocks, Panels, Fences, Bricks",Masonry walling units,,0.0
1248,1248,81678,https://restado.de/baustoff/handform-ziegel-riemchen-vintage-rote-klinker-verblender-wand-reichsformat-feldbrand-echte-alte-back/,Handform Ziegel Riemchen Vintage rote Klinker Verblender Wand Reich…,Fliesen & Steine,Fliesen,2023-01-09,1692230400000.0,"original historische Backsteine zu Antikriemchen geschnitten.   Unsere alten Mauersteine stammen aus der  Handbergung historischer Gebäude,   Anschließend werden zwei Riemchen von den Aussenseiten  im Nassschneideverfahren abgeschnitten.   Preis je 1 m²  Ergiebigkeit 52 Stck/ m².  Maße: 25x6,5x2 cm  Transportkosten auf Anfrage.  Ab 20 m² Bestellmenge 50 EUR/ m²",Gebraucht,54€ / m²,100 m² verfügbar,(1 m² Mindestabnahme),D-06120 Halle (Saale),,{},54.0,100.0,54.0,100.0,54€ / m²,100 m² verfügbar,1.0,19008000000.0,"['https://restado.de/wp-content/uploads/products/2021/09/4d9d8c06-rm-rt-aken-09-21-4.jpg', 'https://restado.de/wp-content/uploads/products/2021/09/7e9972ce-collage-herstellung-deutsch.jpg', 'https://restado.de/wp-content/uploads/products/2021/09/ac98d2a2-rm-rt-aken-09-21.jpg', 'https://restado.de/wp-content/uploads/products/2021/09/709d3898-crocodil-cafe-kneipe-rostock-rm-rt-diesk-19.5.17.jpg']",Hand-shaped brick straps vintage red clinker facing wall rich…,Clinker,Shear wall ties,Pr_20_85_84_73,Other,"Blocks, Panels, Fences, Bricks",Masonry walling units,220.0,0.0
1250,1250,79875,https://restado.de/baustoff/fliesen-bordueren/,Fliesen Bordüren,Fliesen & Steine,Fliesen,2023-01-09,, ,Neu,96€ (VB) Paketpreis,32 Stück verfügbar,(32 Stück Mindestabnahme),D-22587 Hamburg,England Winchester tile company ,"{""Farbe"": ""Hellblaugrün"", ""Länge (cm)"": ""20"", ""Breite (cm)"": ""3"", ""Einsatzbereich"": ""1091"", ""Material"": ""Feinsteinzeug""}",96.0,32.0,96.0,32.0,96€ (VB) Paketpreis,32 Stück verfügbar,0.0,,"['https://restado.de/wp-content/uploads/products/2021/08/355e2e0b-968c1324-6ed0-491a-a799-0e91723e7bd9-scaled.jpeg', 'https://restado.de/wp-content/uploads/products/2021/08/0ed771f9-db231488-8ec3-43b3-b16d-d91114fb0a65-scaled.jpeg']",Tile borders,Patterned glass,Ceramic tile borders,Pr_35_93_96_13,"Wall, Barriers, Pannels","Blocks, Panels, Fences, Bricks",Glass blocks and panels,,0.0
1252,1252,78975,https://restado.de/baustoff/9-m%c2%b2-mediterrane-boden-platten-ziegel-fliesen-backstein-mauerstein-landhaus-rustikal/,9 m² mediterrane Boden Platten Ziegel Fliesen Backstein Mauerstein…,Fliesen & Steine,Fliesen,2023-01-09,1690588800000.0,"++++Sonderposten nur 27,77 EUR/ m²+++  Unsere alten Mauersteine, geschnitten zu Bodenplatten, stammen aus der Handbergung historischer Gebäude,  Daraus werden dann flache, fliesenartige Bodenziegel geschnitten. Glatte Innenschnitte, für eine lebhafte, pflegeleichte Oberfläche.   Sonderpreis für insgesamt 9 m².  Maßabweichungen in der Dicke.  Ergiebigkeit 32 Stck/ m².  Maße: 25x12x2 cm  Transportkosten auf Anfrage.  Bezugnahme auf Art-Nr: Sonder Bd Pl gl glatt 2020   ***Antik-Stein auch auf Facebook, Pinterest & youtube***  Page: baustoffe-antik.de",Gebraucht,250€ / Paket,1 Paket verfügbar,(1 Paket Mindestabnahme),D-06120 Halle (Saale),,"{""Bezeichnung"": ""Steingutfliesen""}",250.0,1.0,250.0,1.0,250€ / Paket,1 Paket verfügbar,1.0,17366400000.0,"['https://restado.de/wp-content/uploads/products/2021/07/bbcff11a-bd-pl-gl-v3-lieskau-03-16-2-v-2.jpg', 'https://restado.de/wp-content/uploads/products/2021/07/1e917de0-collage-herstellung-bd.jpg', 'https://restado.de/wp-content/uploads/products/2021/07/15a06934-bd-pl-gl-rabatt-9-qm-250-2020.jpg']",m² Mediterranean floor panels brick tiles brick wall stone…,Masonry cement,Stone tiles,Pr_35_93_96_86,"Roof, Slabs, Stairs","Blocks, Panels, Fences, Bricks",Masonry walling units,201.0,0.0
1256,1256,78098,https://restado.de/baustoff/ziegel-steine-mauerziegel-backstein-wand-fliese-antik-riemchen-verblender-retro-kamin-used-look-loft/,Ziegel Steine Mauerziegel Backstein Wand Fliese Antik Riemchen Verb…,Fliesen & Steine,Fliesen,2023-01-09,1687651200000.0,"Unsere Antikriemchen werden aus echten über 120 Jahre alten original historische Backsteinen geschnitten.  Die historischen Mauersteine stammen aus der Handbergung von alten Gebäude mit Ziegelfassade  Das damalige Format war das Reichsformat, 25x12x6,5 cm  glatte Sägeschnittinnenseiten mit interessanter Farbgebung  Preis je 1 m²  Ergiebigkeit 52 Stck/ m².  Transportkosten auf Anfrage.  Bezugnahme auf Art-Nr: Rm rt Radow glatt 5-21",Neu,25€ / m²,100 m² verfügbar,(1 m² Mindestabnahme),D-06120 Halle (Saale),,{},25.0,100.0,25.0,100.0,25€ / m²,100 m² verfügbar,1.0,14428800000.0,"['https://restado.de/wp-content/uploads/products/2021/07/cc59e081-collage-herstellung-deutsch.jpg', 'https://restado.de/wp-content/uploads/products/2021/07/61d445dc-rm-glatt-rot-doelau-2.jpg', 'https://restado.de/wp-content/uploads/products/2021/07/0f867838-morgenstern-3-neu-2021.jpg', 'https://restado.de/wp-content/uploads/products/2021/07/05a332b0-rm-glatt-rot-doelau.jpg', 'https://restado.de/wp-content/uploads/products/2021/07/16cf2686-vieles-mehr-schamotte.jpg', 'https://restado.de/wp-content/uploads/products/2021/07/a6678e04-rm-rt-2012-v3.jpg', 'https://restado.de/wp-content/uploads/products/2021/07/efd13635-mehr-ref-auf-baust-antik-17.jpg']",Bricks Stones Brick Wall Tile Antique Straps Connection…,Masonry cement,Masonry repair ties,Pr_20_85_84_50,Other,"Blocks, Panels, Fences, Bricks",Masonry walling units,167.0,0.0
1261,1261,76588,https://restado.de/baustoff/loft-ziegel-verblendsteine-klinker-riemchen-original-mauerziegel-steinwand-antik-used-look/,Loft Ziegel Verblendsteine Klinker Riemchen original Mauerziegel St…,Fliesen & Steine,Fliesen,2023-01-09,1690761600000.0,"Unsere Antikriemchen werden aus echten über 120 Jahre alten original historische Backsteinen geschnitten.  Die historischen Mauersteine stammen aus der Handbergung von alten Gebäude mit Ziegelfassade  Das damalige Format war das Reichsformat, 25x12x6,5 cm  Preis je 1 m²  Ergiebigkeit 52 Stck/ m².  Maße: 25x6,5x2 cm  Transportkosten auf Anfrage.  Bezugnahme auf Art-Nr: Rm rt Rado 5-21  Ab 20 m² Bestellmenge 50 €/ m²  ***Antik-Stein auch auf Facebook, Pinterest & youtube***",Gebraucht,54€ / m²,100 m² verfügbar,(1 m² Mindestabnahme),D-06120 Halle (Saale),,"{""Bezeichnung"": ""Steingutfliesen""}",54.0,100.0,54.0,100.0,54€ / m²,100 m² verfügbar,1.0,17539200000.0,"['https://restado.de/wp-content/uploads/products/2021/06/0fb2f736-rm-rt-rado5-21.jpg', 'https://restado.de/wp-content/uploads/products/2021/06/be62a168-lars-kurzweil-13-mb-rotated.jpeg', 'https://restado.de/wp-content/uploads/products/2021/06/09b0b95c-rm-rt-rado5-21-4.jpg']",Loft brick facing stones clinker straps original wall bricks…,Clinker,Masonry repair ties,Pr_20_85_84_50,Other,"Blocks, Panels, Fences, Bricks",Masonry walling units,203.0,0.0
1264,1264,75079,https://restado.de/baustoff/agnes-fassadenverkleidung-verblender-riemchen-sandstein/,AGNES Fassadenverkleidung Verblender Riemchen Sandstein,Fliesen & Steine,Fliesen,2023-01-09,1692144000000.0,"Riemchen ""AGNES"". Verblender aus Sandstein 250 x 60 x 15-25 mm. Oberfläche gespalten, alle 5 andere Seiten gesägt  Verpackung: geschrumpft auf den Palleten (ohne Kartons)!  Der Preis ist 46€ (inkl. MwSt.) für 1 m2. Mindestabnahme - 5 m2. Selbstabholung in 40229 Düsseldorf oder deutschlandweite Lieferung gegen Aufpreis - beides ist möglich.  Wenn Sie Interesse haben - kann ich 6 St. Musterriemchen per Hermes gegen 12€ Musterpauschale verschicken.  Material: Es handelt sich hierbei um hochqualitativen, frostsicheren Naturstein. Der Farbton reicht von ganz hellgrau bis dunkelbeige mit braunen Adern.  Wir sind unter 0178-8299083 erreicthbar.  Mehr Info finden Sie hier: http://sandstein-rusava.de",Neu,48€ / m²,100 m² verfügbar,(5 m² Mindestabnahme),D-40229 Düsseldorf,,"{""Farbe"": ""Hellrau beige"", ""Länge (cm)"": ""25"", ""Breite (cm)"": ""6"", ""Dicke (cm)"": ""1-2"", ""Serie"": ""AGNES""}",48.0,100.0,48.0,100.0,48€ / m²,100 m² verfügbar,1.0,18921600000.0,['https://restado.de/wp-content/uploads/products/2021/05/2cdb8672-agnes-1.jpg'],facade cladding brick strips sandstone,Sandstone,Silicate-based masonry coatings,Pr_35_31_22_77,"Roof, Slabs, Stairs","Blocks, Panels, Fences, Bricks",Masonry walling units,219.0,0.0
1265,1265,73396,https://restado.de/baustoff/fliesen-13/,Fliesen,Fliesen & Steine,Fliesen,2023-06-22,,Die Fliesen sind zur Selbstdemontage abholbereit. Bei Interesse bitte melden. Preis ist verhandelbar.,Gebraucht,1€ (VB) / Stück,100 Stück verfügbar,(30 Stück Mindestabnahme),D-08645 Bad Elster,,"{""Länge (cm)"": ""14,5"", ""Breite (cm)"": ""14,5""}",1.0,100.0,1.0,100.0,1€ (VB) / Stück,100 Stück verfügbar,0.0,,[],Tiles,Slate,Stone tiles,Pr_35_93_96_86,"Roof, Slabs, Stairs","Blocks, Panels, Fences, Bricks",Masonry walling units,,0.0
1266,1266,73000,https://restado.de/baustoff/alte-fliesen-kachel-borduere/,Alte Fliesen/Kachel Bordüre,Fliesen & Steine,Fliesen,2023-08-30,,"Alte Fliesen/Kachel Bordüre weiß  um 1880 aus altem Bauernhaus  Einzigartige rustikale Profilkante, gebrannt wie Ofenkachel. Gesamtlänge inkl. 5mm Fuge: ca. 315 cm Maße einzelnes Bordüren-Element: Länge 21 cm, Höhe 5 cm, Tiefe 7 cm Bestehend aus folgenden Elementen: 12 Stück Gerade je 21 cm Länge 1 Stück langes Eckstück 24 cm Länge 1 Stück Gerade 12 cm 2 Eckstücke je 10 cm Länge Zustand: Die Objekte weisen Gebrauchsspuren und teils an den Kanten kleine Abplatzungen auf. Ferner sind rückseitig Verbauungsspuren. Gesamtgewicht 15 KG. Paketpreis 150 €",Gebraucht,150€ (VB) / Paket,1 Paket verfügbar,(1 Paket Mindestabnahme),D-22525 Hamburg,,{},150.0,1.0,150.0,1.0,150€ (VB) / Paket,1 Paket verfügbar,0.0,,"['https://restado.de/wp-content/uploads/products/2021/04/24d34213-dsc04754-scaled.jpg', 'https://restado.de/wp-content/uploads/products/2021/04/c5f6cfd2-dsc04750-scaled.jpg']",Old tiles/tile border,Mosaic glass,Ceramic tile borders,Pr_35_93_96_13,Other,"Blocks, Panels, Fences, Bricks",Glass blocks and panels,,0.0
1268,1268,71545,https://restado.de/baustoff/boden-platten-ziegel-fliese-backstein-alte-mauersteine-antikziegel-natuerlich-rustikal-landhaus/,Boden Platten Ziegel Fliese Backstein alte Mauersteine Antikziegel …,Fliesen & Steine,Fliesen,2023-01-09,1689292800000.0,"original historische Backsteine aus dem Handrückbau über 120 Jare alter Gebäude, als Bodenbelag.  Die Steine werden zu flachen fliesenartigen Bodenplatten aufgesägt.  Nur die orignalen Außenseiten der Backsteine werden verwendet.  Preis je 1 qm   Maße je Stein: 25x12x2 cm  Sockelleisten auch lieferbar.  Transportkosten auf Anfrage   interne Arbeitsbezeichnung: Bd Pl rt Rado orig Obf 12-20   Antik-Stein auch auf facebook, Pinterest & youtube",Gebraucht,54€ / m²,300 m² verfügbar,(1 m² Mindestabnahme),D-06120 Halle (Saale),,{},54.0,300.0,54.0,300.0,54€ / m²,300 m² verfügbar,1.0,16070400000.0,"['https://restado.de/wp-content/uploads/products/2021/03/d5949c84-bd-pl-rt-v1-12-20-4.jpg', 'https://restado.de/wp-content/uploads/products/2021/03/7b046a96-bd-pl-rt-v1-12-20.jpg', 'https://restado.de/wp-content/uploads/products/2021/03/7e2fb552-foto.jpg', 'https://restado.de/wp-content/uploads/products/2021/03/06fa2b24-plihal-bd-neu-2019.jpg', 'https://restado.de/wp-content/uploads/products/2021/03/6315595b-collage-herstellung-bd.jpg', 'https://restado.de/wp-content/uploads/products/2021/03/ae7a88ef-bd-pl-rt-orig-o-vk-98-20.jpg', 'https://restado.de/wp-content/uploads/products/2021/03/cc950716-mehr-ref-auf-baust-antik-17.jpg']",Floor slabs brick tile brick old bricks antique bricks…,Masonry cement,Clay bricks,Pr_20_93_52_15,"Roof, Slabs, Stairs","Blocks, Panels, Fences, Bricks",Masonry walling units,186.0,0.0
1270,1270,70683,https://restado.de/baustoff/fliesen-aus-dachziegeln/,Fliesen aus Dachziegeln,Fliesen & Steine,Fliesen,2023-01-09,,"Fliesen aus alten Dachziegeln  Wir bieten 3 Maße an:  - Länge 28 breite 16 cm  - Länge 16 breite 16 cm  - Länge 22 breite 16 cm   - Handgeschnitten  - Rustikaler Look im Wohnbereich  - Originell, Einzigartig, Nachhaltig  - Preis bei 27€/ m2  Das sind die Maße die wir gerne anfertigen. ",Gebraucht,27€ / m²,500 m² verfügbar,(10 m² Mindestabnahme),D-80539 München,,{},27.0,500.0,27.0,500.0,27€ / m²,500 m² verfügbar,0.0,,"['https://restado.de/wp-content/uploads/products/2021/02/f90ef747-eee01678-4513-4663-a563-cfa8da017284-scaled.jpeg', 'https://restado.de/wp-content/uploads/products/2021/02/9afca987-bad71b1b-13b0-4583-a305-41be6cfa323b.jpeg', 'https://restado.de/wp-content/uploads/products/2021/02/8e4d1a6f-3c6b98bc-12a3-4ff2-a31c-31657057d4f5.jpeg']",Tiles made from roof tiles,Acrylic resin,Ceramic tiles,Pr_35_93_96_19,"Roof, Slabs, Stairs","Blocks, Panels, Fences, Bricks",Structural roofing units,,0.0
1280,1280,67817,https://restado.de/baustoff/ziegelfliesen/,Ziegelfliesen,Fliesen & Steine,Fliesen,2023-01-09,,"- Die Ziegelfliesen werden auf Bestellung & auf Wunsch stärke zugeschnitten.  - in ca. 3 cm wenn wir den Ziegelstein Teilen - in ca. 1,8 cm wenn wir den Ziegelstein 3 Teilen kommt immer auf den Härtegrad des Ziegelstein an  - Weiche Ziegelsteine sind er ungeeignet für diesen aufwendigen hochkant schnitt.  - Sie sagen uns wie dick Sie den Ziegelstein haben möchten und wir tun unser möglichstes dies zu realisieren  - Preis/Stk. Netto 2,15 €   VERSANDKOSTEN NACH ABSPRACHE/VEREINBARUNG",Gebraucht,"2,15€ / Stück",100 Stück verfügbar,(1 Stück Mindestabnahme),Gebraucht,,"{""Bezeichnung"": ""Ziegelfliesen""}",2.15,100.0,2.15,100.0,"2,15€ / Stück",100 Stück verfügbar,0.0,,['https://restado.de/wp-content/uploads/products/2021/01/762047b5-00192-2_produktbild_165-203_700x700.jpg'],Brick tiles,Masonry cement,Stone tiles,Pr_35_93_96_86,"Roof, Slabs, Stairs","Blocks, Panels, Fences, Bricks",Masonry walling units,,0.0
1281,1281,67647,https://restado.de/baustoff/historische-fliesen/,Historische Fliesen,Fliesen & Steine,Fliesen,2023-01-13,,Die Fliesen stammen aus dem alten Badezimmer und wurden im Zuge der Renovierung ausgetauscht. Statt Geld tausche ich auch gerne z.B. gegen einen Kasten Gaffel Fassbrause Zitrone 🍋.,Gebraucht,1€ (VB) / Stück,33 Stück verfügbar,(1 Stück Mindestabnahme),D-53721 Siegburg,Sinzig,"{""Farbe"": ""16x schwarz, 17x weiß"", ""Bezeichnung"": ""Steinzeugfliesen"", ""Länge (cm)"": ""10"", ""Breite (cm)"": ""10"", ""Serie"": ""Sinzig"", ""Dicke (mm)"": ""10""}",1.0,33.0,1.0,33.0,1€ (VB) / Stück,33 Stück verfügbar,0.0,,"['https://restado.de/wp-content/uploads/products/2021/01/0c949eba-ab675eab-5132-4d65-a121-bde1ecca4ccf.jpeg', 'https://restado.de/wp-content/uploads/products/2021/01/79203543-c467d714-b3d3-4485-b379-7f631053ba3a.jpeg']",Historical tiles,Slate,Stone tiles,Pr_35_93_96_86,"Roof, Slabs, Stairs","Blocks, Panels, Fences, Bricks",Masonry walling units,,0.0
1282,1282,67010,https://restado.de/baustoff/antikriemchen-backsteinklinker-loft-backsteinverblender/,Antikriemchen Backsteinklinker Loft Backsteinverblender,Fliesen & Steine,Fliesen,2023-01-09,,"Wir bieten hier Backsteinklinker/ Ziegelriemchen aus Rückbau gereinigt!  Exklusive Wandverkleidung aus 80-130 Jahre altem recycelten Backstein bzw. Ziegelstein! Mit diesem Backsteinklinker verleihen Sie ihrem Projekt den typisch natürlichen Charme alter Gebäude in frischer Optik. Kein neu hergestellter Stein kann Ihnen die Wärme und Ausstrahlung unserer alten Backsteinklinker bieten. Formen, Farben und Patina, beeinflusst von über 80 Jahren verstrichener Zeit, sorgen dafür, dass Ihr nächstes Projekt anders als alle anderen ist. Unsere alten Ziegel werden durch sog. “selektiven Rückbau“ gewonnen. Im Gegensatz zum konventionellen Abriss eines Gebäudes wird dabei auf den Werterhalt gesetzt. Kenner sprechen von Recycling auf höchster Wertstufe. Der Rückbau geschieht in aufwendiger Handarbeit. Alle Backsteine werden einzeln aus dem Mauerverband gelöst, gesäubert und palettiert un d dann geschnitten. Farbabweichungen sind bei keramischen bzw. brand Produkten wie z. B. Klinker oder Backstein kein Reklamationsgrund! Weiterhin sind bei antiken Baumaterialien wie Backsteinklinker oder Abbruchsteinen, Maßdifferenzen kein Reklamationsgrund! Bei der Verlegung/Verarbeitung vorgenannter Materialien muss immer gemischt verlegt/verarbeitet werden, um ein optimales Farbspiel bzw. -bild zu erreichen! Weiterhin können bei der Lieferung auch defekte Backsteinklinker dabei sein, auch dies ist kein Reklamationsgrund da Sie diese benötigen um Anfänge oder Versatze zu erstellen!   Die Verlegung ist kinderleicht! Sollten Sie es sich doch nicht zutrauen, können wir auch gerne ein Angebot mit der Verlegung erstellen.   Gesamtgröße: ca. 250 mm x 65 mm  Gestaltung: variabel  Stärke: ca.20 mm  Rückseite: glatt  Frontseite: antik  Verlauf: gemischt  Material: Backstein mit Kalkansätzen   Wir montieren auch!  Preis nach Sortierung: C- Sortierung 1/2 / 3/4=29€/qm B- Sortirung teils 1/2 und 3/4 39€/qm A-Sortierung 1/1 Top Ware 49€/qm",Aufbereitet,29€ / Stück,10.000 Stück verfügbar,(1 Stück Mindestabnahme),Aufbereitet,,"{""Bezeichnung"": ""Klinker""}",29.0,10000.0,29.0,10000.0,29€ / Stück,10.000 Stück verfügbar,0.0,,"['https://restado.de/wp-content/uploads/products/2020/12/99bdd5e7-1.jpg', 'https://restado.de/wp-content/uploads/products/2020/12/7e985ac9-10.png', 'https://restado.de/wp-content/uploads/products/2020/12/bd9af267-4.jpg', 'https://restado.de/wp-content/uploads/products/2020/12/613f17e3-7.jpg', 'https://restado.de/wp-content/uploads/products/2020/12/a96285d0-13.jpg']",Antikriemchen brick clinker loft brick facing brick,Masonry cement,Engineering bricks,Pr_20_93_52_27,Other,"Blocks, Panels, Fences, Bricks",Masonry walling units,,0.0
1284,1284,66862,https://restado.de/baustoff/backsteinklinker-antik/,Backsteinklinker „Antik“,Fliesen & Steine,Fliesen,2023-01-09,1689033600000.0,"Backsteinklinker „Antik“  Exklusive Wandverkleidung aus 80-130 Jahre altem recycelten Backstein bzw. Ziegelstein!  Mit diesem Backsteinklinker verleihen Sie ihrem Projekt den typisch natürlichen Charme alter Gebäude in frischer Optik.  Kein neu hergestellter Backsteinklinker kann Ihnen die Wärme und Ausstrahlung unserer alten Backsteinklinker bieten. Formen, Farben und Patina, beeinflusst von über 80 Jahren verstrichener Zeit, sorgen dafür, dass Ihr nächstes Projekt anders als alle anderen ist.  Unsere alten Backsteinklinker werden durch sog. “selektiven Rückbau“ gewonnen. Im Gegensatz zum konventionellen Abriss eines Gebäudes wird dabei auf den Werterhalt der Backsteinklinker gesetzt. Kenner sprechen von Recycling auf höchster Wertstufe. Der Rückbau geschieht in aufwendiger Handarbeit. Alle Backsteinklinker werden einzeln aus dem Mauerverband gelöst, gesäubert und palettiert. Farbabweichungen sind bei keramischen bzw. brand Produkten wie z. B. Klinker oder Backstein kein Reklamationsgrund!  Weiterhin sind bei antiken Baumaterialien wie Backsteinklinker oder Abbruchsteinen, Maßdifferenzen kein Reklamationsgrund!  Bei der Verlegung/Verarbeitung der Backsteinklinker muss immer gemischt verlegt/verarbeitet werden, um ein optimales Farbspiel bzw. -bild zu erreichen!  Weiterhin können bei der Lieferung auch defekte Backsteinklinker dabei sein, auch dies ist kein Reklamationsgrund da Sie diese benötigen um Anfänge oder Versatze zu erstellen!  Preis nach Qualitätsstufe und Menge!",Aufbereitet,39€ (VB) / m²,100.000 m² verfügbar,(5 m² Mindestabnahme),Aufbereitet,,{},39.0,100000.0,39.0,100000.0,39€ (VB) / m²,100.000 m² verfügbar,1.0,15811200000.0,,Brick clinker “ antique ”,Clinker,Clay brick sills,Pr_25_93_52_13,Other,"Blocks, Panels, Fences, Bricks",Shaft-lining products,183.0,0.0
1285,1285,64671,https://restado.de/baustoff/kacheln/,Kacheln,Fliesen & Steine,Fliesen,2023-01-09,,70er Jahre Fliesenschild aus Küche und Bad für Retrodesign,Gebraucht,100€ / m²,1 m² verfügbar,(1 m² Mindestabnahme),D-24253 Fahren,,"{""Farbe"": ""orange-blau und weiß mit roter Prilblume"", ""Bezeichnung"": ""Glasfliesen"", ""Länge (cm)"": ""normale Kachelgröße"", ""Dicke (cm)"": ""normal""}",100.0,1.0,100.0,1.0,100€ / m²,1 m² verfügbar,0.0,,['https://restado.de/wp-content/uploads/products/2020/11/606927ed-img_20201118_200341_2.jpg'],Tiles,Slate,Stone tiles,Pr_35_93_96_86,"Roof, Slabs, Stairs","Blocks, Panels, Fences, Bricks",Masonry walling units,,0.0
1289,1289,62502,https://restado.de/baustoff/fliesen-2/,Fliesen,Fliesen & Steine,Fliesen,2023-01-09,,Bodenfliesen neu und nicht gebraucht für Selbstabholer 35qm bzw. 35 Pakete,Neu,875€ (VB) Paketpreis,35 Stück verfügbar,(35 Stück Mindestabnahme),D-47051 Duisburg,,"{""Farbe"": ""Anthrazit"", ""Bezeichnung"": ""Steinzeugfliesen"", ""Länge (cm)"": ""297"", ""Breite (cm)"": ""297"", ""Serie"": ""KERMOS Nr. 62 Metro anthrazit, matt"", ""Dicke (mm)"": ""7"", ""Rutschfestigkeitsklasse"": ""R10""}",875.0,35.0,875.0,35.0,875€ (VB) Paketpreis,35 Stück verfügbar,0.0,,"['https://restado.de/wp-content/uploads/products/2020/10/40485ab0-img_1229-scaled.jpg', 'https://restado.de/wp-content/uploads/products/2020/10/1fde87e3-img_1228-scaled.jpg']",Tiles,Slate,Stone tiles,Pr_35_93_96_86,"Roof, Slabs, Stairs","Blocks, Panels, Fences, Bricks",Masonry walling units,,0.0
