,Unnamed: 0,Nr,URL,Title,Category,Subcategory,Saved,LastUpOn,Description,Zustand,FirstPrice,FirstAvailable,MinAmount,Location,Hersteller,Properties,FirstPriceNumeric,FirstAvailableNumeric,LastPriceNumeric,LastAvailableNumeric,LastPrice,LastAvailable,Sold,SoldAfter,Imagefile,Title_en,material_emb,German_Raw,German_Code,first_level,second_level,third_level,SoldAfterDays,StockChange
2241,2241,4669,https://restado.de/baustoff/alte-ziegelsteine/,"Alte Ziegelsteine, Backstein, Mauerziegel - Historische Ziegelstein…",Rohbau,Mauerwerk,2023-01-09,,"Sonderaktion: Nur für kurze Zeit: 50% günstiger: 0,79€ anstatt 1,34€ pro Stück.Mauersteine / Klinker / Backsteine im alten Reichsformat und Klosterformat aus dem selektivem Rückbau.restado ist der führende Anbieter und Ihr kompetenter Partner für historische Ziegelsteine in Deutschland. Wir lagern über 2 Millionen Ziegelsteine verschiedener Herkunft und Formate.Unsere Ziegelsteine stammen aus Rückbauprojekten und sind händisch aufbereitet. Mit diesen Ziegelsteinen können Sie Ihr individuelles Projekt realisieren.restado ist der größte Anbieter von alten Ziegelsteinen in Deutschland. Auf uns können Sie bauen.Zwei Varianten der alten Ziegelsteine:1. Variante: Reichsformat (gängiges Format): Breite x Tiefe x Höhe: 25cm x 12,5cm x 6,5cm Ergiebigkeit: 52-54 Steine pro m² Härte: Hart  2. Variante: Klosterformat: Breite x Tiefe x Höhe: 29cm x 13cm x 7cm Ergiebigkeit: 40 Steine pro m² Härte: Mittel-HartAlle Steine können für den Außenbereich genutzt werden und sind frostsicher. Da die Zielgesteine handgeformt wurden, können die Maße leicht abweichen (bis zu 15%).Ursprung:Aus Rückbaugebäuden wie z.B. alten Gutshäuser im alten Kaiserreich. Diese wurden hochwertig aufbereitet, so dass diese wiedergenutzt werden können.Verfügbare Farben:Gemischte rot-töneGelbDurch unsere verschieden Abrisse sind immer unterschiedliche Farbtöne verfügbar. Wenn Sie genaue Vorstellungen der Ziegelsteine haben, können Sie auch Fotos an [email protected] schicken.Anwendungsmöglichkeiten:Historische Ziegel eigenen sich zum Beispiel für den Bau von traditionellen Fassaden oder auch zur Gartengestaltung. Die Möglichkeiten sind immens und Sie können Ihrer Inspiration freien Lauf lassen. Kunden haben bereits Fassaden, Innenwände, (Ziegel-)Mauern, Bodenbeläge, Pflasterwege, Ruinenmauern, Pizzaöfen, Gartengrills, Brotöfen und viel mehr aus unseren Ziegeln gebaut. Diese sind für außen und innen geeignet.Transport & Abladung:Die Versandkosten werden Ihnen nach der Anfrage mitgeteilt oder gerne auch per Mail an [email protected]Bei der Anlieferung müssen Sie für die Abladung sorgen (z.b. händisch oder per Gabelstapler). Ab einer Bestellmenge von 1.500 Steinen kann diese zugebucht werden. Ab 5.000 Steinen ist die Abladung im Preis inbegriffen.Die Ziegelsteine werden auf Europlatten gelieferte und sind foliert, sodass diese aussen (auch bei Frost) gelagert werden können.Die Steine aus Handbruch sind geprüft, können jedoch auch gewöhnliche Nutzungsspuren wie z.B. Bruchspuren und Mörtelreste (mit der Hand entfernbar) enthalten. Es handelt sich um gebrauchte Steine die bereits bis zu 150 Jahre in Gebäuden eingebaut waren. Jeder Stein erzählt dadurch eine einzigartige Geschichte und hat seinen eigenen Charme. Diese können nicht mit neuen Ziegelsteinen aus dem Baumarkt verglichen werden, aber genau deshalb kaufen unsere Kunden mehrere Millionen dieser Steine jedes Jahr.Zahlung:Sie können bei uns mit allen gängigen Zahlungsarten wie z.B. Rechnung (Klarna), Vorkasse, PayPal (mit Käuferschutz) oder Kreditkarte bezahlen.Muster-Ziegelsteine:Wir können Ihnen Mustersteine bei Abnahme einer größeren Menge liefern. Alternativ können Sie uns in unserem Lager in Berlin-Neukölln besuchen oder auch per Videoanruf das Lager zeigen lassen.Weitere Fragen:Kontaktieren Sie uns gerne, in dem Sie oben auf ""Anfrage stellen"" klicken oder eine Mail an [email protected] schicken.Über restado:Wir sind Ihr Spezialist für Ziegel im Reichsformat & Klostererformat in Deutschland. Wir haben mit mehreren Millionen alten Klinker den größten Bestand in Deutschland. Dadurch bieten wir ein großes Sortiment und können jeden Tag hunderte Kunden glücklich machen.Informationen:Verfügbare Farben: Rot / Orange, Gelb / Rosé, Rot, GelbMaße: 25 x 12 x 6,5 cmFormat: Alte Reichsformatziegel und KlosterformatUrsprung: Alte Ziegelsteine aus RückbautenVerfügbarkeit: Lagerware beträgt immer ca. 300.000 ZiegelFragen, Bestellung aufgeben oder Beratung:Sie benötigen eine individuelle Beratung zu den Ziegeln oder möchten eine Bestellung aufgeben? Telefon: 0711 400 990 97 E-Mail: [email protected]",Guter Zustand (rückgebaut & aufbereitet),"0,79€ / Stück",300.000 Stück verfügbar,(1.000 Stück Mindestabnahme),Guter Zustand (rückgebaut & aufbereitet),,{},0.79,300000.0,0.79,300000.0,"0,79€ / Stück",300.000 Stück verfügbar,0.0,,[],"Old bricks , bricks , wall bricks - historical bricks…",Masonry cement,Engineering bricks,Pr_20_93_52_27,"Wall, Barriers, Pannels","Blocks, Panels, Fences, Bricks",Masonry walling units,,0.0
2244,2244,3186,https://restado.de/baustoff/glasbaustein-la-rochere/,Glasbaustein La Rochère,Rohbau,Mauerwerk,2023-01-09,,"22 Stück Glasbausteine von La Rochère . Unbenutzt, da zu viele gekauft.  Neupreis 120.- Euro",Neu,5€ (VB) / Stück,22 Stück verfügbar,(1 Stück Mindestabnahme),Neu,,{},5.0,22.0,5.0,22.0,5€ (VB) / Stück,22 Stück verfügbar,0.0,,[],Glass building block La Rochere,Architectural glass,Glass blocks,Pr_20_93_33_34,"Wall, Barriers, Pannels","Blocks, Panels, Fences, Bricks",Glass blocks and panels,,0.0
2245,2245,3146,https://restado.de/baustoff/mauersteine/,Mauersteine,Rohbau,Mauerwerk,2023-01-09,,"Mauersteine zum vermörteln oder verkleben, 3 Paletten in verschiedenen Farben vorhanden, farblicher Hauptanteil ist ""Schilfsand"". Geeignet zur Hanhabfangung, Gartenmauern, Beeteinfassungen usw.. Mase L/B/H 30-50 cm/25 cm/7,5 cm. Nur Abholung.",Neuwertig,"270,01€ (VB) / Paletten",3 Paletten verfügbar,(inkl. 19% MwSt.),Neuwertig,,{},270.01,3.0,270.01,3.0,"270,01€ (VB) / Paletten",3 Paletten verfügbar,0.0,,[],bricks,Concrete,Engineering bricks,Pr_20_93_52_27,"Wall, Barriers, Pannels","Blocks, Panels, Fences, Bricks",Masonry walling units,,0.0
2260,2260,126486,https://restado.de/baustoff/ziegel-3/,Ziegel,Rohbau,Mauerwerk,2023-04-12,,,,,,,,,{},0.0,0.0,0.0,0.0,,,0.0,,['https://restado.de/wp-content/uploads/products/2023/05/e06e1ab2-img20230423110707.jpg'],brick,Concrete,Engineering bricks,Pr_20_93_52_27,"Wall, Barriers, Pannels","Blocks, Panels, Fences, Bricks",Masonry walling units,,0.0
2269,2269,80518,https://restado.de/baustoff/21-bauder-daemmplatten-1200x600mm/,Bauder Dämmplatten 1200x600mm,Rohbau,Dämmung,2023-01-09,,"7 Packungen vorhanden a 3 Platten.  Insgesamt 21 Platten.  Sind nach unserer Haus Sanierung übrig geblieben.  Preisvorschlag gerne per PN.  Bauder Dämmplatten mit Stufenfalz PIR FA TE F Dachdämmung  Die Bauder Dämmplatten mit Stufenfalz PIR FA TE werden als Wärmedämmung mit geringer Wärmeleitfähigkeit eingesetzt.  Die Platten sind frei von halogenierten Treibmitteln und HBCD. Eine mögliche Lagerung der Dämmplatten sollte nicht unter direkter Sonneneinstrahlung sowie vor Feuchtigkeit geschützt erfolgen.  Vorteile:  blendarme Oberfläche  leichte und schnelle Verarbeitung  geringe Rohdichte  hohe Druckfestigkeit  für den Einsatz auf dem leichten Industriedach  gute Wärmedämmeigenschaft  großformatige und leichte Dämmplatten  beidseitige Deckschicht aus Aluminium, verschiedene Höhen  1200x600 mm  Höhe 160mm",Neu,60€ (VB) / Paket,7 Paket verfügbar,(1 Paket Mindestabnahme),D-74909 Meckesheim,Bauder,"{""Dicke (mm)"": ""160"", ""Länge (mm)"": ""1200"", ""Breite (mm)"": ""600 mm""}",60.0,7.0,60.0,7.0,60€ (VB) / Paket,7 Paket verfügbar,0.0,,['https://restado.de/wp-content/uploads/products/2021/08/5494e2f0-img-20210717-wa0001.jpg'],Bauder insulation panels xmm,Insulating glass,Rigid insulation boards and panels,Pr_25_71_70,"Wall, Barriers, Pannels","Blocks, Panels, Fences, Bricks",Glass blocks and panels,,0.0
2270,2270,76620,https://restado.de/baustoff/bodendaemmplatten/,Bodendämmplatten,Rohbau,Dämmung,2023-01-09,,Ich habe noch Styropor übrig Bodendämmplatten EPS 035 DEO  15 Pack Brohlburg 1000 x 500 x 30 mm 5 Pack Geissner 1000x500x30 mm 2 Pack Geissner 1000x500x60 mm,Neu,18€ (VB) / Paket,20 Paket verfügbar,(1 Paket Mindestabnahme),D-72144 Dußlingen,,{},18.0,20.0,18.0,20.0,18€ (VB) / Paket,20 Paket verfügbar,0.0,,"['https://restado.de/wp-content/uploads/products/2021/06/121f831b-20210602_184525-scaled.jpg', 'https://restado.de/wp-content/uploads/products/2021/06/82d59a7d-20210601_181800-scaled.jpg', 'https://restado.de/wp-content/uploads/products/2021/06/504c4d85-20210601_181800-scaled.jpg']",Floor insulation panels,Insulating concrete,Rigid insulation boards and panels,Pr_25_71_70,"Roof, Slabs, Stairs","Blocks, Panels, Fences, Bricks",Glass blocks and panels,,0.0
2271,2271,75948,https://restado.de/baustoff/kork-korkplatten-daemmkork-oekologisch-bauen/,"Kork, Korkplatten, Dämmkork, ökologisch bauen",Rohbau,Dämmung,2023-07-05,,"expandierte Kork-Dämmplatten, geeignet für Schall- und Wärmedämmung, Stärke 40 mm, Plattengröße 1000x500 mm (teilweise auch kleiner), gesamt ca. 560 qm, per qm 14,- Euro Stärke 80 mm, Plattengröße 1000x500 mm (teilweise auch kleiner), gesamt ca. 145 qm, per qm 24,- Euro alles komplett ohne Klebstoffreste!!! bei Komplettübernahme Sonderpreis möglich!!!",Gebraucht,14€ (VB) / m²,560 m² verfügbar,(100 m² Mindestabnahme),D-20095 Hamburg,,{},14.0,560.0,14.0,560.0,14€ (VB) / m²,560 m² verfügbar,0.0,,['https://restado.de/wp-content/uploads/products/2021/05/9aecf286-59.jpg'],"Cork , cork boards , insulating cork , build ecologically",Cork,Corkboards,Pr_25_71_97_16,Other,"Blocks, Panels, Fences, Bricks",Other,,0.0
2272,2272,73860,https://restado.de/baustoff/isover-styrodur-2800c-hartschaumplatten/,ISOVER Styrodur 2800C Hartschaumplatten,Rohbau,Dämmung,2023-01-09,, ,Neu,10€ (VB) / Stück,3 Stück verfügbar,(2 Stück Mindestabnahme),D-85716 Unterschleißheim,,"{""Serie"": ""Styrodur 2800 C stumpf WLG 035"", ""Dicke (mm)"": ""120 mm"", ""Länge (mm)"": ""1250 mm"", ""Breite (mm)"": ""600 mm"", ""Brandverhalten"": ""normal entflammbar"", ""Wärmeleitfähigkeit (W/mK)"": ""0.035"", ""Druckfestigkeit (kPa)"": ""300""}",10.0,3.0,10.0,3.0,10€ (VB) / Stück,3 Stück verfügbar,0.0,,[],Styrodur rigid foam panels,Foam,Flexible foam rods,Pr_20_76_63_30,Other,"Blocks, Panels, Fences, Bricks",Glass blocks and panels,,0.0
2274,2274,71333,https://restado.de/baustoff/korkplatten/,"Kork, Korkplatten, Dämmkork, ökologisch bauen",Rohbau,Dämmung,2023-10-17,,"Stärke 80 mm, Plattengröße 1000x500 mm (teilweise auch kleiner), gesamt ca. 145 qm, per qm 24,- Euro absolut ohne Klebstoffrückstände, Nur Selbstabholung, bei Komplettübernahme Sonderpreis möglich",Gebraucht,24€ (VB) / m²,145 m² verfügbar,(77 m² Mindestabnahme),D-20095 Hamburg,,{},24.0,145.0,24.0,145.0,24€ (VB) / m²,145 m² verfügbar,0.0,,['https://restado.de/wp-content/uploads/products/2021/05/6c1bf237-59-1.jpg'],"Cork , cork boards , insulating cork , build ecologically",Cork,Corkboards,Pr_25_71_97_16,Other,"Blocks, Panels, Fences, Bricks",Other,,0.0
2285,2285,42815,https://restado.de/baustoff/multipor-daemmplatten-600x390x100-mm/,"33,7 m² Multipor Dämmplatten 600x390x100 mm auf 2 Paletten",Rohbau,Dämmung,2023-01-18,,"Ware ist unbenutzt auf 2 Paletten Je 16,85 m² Abnahme bitte komplett",Neu,650€ (VB) / Stück,1 Stück verfügbar,(1 Stück Mindestabnahme),D-53909 Zülpich,,"{""Serie"": ""Multipor"", ""Dicke (mm)"": ""100 mm"", ""Breite (mm)"": ""600 mm"", ""Brandverhalten"": ""Nicht brennbar"", ""Kantenausbildung"": ""glatte Kante""}",650.0,1.0,650.0,1.0,650€ (VB) / Stück,1 Stück verfügbar,0.0,,[],. m² Multipor insulation panels xx mm on pallets,Insulating glass,Structural insulated panel (SIP) modules,Pr_20_65_60_84,Other,"Blocks, Panels, Fences, Bricks",Glass blocks and panels,,0.0
2291,2291,35879,https://restado.de/baustoff/puren-mv-kd-80-polyurethan-hartschaum-daemmplatten-pu-027/,PUREN MV-KD 80 Polyurethan-Hartschaum-Dämmplatten PU 027,Rohbau,Dämmung,2023-01-09,,"Gut geeignet für die Dämmung der Kellerdecke. Einfach zu verarbeiten (Heimwerker geeignet). Quadratmeterpreis unter 20€. Ein Paket enthält 4,3 Quadratmeter.",Neuwertig,91€ (VB) Paketpreis,13 m² verfügbar,(13 m² Mindestabnahme),D-12247 Berlin,,"{""Serie"": ""MV-KD"", ""Breite (mm)"": ""600 mm"", ""Anwendungsbereich"": ""Kellerdecke""}",91.0,13.0,91.0,13.0,91€ (VB) Paketpreis,13 m² verfügbar,0.0,,[],polyurethane rigid foam insulation panels,Polyurethane resin,Polyurethane (PUR) foam insulation,Pr_25_31_28_67,Other,"Blocks, Panels, Fences, Bricks",Glass blocks and panels,,0.0
2298,2298,12914,https://restado.de/baustoff/deckoplatten-kellerdeckendaemmung/,Deckoplatten Kellerdeckendämmung,Rohbau,Dämmung,2023-01-09,,"Paketinhalt: 2 m². Wir haben drei Pakete ab zu geben. Preis je Paket  Die Kellerdecken-Dämmelemente sind aus hochwertigem Polystyrol-Hartschaum in der Wärmeleitgruppe 035 gefertigt. Die einzelnen Elemente sind 120 mm stark, 500 x 500 mm groß und haben eine Deckfläche von 488 mm x 488 mm. Eine umlaufende Nut- und Federverbindung ermöglicht die einfache Montage, gefaste Kanten sorgen für eine ansprechende Optik.",Neu,29€ / m²,6 m² verfügbar,(2 m² Mindestabnahme),Neu,,{},29.0,6.0,29.0,6.0,29€ / m²,6 m² verfügbar,0.0,,[],Decko panels basement ceiling insulation,Insulating concrete,Rigid insulation boards and panels,Pr_25_71_70,Other,"Blocks, Panels, Fences, Bricks",Glass blocks and panels,,0.0
2328,2328,5618,https://restado.de/baustoff/handlauf-fuer-gelaender-holz-fuer-moebelbau-kerzenstaender-upcycling/,"Handlauf für Geländer, Holz für Möbelbau, Kerzenständer, Upcyc…",Rohbau,Sonstiges,2023-01-09,,"Die Multplex-Platten hatten eine Stärke von 90 mm. Daraus wurden die Handläufe geformt. Sie eignen sich für die Weiterverwendung als Handlauf und weitere Zwecke, z.B. Möbelbau, Upcycling - oder eine Serienproduktion für Kerzenständer. 7 Handläufe: 219 x 9 cm 8 Handläufe 142 x 9 cm Weitere Details siehe Foto oder Besichtigung in der Bauteilbörse Hannover. Der Preis von 9 Euro bezieht sich auf den Stückpreis. Bei Abnahme der Gesamtmenge erhalten Sie ein individuelles Angebot. Breite:    Höhe:    Länge/Tiefe:    Gewicht / Stk.:    Baujahr:   Material:  Buche-Multiplex Farbe:  hellbraun/Buche Verfügbar ab: sofort", gut,135€ Paketpreis,15 Stk. verfügbar,(15 Stk. Mindestabnahme),gut,,{},135.0,15.0,135.0,15.0,135€ Paketpreis,15 Stk. verfügbar,0.0,,[],"Handrail for railings , wood for furniture construction , candlestick , upcyc ...",Wood,Wood handrails,Pr_25_30_36_96,"Roof, Slabs, Stairs","Blocks, Panels, Fences, Bricks",Handrails,,0.0
2348,2348,117507,https://restado.de/baustoff/daemmplatten-neo-wall-180mm/,"Dämmplatten Neo Wall, 180mm",Fassade,Fassadendämmung,2023-01-09,, ,Neuwertig,"19,50€ (VB) / Paket",17 Paket verfügbar,(1 Paket Mindestabnahme),D-82402 Seeshaupt,Baumit,"{""Material"": ""EPS"", ""Wärmeleitgruppe"": ""032"", ""Anwendungsbereich"": ""Vollwärmeschutz"", ""Brandschutzklasse"": ""B1 (schwerentflammbar)"", ""Dämmstärke"": ""180 mm""}",19.5,17.0,19.5,17.0,"19,50€ (VB) / Paket",17 Paket verfügbar,0.0,,['https://restado.de/wp-content/uploads/products/2022/12/c2b9c18e-20221209_1328021-scaled.jpg'],"Neo Wall insulation panels , mm",Insulating glass,Faced insulating wall panels,Pr_25_71_14_29,"Wall, Barriers, Pannels","Blocks, Panels, Fences, Bricks",Walling units,,0.0
2359,2359,92816,https://restado.de/baustoff/pu-wandpaneele/,PU-Wandpaneele,Fassade,Fassadendämmung,2023-01-09,1690588800000.0,"Verkaufe PU-Wandpaneele, verschiedene Formate und Farben, laut Liste. Auch nach Wunsch vorbestellbar.",Neu,23€ (VB) / m²,20.000 m² verfügbar,(700 m² Mindestabnahme),AT-4221,,{},23.0,20000.0,23.0,20000.0,23€ (VB) / m²,20.000 m² verfügbar,1.0,17366400000.0,"['https://restado.de/wp-content/uploads/products/2022/03/311f4989-pu-paneele.jpg', 'https://restado.de/wp-content/uploads/products/2022/03/9dc28e5d-paneele_2.jpg', 'https://restado.de/wp-content/uploads/products/2022/03/241d4537-pu-paneele.jpg']",wall panels,Sheet glass,Wall protection panels,Pr_35_90_43_86,"Wall, Barriers, Pannels","Blocks, Panels, Fences, Bricks",Glass blocks and panels,201.0,0.0
2360,2360,91887,https://restado.de/baustoff/daemmplatten-gebraucht-verschiedene-laengen/,Dämmplatten gebraucht verschiedene Längen,Fassade,Fassadendämmung,2023-03-16,1696896000000.0,Gebrauchte dämmplatten verschiedene Längen verschiedener Zustand gg Abholung im Deizisau... beschädigte gibt es gratis dazu,Gebraucht,1€ / Stück,20 Stück verfügbar,(1 Stück Mindestabnahme),D-73779 Deizisau,,{},1.0,20.0,1.0,20.0,1€ / Stück,20 Stück verfügbar,1.0,17971200000.0,['https://restado.de/wp-content/uploads/products/2022/02/107ad041-20220218_170942-scaled.jpg'],Insulation panels are used in different lengths,Insulating glass,Rigid insulation boards and panels,Pr_25_71_70,"Wall, Barriers, Pannels","Blocks, Panels, Fences, Bricks",Glass blocks and panels,208.0,0.0
2363,2363,83178,https://restado.de/baustoff/knauf-steinwolle-daemmplatten/,Knauf Steinwolle Dämmplatten,Fassade,Fassadendämmung,2023-01-09,1687305600000.0,Zu verkaufen stehen cca. 600 pakete KnaufInsulation DPF-50 Steinwolle Dämmplatten.   Hersteller: Knauf  Wärmeleitgruppe: 035 Dämmstarke: 80mm  Material: Steinwolle Brandschutzklasse: A1 (nicht brennbar)    Ware befindet sich in Berlin.  Kontakt: 015254384166,Neu,20€ (VB) / Paket,600 Paket verfügbar,(300 Paket Mindestabnahme),D-10178 Berlin,,{},20.0,600.0,20.0,600.0,20€ (VB) / Paket,600 Paket verfügbar,1.0,14083200000.0,"['https://restado.de/wp-content/uploads/products/2021/10/ee097c7e-c8160685-acbc-4d7b-a7e1-fa5329f55f00.jpeg', 'https://restado.de/wp-content/uploads/products/2021/10/709501c9-fcb9ef31-e503-4907-a75b-41b8d3cb0a93.jpeg']",Knauf rock wool insulation panels,Glass wool,Mineral wool insulation,Pr_25_57_06_53,Other,"Blocks, Panels, Fences, Bricks",Glass blocks and panels,163.0,0.0
2369,2369,65798,https://restado.de/baustoff/eps-wdv-fassaden-daemmplatten/,EPS-WDV-Fassaden Dämmplatten,Fassade,Fassadendämmung,2023-01-09,1687219200000.0,Verkaufe insgesamt 16qm neue EPS-WDV-Fassaden Dämmplatten 16 Pakete a 1qm Wärmeleitgruppe: 035 Materialspezifizierung: EPS (expandiertes Polystyrol) Nutzmaß: 1000*500mm Kantenausprägung: Stumpf Nenndicke: 200mm,Neu,18€ (VB) / Stück,16 Stück verfügbar,(1 Stück Mindestabnahme),D-32547 Bad Oeynhausen,HIRSCH Porozell GmbH,"{""Material"": ""Kunststoff"", ""Wärmeleitgruppe"": ""035"", ""Anwendungsbereich"": ""Wand"", ""Brandschutzklasse"": ""B1 (schwerentflammbar)"", ""Dämmstärke"": ""200 mm""}",18.0,16.0,18.0,16.0,18€ (VB) / Stück,16 Stück verfügbar,1.0,13996800000.0,"['https://restado.de/wp-content/uploads/products/2020/11/b5ff99f1-00012-scaled.jpg', 'https://restado.de/wp-content/uploads/products/2020/11/b124ec06-0001-scaled.jpg']",facade insulation panels,Insulating glass,Faced insulating wall panels,Pr_25_71_14_29,"Wall, Barriers, Pannels","Blocks, Panels, Fences, Bricks",Glass blocks and panels,162.0,0.0
2378,2378,126110,https://restado.de/baustoff/claytec-leichtlehmsteine-nf-1200/,CLAYTEC Leichtlehmsteine NF 1200,Rohbau,Sonstiges,2023-04-04,,,,,,,,,{},0.0,0.0,0.0,0.0,,,0.0,,[],light clay bricks,Clays,Clay bricks,Pr_20_93_52_15,"Roof, Slabs, Stairs","Blocks, Panels, Fences, Bricks",Masonry walling units,,0.0
2387,2387,6759,https://restado.de/baustoff/dmmung-isover-ultimate-isover-kontur-fassadendmmung-perlit/,"Dämmung, Isover Ultimate, Isover Kontur, Fassadendämmung, Perlit",Fassade,Fassadendämmung,2023-01-09,,"Diverse Dämmung an Selbstabholer abzugeben  - 1 Rolle Randdämmstreifen 150 mm x 8 mm (25 m Rolle) - 2 Säcke DS Perlit (100 ltr/Sack) - 8 Pack Neopor-Fassadenplatten 032 1000 x 500 mm 50 mm - 10 Rollen Isover Ultimate UF 040 Universal-Filz 80 mm, Abmessung: 0,8 x 1,2 m - 11 Pack Isover Kontur KP1 WLG 035 60 mm Kerndämmplatte, Abmessungen: 1,25 m x 0,625 m x 0,06 m  Neuwert ca. 660 € Als Komplettpaket für 550 € abzugeben Versand ist leider nicht möglich",Neu,550€ / Stück,1 Stück verfügbar,(1 Stück Mindestabnahme),Neu,,{},550.0,1.0,550.0,1.0,550€ / Stück,1 Stück verfügbar,0.0,,[],"Insulation , Isover Ultimate , Isover Kontur , facade insulation , perlite",Perlite aggregates,Perlite loose insulation,Pr_25_31_48_61,"Wall, Barriers, Pannels","Blocks, Panels, Fences, Bricks",Unit covering and finish products,,0.0
2390,2390,2584,https://restado.de/baustoff/brillux-wdv-system-qju-fassaden-dmmplatten-dmmung/,Brillux WDV-System Qju Fassaden Dämmplatten / Dämmung,Fassade,Fassadendämmung,2023-01-09,,"Brillux WDV-System Qju Fassaden Dämmplatte  150mm dick, 1,5 Meter x 0,50 Meter, insgesamt 7,5 m²  5 Pakete à 3 Platten, original eingeschweißt, für Selbstabholer.  Einkaufspreis: pro m² 17,50 €, Gesamtpreis 131,25 €  nur komplett abzuholen in 47877 Willich",Neu,100€ Paketpreis,5 Stück verfügbar,(5 Stück Mindestabnahme),Neu,,{},100.0,5.0,100.0,5.0,100€ Paketpreis,5 Stück verfügbar,0.0,,[],Brillux system Qju facade insulation panels/insulation,Insulating glass,Concrete structural insulated panels (SIPs),Pr_20_93_85_16,"Wall, Barriers, Pannels","Blocks, Panels, Fences, Bricks",Glass blocks and panels,,0.0
2393,2393,121724,https://restado.de/baustoff/mammut-pvc-kunststoff-paneele/,Mammut PVC Kunststoff Paneele,Fassade,Fassadenverkleidung,2023-01-09,,"Verkauft werden PVC Kunststoff Paneelen Hersteller ""Mammut"", Farbe weiss, Menge: 144 qm, das sind 120 Paneelen, 24 Pakete, 1 Paket= 5 Stk. Masse: 6000 x 200 x 17 mm  Preis ist verhandelbar!  Dank seiner Schlüsseleigenschaften wie Wartungsfreiheit und lange Nutzungsdauer ist es eine perfekte Alternative zu Holz. Kunststoffdielen werden hauptsächlich im Außenbereich (Dachuntersichten, Dachluken, Fassaden, Giebel usw.) sowie im Innenbereich (insbesondere Wandverkleidungen) verwendet. Dielen sind UV-stabil und können daher in der Sonne verwendet werden.  Da es ein Sonderpreis ist, können wir keine Garantie und Rückgaberecht gewähren.",Neu,170€ (VB) / Paket,24 Paket verfügbar,(1 Paket Mindestabnahme),D-46446 Emmerich,,"{""Material"": ""Kunststoff""}",170.0,24.0,170.0,24.0,170€ (VB) / Paket,24 Paket verfügbar,0.0,,"['https://restado.de/wp-content/uploads/products/2023/03/c8a54eec-img_4750-rotated.jpg', 'https://restado.de/wp-content/uploads/products/2023/03/d6293ca7-img_4740-rotated.jpg', 'https://restado.de/wp-content/uploads/products/2023/03/524313a1-img_4741-rotated.jpg', 'https://restado.de/wp-content/uploads/products/2023/03/37cc89cc-img_4749-rotated.jpg']",Mammut plastic panels,Plastics,Plastics panels,Pr_25_71_57_63,"Wall, Barriers, Pannels","Blocks, Panels, Fences, Bricks",Glass blocks and panels,,0.0
2395,2395,119464,https://restado.de/baustoff/fassade-daemmung-energie-sparen-echte-alte-gebrauchte-back-steine-ziegelsteine-nostalgischer-look/,Fassade Dämmung Energie sparen echte alte gebrauchte Back Steine Z…,Fassade,Fassadenverkleidung,2023-01-09,,"Nachhaltig, Klimaneutral, formschön, trendig  Unsere Antikriemchen werden aus original historischen Backsteinen,  vom Handrückbau über 100 Jahre alter Ziegelgebäuden, aus regionalen Rückbauvorhaben, geschnitten   Die glatten Innenschnitte mit natursteinartigem Design  werden mit einer Steintrennmaschine aufgeschnitten.   Preis je 1 m², incl. dt. MwSt. 19 %, ab 100 m² Bestellmenge.  Ergiebigkeit 52 Stck/ m².  Maße: 25x6,5x2 cm  Transportkosten auf Anfrage.   Bezugnahme auf Art-Nr: Rm rt glatt Rad 11-22  Antik-Stein auch auf Facebook, Pinterest & youtube",Gebraucht,39€ / m²,500 m² verfügbar,(100 m² Mindestabnahme),D-06120 Halle (Saale),,{},39.0,500.0,39.0,500.0,39€ / m²,500 m² verfügbar,0.0,,"['https://restado.de/wp-content/uploads/products/2023/01/b2702a6e-collage-herstellung-deutsch.jpg', 'https://restado.de/wp-content/uploads/products/2023/01/500241eb-urano-09-28-22-rm-rt-bunt-v3-2.jpg', 'https://restado.de/wp-content/uploads/products/2023/01/5a2004de-vk-176-21-rm-preussisch-rado-21-4.jpg', 'https://restado.de/wp-content/uploads/products/2023/01/6c039a4a-urano-09-28-22-rm-rt-bunt-v3.jpg', 'https://restado.de/wp-content/uploads/products/2023/01/be829244-rm-glatt-rot-doelau.jpg', 'https://restado.de/wp-content/uploads/products/2023/01/41516d08-rm-glatt-rot-doelau-4.jpg', 'https://restado.de/wp-content/uploads/products/2023/01/fb43902b-vk-127-31-5-21-rm-rt-pruskje-160-qm-2.jpg']",Facade insulation save energy real old used bricks ...,Insulating concrete,Engineering bricks,Pr_20_93_52_27,"Roof, Slabs, Stairs","Blocks, Panels, Fences, Bricks",Masonry walling units,,0.0
