,Unnamed: 0,Nr,URL,Title,Category,Subcategory,Saved,LastUpOn,Description,Zustand,FirstPrice,FirstAvailable,MinAmount,Location,Hersteller,Properties,FirstPriceNumeric,FirstAvailableNumeric,LastPriceNumeric,LastAvailableNumeric,LastPrice,LastAvailable,Sold,SoldAfter,Imagefile,Title_en,material_emb,German_Raw,German_Code,first_level,second_level,third_level,SoldAfterDays,StockChange
2862,2862,124256,https://restado.de/baustoff/glastrennwand-raumteiler-glasscheibe-zum-selbstausbauen/,Glastrennwand Raumteiler Glasscheibe zum Selbstausbauen,Innenausbau,Sonstiges,2023-03-07,1679097600000.0,"VB - das was die Elemente ""wert"" sind; im Müll sollen sie nicht landen: zum Selbstabbau in Bochum, RuhrPark, werden diese Glasscheiben / Metallrahmen / kompletten Elemente angeboten +++ siehe Fotos +++  2 Glastrennwände - je circa 620 cm breit, 312 cm hoch - eine Glaswand mit Türelement, ohne Griffstangen - alle Scheiben vorhanden! - Scheiben: 2x4mm Sicherheitsglas - die Folie auf den Scheiben lässt sich ablösen - Metallprofile/-pfosten: 4,5 cm breit, 12 cm tief  Glastrennwand circa 210 cm breit, 210 cm hoch - Metallrahmen - Sicherheitsglas  Fenster, festverglast, - circa 176 cm breit, 124 cm hoch -Sicherheitsglas  große Glastrennwand - letztes Foto - - Sicherheitsglas - manche Scheiben und die Griffstangen stehen nicht mehr zur Verfügung",Gebraucht,2.023€ / Stück,5 Stück verfügbar,(1 Stück Mindestabnahme),D-44791 Bochum,,{},2023.0,5.0,2023.0,5.0,2.023€ / Stück,5 Stück verfügbar,1.0,950400000.0,"['https://restado.de/wp-content/uploads/products/2023/04/4285ae59-festverglasung-b-176-h-124.jpg', 'https://restado.de/wp-content/uploads/products/2023/04/7748b1b4-glaswand-1og-1.jpg', 'https://restado.de/wp-content/uploads/products/2023/04/c84c12b5-glaswand-2og-scaled.jpg']","Glass partition , room divider , glass panel for self-assembly",Architectural glass,Glass panels,Pr_25_71_33_35,Other,"Blocks, Panels, Fences, Bricks",Glass blocks and panels,11.0,0.0
2865,2865,91355,https://restado.de/baustoff/konstruktionsvollholz-fichte-tanne-kiefer/,Konstruktionsvollholz Fichte/Tanne/Kiefer,Innenausbau,Sonstiges,2023-01-09,,Konstruktionsvollholz Fichte/Tanne/Kiefer S10-DIN 4074. Maße pro Stück: ca. 5 m x 6 cm x 18 cm. Ca. 1.000 lfm vorhanden. Preis pro lfm. Nur Selbstabholung in Freiburg.,Neu,7.000€ (VB) Paketpreis,1.000 lfm verfügbar,(1.000 lfm Mindestabnahme),D-79106 Freiburg im Breisgau,,{},7000.0,1000.0,7000.0,1000.0,7.000€ (VB) Paketpreis,1.000 lfm verfügbar,0.0,,['https://restado.de/wp-content/uploads/products/2022/02/c5b9196c-bild-holz.jpg'],Solid construction wood spruce/fir/pine,Spruce,Structural wood composites,Pr_20_85_08_87,Other,"Blocks, Panels, Fences, Bricks",Prefabricated buildings and structures,,0.0
2887,2887,79691,https://restado.de/baustoff/kaminumrandung-kaminverkleidung-kaminbausatzt-kaminportal-sandstein/,Kaminumrandung Kaminverkleidung Kaminbausatzt Kaminportal Sandstein,Innenausbau,Sonstiges,2023-01-09,1687737600000.0,"Zum Verkauf steht eine Kaminumrandung aus Sandstein. Das ist keinen Steinguß - alle Teile sind 100% aus Sandsteinblöcke gefräst, 100% Handarbeit, 100% Unikat!  1000€ (zzgl. MwSt.) Festpreis!  Abmessungen: Breite 135 cm Höhe 119 cm Tiefe 30 cm Gewicht ca. 300 kg  Material: Es handelt sich hierbei um hochqualitativen, frostsicheren Naturstein. Der Farbton reicht von ganz hellgrau bis dunkelbeige mit braunen Adern.  Lagerverkauf: Dillenburger Weg 50, 40229 Düsseldorf. Besichtigung immer Freitags reitags zwischen 14.00 und 17.00 oder nach Terminvereinbahrung am Samstag Vormittag.",Neu,1.200€ / Stück,1 Stück verfügbar,(1 Stück Mindestabnahme),D-40229 Düsseldorf,Sandstein Rusava ,"{""Produkt"": ""Kaminumrandung aus Sandstein""}",1200.0,1.0,1200.0,1.0,1.200€ / Stück,1 Stück verfügbar,1.0,14515200000.0,"['https://restado.de/wp-content/uploads/products/2021/08/a946042c-kamin-1-scaled.jpg', 'https://restado.de/wp-content/uploads/products/2021/08/fae6be58-kamin-4-scaled.jpg']","Fireplace surround , fireplace cladding , fireplace kit , fireplace portal , sandstone",Sandstone,Fireplace surrounds,Pr_70_60_82_32,"Wall, Barriers, Pannels","Blocks, Panels, Fences, Bricks",Glass blocks and panels,168.0,0.0
2905,2905,67669,https://restado.de/baustoff/alte-holzbalken/,alte Holzbalken,Innenausbau,Sonstiges,2023-05-11,1697932800000.0,"15 Balken 15 x 20 5 m lang 10 Balken 13 x15 5 m lang und eine Treppe, sie Bild Als Paket VB 280,-- mit Treppe",Gebraucht,15€ (VB) / Stück,25 Stück verfügbar,(1 Stück Mindestabnahme),D-95680 Bad Alexandersbad,,{},15.0,25.0,15.0,25.0,15€ (VB) / Stück,25 Stück verfügbar,1.0,14169600000.0,"['https://restado.de/wp-content/uploads/products/2021/01/0c84cefb-balken1.jpg', 'https://restado.de/wp-content/uploads/products/2021/01/c5555997-balken2.jpg', 'https://restado.de/wp-content/uploads/products/2021/01/7b56f05e-balken3.jpg']",old wooden beams,Wood,Hardwood beams,Pr_20_85_08_36,"Roof, Slabs, Stairs","Blocks, Panels, Fences, Bricks",Handrails,164.0,0.0
2907,2907,66413,https://restado.de/baustoff/fermacell-schnellbauschraube-39x19mm-1000-stueck-pak/,"Fermacell Schnellbauschraube 3,9x19mm 1000 Stück / Pak.",Innenausbau,Sonstiges,2023-01-09,, ,Neu,"11,48€ / Paket",3 Paket verfügbar,(1 Paket Mindestabnahme),D-93326 Abensberg,Fermacell,"{""Produkt"": ""Schnellbauschraube""}",11.48,3.0,11.48,3.0,"11,48€ / Paket",3 Paket verfügbar,0.0,,['https://restado.de/wp-content/uploads/products/2020/12/5542acb8-fermacellschnellbauschr39x19mm1000st.jpg'],Fermacell drywall screws .xmm pieces / pack .,Bituminous material,Screws,Pr_20_29_76,"Wall, Barriers, Pannels","Blocks, Panels, Fences, Bricks","Lighting columns, brackets and bollards",,0.0
2908,2908,66409,https://restado.de/baustoff/fermacell-schnellbauschraube-39x19mm-250-stueck-pak/,"Fermacell Schnellbauschraube 3,9x19mm 250 Stück / Pak.",Innenausbau,Sonstiges,2023-04-29,, ,Neu,"2,32€ / Stück",20 Stück verfügbar,(1 Stück Mindestabnahme),D-93326 Abensberg,Fermacell,"{""Produkt"": ""Schnellbauschraube""}",2.32,20.0,2.32,20.0,"2,32€ / Stück",20 Stück verfügbar,0.0,,['https://restado.de/wp-content/uploads/products/2020/12/c088f2df-fermacellschnellbauschr39x19mm250st.jpg'],Fermacell drywall screws .xmm pieces / pack .,Bituminous material,Screws,Pr_20_29_76,"Wall, Barriers, Pannels","Blocks, Panels, Fences, Bricks","Lighting columns, brackets and bollards",,0.0
2909,2909,66405,https://restado.de/baustoff/fermacell-schnellbauschraube-39x22mm-250-stueck-pak/,"Fermacell Schnellbauschraube 3,9x22mm 250 Stück / Pak.",Innenausbau,Sonstiges,2023-01-09,, ,Neu,"2,49€ / Stück",2 Stück verfügbar,(1 Stück Mindestabnahme),D-93326 Abensberg,Fermacell,"{""Produkt"": ""Schnellbauschraube""}",2.49,2.0,2.49,2.0,"2,49€ / Stück",2 Stück verfügbar,0.0,,['https://restado.de/wp-content/uploads/products/2020/12/69254828-fermacellschnellbauschr39x22mm250st.jpg'],Fermacell drywall screws .xmm pieces / pack .,Bituminous material,Screws,Pr_20_29_76,"Wall, Barriers, Pannels","Blocks, Panels, Fences, Bricks","Lighting columns, brackets and bollards",,0.0
2922,2922,56262,https://restado.de/baustoff/antik-holz/,Backsteinklinker „Antik“,Innenausbau,Sonstiges,2023-01-09,,"Backsteinklinker „Antik“ Exklusive Wandverkleidung aus 80-130 Jahre altem recycelten Backstein bzw. Ziegelstein! Mit diesem Backsteinklinker verleihen Sie ihrem Projekt den typisch natürlichen Charme alter Gebäude in frischer Optik. Kein neu hergestellter Backsteinklinker kann Ihnen die Wärme und Ausstrahlung unserer alten Backsteinklinker bieten.
Formen, Farben und Patina, beeinflusst von über 80 Jahren verstrichener Zeit, sorgen dafür, dass Ihr nächstes Projekt anders als alle anderen ist. Unsere alten Backsteinklinker werden durch sog. “selektiven Rückbau“ gewonnen. Im Gegensatz zum konventionellen Abriss eines Gebäudes wird dabei auf den Werterhalt der Backsteinklinker gesetzt. Kenner sprechen von Recycling auf höchster Wertstufe. Der Rückbau geschieht in aufwendiger Handarbeit. Alle Backsteinklinker werden einzeln aus dem Mauerverband gelöst, gesäubert und palettiert. Farbabweichungen sind bei keramischen bzw. brand Produkten wie z. B. Klinker oder Backstein kein Reklamationsgrund! Weiterhin sind bei antiken Baumaterialien wie Backsteinklinker oder Abbruchsteinen, Maßdifferenzen kein Reklamationsgrund! Bei der Verlegung/Verarbeitung der Backsteinklinker muss immer gemischt verlegt/verarbeitet werden, um ein optimales Farbspiel bzw. -bild zu erreichen! Weiterhin können bei der Lieferung auch defekte Backsteinklinker dabei sein, auch dies ist kein Reklamationsgrund da Sie diese benötigen um Anfänge oder Versatze zu erstellen! Preis nach Qualitätsstufe und Menge!",Aufbereitet,39€ (VB) / Stück,100.000 Stück verfügbar,(5 Stück Mindestabnahme),Aufbereitet,,{},39.0,100000.0,39.0,100000.0,39€ (VB) / Stück,100.000 Stück verfügbar,0.0,,"['https://restado.de/wp-content/uploads/products/2020/12/d696b4a3-photo-2020-11-07-10-45-23-kopie.jpg', 'https://restado.de/wp-content/uploads/products/2020/12/aa4d6fb1-img_7760.jpg', 'https://restado.de/wp-content/uploads/products/2020/12/c255ec21-hdgw8737.jpg', 'https://restado.de/wp-content/uploads/products/2020/12/13186919-k1600_img_1124.jpg', 'https://restado.de/wp-content/uploads/products/2020/12/f421036a-akpf4458-kopie.jpg']",Brick clinker “ antique ”,Clinker,Clay brick sills,Pr_25_93_52_13,Other,"Blocks, Panels, Fences, Bricks",Shaft-lining products,,0.0
2923,2923,55478,https://restado.de/baustoff/rahmenduebel-10x160/,Rahmendübel 10x160,Innenausbau,Sonstiges,2023-01-09,,"Rahmendübel verzinkt 135 Stück je 0,50 = 67,50",Neuwertig,"67,50€ / Stück",1 Stück verfügbar,(1 Stück Mindestabnahme),D-89423 Gundelfingen an der Donau,Fa.würth,"{""Produkt"": ""Befestigungstechnik""}",67.5,1.0,67.5,1.0,"67,50€ / Stück",1 Stück verfügbar,0.0,,['https://restado.de/wp-content/uploads/products/2020/07/3e24222f-20200706_150259-scaled.jpg'],Frame dowel x,Spandrel glass,Dowels and rods,Pr_20_29_23,Furnishings,"Blocks, Panels, Fences, Bricks",Sectional products,,0.0
2928,2928,125497,https://restado.de/baustoff/fussbodendaemmplatten-puren-fal-wls-024-aus-haussanierung-14-platten-40-mm/,Fußbodendämmplatten (Puren FAL WLS 024) aus Haussanierung (14 Pla…,Innenausbau,Sonstiges,2023-04-04,,,,,,,,,{},0.0,0.0,0.0,0.0,,,0.0,,"['https://restado.de/wp-content/uploads/products/2023/05/62883a62-img_20230420_120120-scaled.jpg', 'https://restado.de/wp-content/uploads/products/2023/05/361c6170-img_20230419_124423-scaled.jpg', 'https://restado.de/wp-content/uploads/products/2023/05/f1811a80-img_20230419_124507-scaled.jpg']",Floor insulation panels Puren from house renovation panels…,Insulating concrete,Rigid insulation boards and panels,Pr_25_71_70,Other,"Blocks, Panels, Fences, Bricks",Glass blocks and panels,,0.0
2929,2929,125507,https://restado.de/baustoff/fussbodendaemmplatten-puren-fal-wls-024-aus-haussanierung-12-platten-50-mm/,Fußbodendämmplatten (Puren FAL WLS 024) aus Haussanierung (12 Pla…,Innenausbau,Sonstiges,2023-04-23,,,,,,,,,{},0.0,0.0,0.0,0.0,,,0.0,,,Floor insulation panels Puren from house renovation panels…,Insulating concrete,Rigid insulation boards and panels,Pr_25_71_70,Other,"Blocks, Panels, Fences, Bricks",Glass blocks and panels,,0.0
2936,2936,44376,https://restado.de/baustoff/innenecken/,Innenecken,Innenausbau,Sonstiges,2023-01-09,,Haben nur 2 Ecken gebraucht. Sind jetzt noch 23 Stück da.,Neu,46€ (VB) Paketpreis,23 Stück verfügbar,(23 Stück Mindestabnahme),D-74889 Sinsheim,Würth,"{""Produkt"": ""Innenecke Cerafix 306""}",46.0,23.0,46.0,23.0,46€ (VB) Paketpreis,23 Stück verfügbar,0.0,,[],Inside corners,Mesh,Corner guards,Pr_35_90_43_15,Openings,"Blocks, Panels, Fences, Bricks",Openings and opening component products,,0.0
2971,2971,8504,https://restado.de/baustoff/sockelleiste-kunststoff-dsp05-2/,Sockelleiste Kunststoff DSP05,Innenausbau,Sonstiges,2023-01-09,,"Sockelleiste Kunststoff DSP05 ist aus hochwertigen Materialien hergestellt. Sie zeichnet sich durch hohe Nutzungsdauer und geringes Gewicht. Die Oberfläche der Sockelleiste ist mit einer dünnen Schicht aus festem Polymer bedeckt, die eine hohe Härte und Beständigkeit gegen Abrieb bietet.  Größe Höhe [cm] : 8 Breite [cm] : 1.8 Länge [cm] : 240   Material : Polymer",Neu,"10,25€ / Stück",1.000 Stück verfügbar,(1 Stück Mindestabnahme),12 Monate Gewährleistung,,{},10.25,1000.0,10.25,1000.0,"10,25€ / Stück",1.000 Stück verfügbar,0.0,,[],Plastic skirting board,Plastics,Plastics skirtings,Pr_35_90_43_63,Other,"Blocks, Panels, Fences, Bricks","Non-rigid sheet, mat and strip covering and finish products",,0.0
2972,2972,8497,https://restado.de/baustoff/fuleiste-von-decor-system-dsp03/,Fußleiste von Decor System DSP03,Innenausbau,Sonstiges,2023-01-09,,Fußleiste von Decor System DSP03 ist aus hochwertigen Polymerwerkstoffen hergestellt. Ihre hohe Effizienz ist mit geringem Eigengewicht möglich. Die Oberfläche der Fußleiste ist mit einer Schicht aus festem Polymer bedeckt.   Größe Höhe [cm] : 8 Breite [cm] : 1.8 Länge [cm] : 240   Material : Polymer,Neu,"10,92€ / Stück",1.000 Stück verfügbar,(1 Stück Mindestabnahme),Neu,,{},10.92,1000.0,10.92,1000.0,"10,92€ / Stück",1.000 Stück verfügbar,0.0,,,Skirting board from Decor System,Surface dressing aggregates,Wood skirtings,Pr_35_90_43_98,Furnishings,"Blocks, Panels, Fences, Bricks","Non-rigid sheet, mat and strip covering and finish products",,0.0
2983,2983,4437,https://restado.de/baustoff/historische-originale-riemchen-verblender/,Historische originale Riemchen Verblender,Innenausbau,Sonstiges,2023-01-09,,"Historisch originale Riemchen Verblender - Klinker Ziegel - Wangenansicht  Sie suchen nach etwas Einzigartigen, Originalen und gleichzeitig 100%  Ökologischen? Sie haben die richtige Adresse gefunden.  Loft-Style-Klinker werden aus Ziegeln, die aus historischen Gebäuden stammen,  hergestellt. Sorgfältig verarbeitet, gewinnen sie ein zweites Leben. Die Ziegel  werden sorgfältig im Rotationsverfahren gereinigt. Dadurch behalten sie ihren  ursprünglichen, einzigartigen Charakter. Jeder von ihnen hat eine einzigartige  Farbe, Muster und Form, da es ein 100% natürliches Produkt ist. Daher  garantieren wir einen einzigartigen dekorativen Effekt.  Wir verwenden nur das exklusivste Veredelungsmaterial, d. h. Klinker, die aus  Abbruchziegeln handgefertigt sind, aus alten historischen Gebäuden stammen  sowie sorgfältig abgerissen wurden. Dadurch erhalten sie einen modernen  Innenraum mit einem echten Geist von Vergangenheit.  Dies ist kein gewöhnlicher dekorativer Akzent! Dies ist ein Schlüsselelement, das  dem gesamten Raum eine bestimmte Atmosphäre verleiht.  Loft-Style-Klinker sind sehr praktisch, langlebig, unempfindlich gegen  Verschmutzung, Beschädigungen und Sonnenstrahlen.  Die Fliesen haben eine einzigartige Form und ungleiche Kanten. Es ist das  exklusivste und begehrteste Veredelungsmaterial, welches ein nahezu perfektes  Seherlebnis bietet.  Dezente Farbabweichungen verstärken das ästhetische Ergebnis.   Preis: 41,00 € / m² bei Abnahme ab 200 m²  Preis: 42,00 € / m² bei Abnahme ab 100 m²  Preis: 43,00 € / m² bei Abnahme von 1 m² - 99 qm   1 m² = ca: 51 Stück = ca. 30 kg (es wurde ca. 1 cm Fuge berücksichtigt)  Hinweis: Für die, die ohne Fuge verkleben möchten, pro m² ca: 10 - 11 Klinker  mehr bestellen!  Sie suchen andere Mengen, rufen Sie an, wir beraten Sie gerne.  Maße:  Länge: ca: 25 cm bis 27 cm  Breite: ca. 6,0 cm - 6,5 cm  Tiefe: ca: 1,8 cm - 2,00 cm  Unser Produkt ist sofort montagefähig.  Wenn Sie die Riemchen befestigt und verfugt haben, bitte diese versiegeln.  (Versieglungsöl auf Anfrage)  Passende Ecken finden Sie in meinen weiteren Angeboten.  Versand oder nach Absprache Selbstabholung und Besichtigung möglich.  Lieferzeit ca. 3 - 4 Werktage. Die Lieferkosten richten sich nach Menge und PLZ.  Bezahlung auch per Nachnahme möglich.",Gebraucht,43€ (VB) / Stück,1.000 Stück verfügbar,(1 Stück Mindestabnahme),D-07551 Gera,Kuschick ,"{""Produkt"": ""Antike Riemchen""}",43.0,1000.0,43.0,1000.0,43€ (VB) / Stück,1.000 Stück verfügbar,0.0,,,Historical original brick facing bricks,Masonry cement,Refractory bricks,Pr_20_93_52_73,"Wall, Barriers, Pannels","Blocks, Panels, Fences, Bricks",Masonry walling units,,0.0
2987,2987,3139,https://restado.de/baustoff/staba-krallen-profilbrett-krallen/,"STABA - Krallen, Profilbrett-Krallen",Innenausbau,Sonstiges,2023-05-24,,250 STABA-Krallen für ca. 10qm zum unsichtbaren verlegen von Profilbrettern.  - Auflagebreite 3cm - für Profilhölzer oder Paneele mit fester Feder - Nutwange 4mm - für Wand und Decke -,Neu,4€ / Stück,1 Stück verfügbar,(1 Stück Mindestabnahme),Neu,,{},4.0,1.0,4.0,1.0,4€ / Stück,1 Stück verfügbar,0.0,,[],"- claws , profile board claws",Shell,Nails,Pr_20_29_56,Other,"Blocks, Panels, Fences, Bricks",Other,,0.0
3003,3003,106024,https://restado.de/baustoff/6-x-lehmputz-fein-30kg-wandputz-fachwerkhaus-baumaterialien/,6 x Lehmputz fein 30kg Wandputz Fachwerkhaus Baumaterialien,Innenausbau,Innenputz,2023-01-09,,"Nur Selbstabholung in Stein b. Nürnberg.    PRIVATVERKAUF  keine Rückgabe, Garantie etc., Irrtum vorbehalten.",Neu,120€ (VB) Paketpreis,6 Stück verfügbar,(6 Stück Mindestabnahme),D-90547 Stein,puclay 333,"{""Gebindeart"": ""Sack"", ""Gebindegröße"": ""30 kg"", ""Geeignet als"": ""Unter und Oberputz"", ""Putzart"": ""3930"", ""Körnung"": ""0/1""}",120.0,6.0,120.0,6.0,120€ (VB) Paketpreis,6 Stück verfügbar,0.0,,"['https://restado.de/wp-content/uploads/products/2022/05/5d9d1fcf-lehmputz1.jpg', 'https://restado.de/wp-content/uploads/products/2022/05/a99e323b-lehmputz2.jpg']",x fine clay plaster kg wall plaster half-timbered house building materials,Masonry cement,Clay plasters,Pr_35_31_64_14,"Wall, Barriers, Pannels","Blocks, Panels, Fences, Bricks",Masonry walling units,,0.0
3005,3005,89235,https://restado.de/baustoff/knauf-bau-und-elektrikergips/,Knauf Bau- und Elektrikergips,Innenausbau,Innenputz,2023-01-09,, ,Gebraucht,0€ / Stück,2 Stück verfügbar,(1 Stück Mindestabnahme),D-80999 Munich,Knauf,{},0.0,2.0,0.0,2.0,0€ / Stück,2 Stück verfügbar,0.0,,['https://restado.de/wp-content/uploads/products/2022/01/1b8dfad4-gips-rotated.jpg'],Knauf construction and electric plaster,Bituminous material,Finish plasters,Pr_35_31_64_32,"Wall, Barriers, Pannels","Blocks, Panels, Fences, Bricks",Masonry walling units,,0.0
3057,3057,63723,https://restado.de/baustoff/ytongmoertel/,Ytongmörtel,Innenausbau,Spachtelmassen & Kleber,2023-01-09,,Es handelt sich um ein Rest von einem 15kg Sack(ca.9kg),Gebraucht,8€ / Stück,1 Stück verfügbar,(1 Stück Mindestabnahme),D-78549 Spaichingen,Ytong,"{""Gebindegröße"": ""15""}",8.0,1.0,8.0,1.0,8€ / Stück,1 Stück verfügbar,0.0,,,Surface mortar,Mortar aggregates,Injection mortars,Pr_20_31_53_42,"Wall, Barriers, Pannels","Blocks, Panels, Fences, Bricks",Masonry walling units,,0.0
3086,3086,86438,https://restado.de/baustoff/betonplatten-4/,Betonplatten,Garten & Freianlagen,Terrassenbeläge,2023-01-09,1692576000000.0, ,Neuwertig,"1,50€ (VB) / Stück",191 Stück verfügbar,(10 Stück Mindestabnahme),D-12309 Berlin,,"{""Länge (cm)"": ""40"", ""Breite (cm)"": ""40"", ""Oberfläche"": ""Glatt"", ""Plattendicke (cm)"": ""4""}",1.5,191.0,1.5,191.0,"1,50€ (VB) / Stück",191 Stück verfügbar,1.0,19353600000.0,['https://restado.de/wp-content/uploads/products/2021/11/76b6ca09-betonplatten-40-x-40-rot-scaled.jpg'],Concrete slabs,Concrete,Concrete solid slabs,Pr_20_85_14_16,"Roof, Slabs, Stairs","Blocks, Panels, Fences, Bricks","Floor plates, gratings and edgings",224.0,0.0
3087,3087,86333,https://restado.de/baustoff/betonplatten-2/,Betonplatten,Garten & Freianlagen,Terrassenbeläge,2023-01-09,1693094400000.0,Wir - Nachbarschaftszentrum Suppenküche Lichtenrade e.V. - sind ein gemeinnütziger Verein und müssen wegen Umzug unsere jetzige Örtlichkeit verkaufen. Wir sind auf den Erlös des Verkaufs angewiesen,Neuwertig,"1,50€ (VB) / Stück",76 Stück verfügbar,(10 Stück Mindestabnahme),D-12305 Berlin,,"{""Länge (cm)"": ""50"", ""Breite (cm)"": ""50"", ""Oberfläche"": ""Glatt"", ""Plattendicke (cm)"": ""5""}",1.5,76.0,1.5,76.0,"1,50€ (VB) / Stück",76 Stück verfügbar,1.0,19872000000.0,['https://restado.de/wp-content/uploads/products/2021/11/0bf5e833-betonplatten-grau-50-x-50--scaled.jpg'],Concrete slabs,Concrete,Concrete solid slabs,Pr_20_85_14_16,"Roof, Slabs, Stairs","Blocks, Panels, Fences, Bricks","Floor plates, gratings and edgings",230.0,0.0
3091,3091,83511,https://restado.de/baustoff/105m2-holzdielen-laerche-gartenbaustoffe-terrassendielen/,"105m2 Holzdielen Lärche, Gartenbaustoffe, Terrassendielen",Garten & Freianlagen,Terrassenbeläge,2023-01-09,1689811200000.0,"EIGENSCHAFTEN  Breite: 100 mm Länge: 2436 mm Stärke: 30 mm  Montageart: mit Stahlgitterrost verschraubt Oberfläche: profiliert  Zusatzinformationen ausgewiesene Länge mit 106 Stk. auf Balkon, verschiedene Längen auf Dachterrasse (5. OG)  Preis pro m2 (ohne Aufbereitung) = 20€ Preis pro m2 (nach Wiederaufbereitung) = 35€",Gebraucht,20€ / Stück,1 Stück verfügbar,(1 Stück Mindestabnahme),D-40213 Düsseldorf,,"{""Oberfläche"": ""Geriffelt"", ""Holzart"": ""Lärche""}",20.0,1.0,20.0,1.0,20€ / Stück,1 Stück verfügbar,1.0,16588800000.0,['https://restado.de/wp-content/uploads/products/2021/10/f79c386a-105m2-holzdielen-laerche-gartenbaustoffe-terrassendielen.jpg'],"m larch wooden floorboards , garden building materials , decking",Wood,Modified wood deck boards,Pr_25_71_97_56,"Roof, Slabs, Stairs","Blocks, Panels, Fences, Bricks",Furnishings,192.0,0.0
3092,3092,82148,https://restado.de/baustoff/terrassenplatten/,Terrassenplatten,Garten & Freianlagen,Terrassenbeläge,2023-01-09,1689206400000.0,"Verkaufe 75m² gebrauchte Terrassenplatten. Maße sind 40 x 40 x 5cm. Platten sind  bereits ausgebaut und auf Paletten gestapelt.  Platten in sehr gutem Zustand  Im näheren Umkreis von Massing können sie auch geliefert werden.  Kleinere Abgaben möglich Preis pro Quadratmeter 5,50 Euro",Aufbereitet,"5,50€ / m³",75 m³ verfügbar,(10 m³ Mindestabnahme),D-84323 Massing,,"{""Länge (cm)"": ""40"", ""Breite (cm)"": ""40"", ""Oberfläche"": ""Glatt"", ""Plattendicke (cm)"": ""5""}",5.5,75.0,5.5,75.0,"5,50€ / m³",75 m³ verfügbar,1.0,15984000000.0,['https://restado.de/wp-content/uploads/products/2021/09/8789c726-img_20210912_180621.jpg'],Terrace tiles,Mosaic glass,Stone tiles,Pr_35_93_96_86,"Roof, Slabs, Stairs","Blocks, Panels, Fences, Bricks",Glass blocks and panels,185.0,0.0
3094,3094,77182,https://restado.de/baustoff/wunderwerk-1964-amsterdam-terrassen-platten/,Wunderwerk 1964 Amsterdam Terrassen Platten,Garten & Freianlagen,Terrassenbeläge,2023-01-09,1691971200000.0,"Wir verkaufen neue Terrassenplatten, die von unserem Bauprojekt übrig geblieben sind.  Infos unter, allerdings in 4 cm Tiefe:  https://www.honer.de/WUNDERWERK-est-1964-AMSTERDAM-Pflaster-braun-nu-60x30x8-cm/p/30354000",Neu,5€ (VB) / Stück,40 Stück verfügbar,(1 Stück Mindestabnahme),D-78582 Balgheim,Wunderwerk 1964 Amsterdam,"{""Länge (cm)"": ""60"", ""Breite (cm)"": ""30"", ""Oberfläche"": ""satiniert"", ""Plattendicke (cm)"": ""4""}",5.0,40.0,5.0,40.0,5€ (VB) / Stück,40 Stück verfügbar,1.0,18748800000.0,,Wunderwerk Amsterdam terrace panels,Decorative aggregates,Window panels,Pr_30_59_97,"Roof, Slabs, Stairs","Blocks, Panels, Fences, Bricks",Glass blocks and panels,217.0,0.0
3106,3106,6377,https://restado.de/baustoff/terrassenplatten-2/,Terrassenplatten,Garten & Freianlagen,Terrassenbeläge,2023-01-09,1689897600000.0,"50 Stk  60 x 40 x 4,5 cm geschliffen und gestrahlt, grau  Nur komplett Abnahme  Nur anrufen 095217200",Neu,350€ Paketpreis,50 Stück verfügbar,(50 Stück Mindestabnahme),Neu,,{},350.0,50.0,350.0,50.0,350€ Paketpreis,50 Stück verfügbar,1.0,16675200000.0,[],Terrace tiles,Mosaic glass,Stone tiles,Pr_35_93_96_86,"Roof, Slabs, Stairs","Blocks, Panels, Fences, Bricks",Glass blocks and panels,193.0,0.0
3109,3109,106620,https://restado.de/baustoff/mediterran-garten-bau-ruinen-mauer-ziegel-gelb-alte-klinker-back-steine-antik-feldbrand-handstrich/,Mediterran Garten Bau Ruinen Mauer Ziegel gelb alte Klinker Back St…,Garten & Freianlagen,Zaun & Mauersysteme,2023-01-09,1682812800000.0,"Wir bieten die außergewöhnliche und einmaligen Gartengestaltung.  Unsere original historischen Klinker stammen vom Rückbau über 100 Jahre alter Gebäude.   Teils neu errichtete Einfamilienhäuser bekommen eine Innen oder Außengestaltung, die einer alten, über 100 Jahre alten Ziegelwand täuschend echt ähnelt.  Das tolle daran: Ihr Projekt ist komplett klimaneutral, da ein bereits verbauter Baustoff wieder verwendet wird.   Ständig große Mengen an unserem Bergelager, sofort transport- und abholfertig  Eine Palette, mit 216 Steinen kostet 259 EUR, incl. MwSt.  passgenaues Angebot bei Angabe der Wunschmeng sowie PLZ, innerhalb von 24 h.  Viele weiter historische Baustoffe an unserem Bergelager.  Antik-Stein auf allen bekannten social media Kanälen",Gebraucht,259€ / Palette,20 Palette verfügbar,(1 Palette Mindestabnahme),D-06120 Halle (Saale),,{},259.0,20.0,259.0,20.0,259€ / Palette,20 Palette verfügbar,1.0,9590400000.0,"['https://restado.de/wp-content/uploads/products/2022/06/6fa1d06c-espitas-mela-2013-2.jpg', 'https://restado.de/wp-content/uploads/products/2022/06/dd46c396-kl-gl-halle-6-22.jpg', 'https://restado.de/wp-content/uploads/products/2022/06/97d4a6f3-kl-gl-in-reihe-am-lager.jpg']",Mediterranean Garden Construction Ruins Wall Brick Yellow Old Clinker Back St…,Clinker,Wall planters,Pr_45_63_63_96,Other,"Blocks, Panels, Fences, Bricks",Masonry walling units,111.0,0.0
