,Unnamed: 0,Nr,URL,Title,Category,Subcategory,Saved,LastUpOn,Description,Zustand,FirstPrice,FirstAvailable,MinAmount,Location,Hersteller,Properties,FirstPriceNumeric,FirstAvailableNumeric,LastPriceNumeric,LastAvailableNumeric,LastPrice,LastAvailable,Sold,SoldAfter,Imagefile,Title_en,material_emb,German_Raw,German_Code,first_level,second_level,third_level,SoldAfterDays,StockChange
17,17,108446,https://restado.de/baustoff/holzglas/,Holz&Glas,Türen & Zargen,Außentüren,2023-01-09,,"23 Einzeltüren 910mm x 2030mm, Dreh-Kipp, Stück 150,-€ 6 Doppelelemente 1820mm x 2030mm, Dreh-Kipp, Stück 300,-€ Gesamtpreis 5.250,-€ - nur Selbstabholung. Für Neubau Carport, Wintergarten, Remise, Terrasse, Gewächshaus etc.",Neuwertig,150€ / Stück,35 Stück verfügbar,(31 Stück Mindestabnahme),D-96472 Rödental,,"{""Material Türblatt"": ""Glas"", ""Türblatt-Ausführung"": ""Gefälzt"", ""Oberfläche Türblatt"": ""Glas"", ""Material Türzarge"": ""Holz"", ""Türzargen-Art"": ""Blockzarge"", ""Türzargen-Ausführung"": ""Stumpf"", ""Oberfläche Türzarge"": ""Massivholz"", ""Farbe Türblatt"": ""Glas"", ""Farbe Türzarge"": ""Braun""}",150.0,35.0,150.0,35.0,150€ / Stück,35 Stück verfügbar,0.0,,"['https://restado.de/wp-content/uploads/products/2022/07/6ca6ba8d-cc84026c-ce0f-4ffc-8b6f-6cc09a43303e.jpeg', 'https://restado.de/wp-content/uploads/products/2022/07/4430e5f6-bf5885ab-4695-4642-870a-5e835f6209c7.jpeg', 'https://restado.de/wp-content/uploads/products/2022/07/86ac9365-aaf33e98-c5e2-4181-b76d-74eb4e0c9585.jpeg']",Wood & Glass,Glass,Antique glass,Pr_25_71_33_03,Furnishings,Furnishings,Glass blocks and panels,,0.0
22,22,95358,https://restado.de/baustoff/hebeschiebetuer-3fach-verglast-internorm-2900-x-2375/,Hebeschiebetür 3fach verglast Internorm 2900 x 2375 inkl. Raffstor…,Türen & Zargen,Außentüren,2023-01-09,,"Wir verkaufen unsere Internorm Hebeschiebetür inklusive passender vorgesetzter Raffstore Anlagen (2 separate elektrische Raffstores für feststehendes Element und Tür, in Führungsschienen, von Warema.)  3-fach verglast, Kunststoffprofile weiß, 10 Jahre alt, top in Schuss.  Maße: 2900 x 2375mm, lichte Durchgangsbreite 1270 mm  Schiebeflügel von innen gesehen links  Führungsschiene nahezu fußbodengleich bei Bodenaufbau von 80mm  Sicherheit Beschlag in Anlehnung an WK1  Zusätzlich enthalten ist ein passend angefertigter Fliegenschutz-Rollo, öffnet innerhalb der Türöffnung von links nach rechts.",Gebraucht,1.500€ (VB) / Stück,1 Stück verfügbar,(1 Stück Mindestabnahme),D-56335 Neuhäusel,,{},1500.0,1.0,1500.0,1.0,1.500€ (VB) / Stück,1 Stück verfügbar,0.0,,['https://restado.de/wp-content/uploads/products/2022/04/fdb7a6c2-img_20220213_102525.jpg'],Lifting sliding door triple glazed Internorm x incl . external blinds…,Mosaic glass,External roller blinds,Pr_30_59_07_26,"Roof, Slabs, Stairs","Door, Windows, Gates",Glass blocks and panels,,0.0
27,27,88872,https://restado.de/baustoff/automatische-alu-tueranlage-mit-fenster/,Automatische Alu-Türanlage mit Fenster,Türen & Zargen,Außentüren,2023-01-09,,"Zum MeistGebot bis Ende des Monats abzugeben:  1 × Eingang inkl. Motor, Sensor, Lichtschranke.  Maße :2,20m breit x 2,20m hoch  Oberlicht 2,20m breit x 0,70m hoch  1 x Eingangstür inkl. Motor, Sensor, Lichtschranke  Maße Türöffnung ca.1,00m , Bauteil links ca. 0,75m ,Bauteil rechts ca. 2,30m  2 × Ausgang inkl. Motor, Sensor, Lichtschranke  Maße :2,20m breit x 2,20m hoch  Oberlicht 2,20m breit x 0,70m hoch  Bei Fragen schreiben Sie uns eine Mail.  Geben Sie ein Angebot per Mail ab.  Zum selber ausbauen in 44328 Dortmund",Gebraucht,999€ (VB) / Stück,1 Stück verfügbar,(5 Stück Mindestabnahme),D-44328 Dortmund,,"{""Material Türblatt"": ""Stahl"", ""Material Türzarge"": ""Stahl"", ""Türzargen-Art"": ""Umfassungszarge"", ""Oberfläche Türzarge"": ""Glas""}",999.0,1.0,999.0,1.0,999€ (VB) / Stück,1 Stück verfügbar,0.0,,"['https://restado.de/wp-content/uploads/products/2022/01/ad4e0299-img-20220110-wa0120.jpg', 'https://restado.de/wp-content/uploads/products/2022/01/824fb8fa-img-20220110-wa0121.jpg']",Automatic aluminum door system with window,Steel-aluminium alloy,Aluminium door frames,Pr_30_59_23_02,Other,"Door, Windows, Gates",Glass blocks and panels,,0.0
41,41,51717,https://restado.de/baustoff/fenster-39/,Fenster,Türen & Zargen,Außentüren,2023-01-09,,"6 wunderschöne hochwertige neue Kunststofffenster mit Sprossen im Glas und elektrischem Rolladen mit integrierten Insektenschutzgitter. Farbe innen weiß und außen anthrazitfarben.  Die Fenster sind dreifach verglast, Lärmschutz, Profil ist von Salamander und Schließsystem von Roto.  Maße: 1 m breit und 1,50 m hoch",Neu,3.300€ (VB) Paketpreis,6 Stück verfügbar,(6 Stück Mindestabnahme),D-74423 Obersontheim,,{},3300.0,6.0,3300.0,6.0,3.300€ (VB) Paketpreis,6 Stück verfügbar,0.0,,['https://restado.de/wp-content/uploads/products/2020/04/fee8afbb-4fa66919-d943-468f-9337-491bbc34da8e.jpeg.webp'],Window,Glass,Window walls,Pr_30_59_99,Openings,"Door, Windows, Gates",Glass blocks and panels,,0.0
50,50,6972,https://restado.de/baustoff/schiebetranlage-2-teilig-advantage-wei-mit-glasfllung/,Schiebetüranlage 2-teilig Advantage weiß mit Glasfüllung,Türen & Zargen,Außentüren,2023-01-09,,"Ich verkaufe eine 2-teilige Schiebetüranlage Advantage B x H: 1770 x 2010 mm bestehend aus: Schiebetür Profil Milano pulverbeschichtet in verkehrsweiß RAL 9016, Füllung in Floatglas &Aumltzeffekt 6 mm inkl. Wandanschlussleiste in RAL 9016, Einlassgriff für Milano im Senkrechtprofil Alu silber inkl. 2flg. Deckenschiene RAL 9016.  Die Anlage ist in einem sehr guten Zustand. An den beiden Türen und an den Wandanschussleisten sind keine Schrammen, Macken o.ä., weder an den Profilen noch an den Scheiben. Alles top! An der Deckenleiste befinden sich minimale normale Gebrauchsspuren.  Die zugehörige Bodenleiste ist nicht im Angebot enthalten, kann aber als Ersatzteil ohne Probleme nachgekauft werden. Es gibt versch. Schienen, je nach Bausituation. Kostet nach meiner Information inkl. Versand von Advantage ca. 130 Euro.",Gebraucht,500€ / Stück,1 Stück verfügbar,(1 Stück Mindestabnahme),Gebraucht,,{},500.0,1.0,500.0,1.0,500€ / Stück,1 Stück verfügbar,0.0,,[],Sliding door system -part Advantage white with glass filling,Coloured glass,Cavity sliding doorsets,Pr_30_59_24_11,Other,"Door, Windows, Gates",Glass blocks and panels,,0.0
118,118,124658,https://restado.de/baustoff/ladentuere-autom-2-tlg-glas-2m-breit-22m-hoch/,"Ladentüre Autom. 2 tlg. Glas 2m breit 2,2m hoch",Türen & Zargen,Sonstiges,2023-04-21,,Baujahr 12/2020,Neuwertig,1.500€ (VB) / Stück,1 Stück verfügbar,(1 Stück Mindestabnahme),D-85276 Pfaffenhofen an der Ilm,Tormax,{},1500.0,1.0,1500.0,1.0,,,0.0,,"['https://restado.de/wp-content/uploads/products/2023/04/d14171df-img_0683-scaled.jpeg', 'https://restado.de/wp-content/uploads/products/2023/04/5ec9ad5a-img_0686-scaled.jpeg', 'https://restado.de/wp-content/uploads/products/2023/04/35d6a31c-img_0682-scaled.jpeg', 'https://restado.de/wp-content/uploads/products/2023/04/bc3390c7-img_0684-scaled.jpeg', 'https://restado.de/wp-content/uploads/products/2023/04/d31e7347-img_0681-scaled.jpeg']",Shop door automatic -piece glass m wide .m high,Prismatic glass,Glass fibre-reinforced plastics (GRP) doorsets,Pr_30_59_24_34,Other,"Door, Windows, Gates",Glass blocks and panels,,0.0
132,132,108532,https://restado.de/baustoff/balkonschiebetuer/,Balkonschiebetür,Türen & Zargen,Sonstiges,2023-01-09,, ,Neu,1.800€ / Stück,1 Stück verfügbar,(1 Stück Mindestabnahme),D-53347 Alfter,Fenster Hai,{},1800.0,1.0,1800.0,1.0,1.800€ / Stück,1 Stück verfügbar,0.0,,['https://restado.de/wp-content/uploads/products/2022/07/90bea148-87b124f8-9cf3-40dd-85cb-8e52d420d589.jpeg'],Sliding balcony door,Mosaic glass,Electric sliding door mechanisms,Pr_30_36_59_27,"Roof, Slabs, Stairs","Door, Windows, Gates",Glass blocks and panels,,0.0
133,133,103986,https://restado.de/baustoff/glas-trennwand/,glas trennwand,Türen & Zargen,Sonstiges,2023-01-09,,Wir verkaufen die abgebildeten Glastrennwände nebst Türen. Alles in einem TOP-Zustand.  Fachgerechter Ausbau und Barzahlung vor Ort wird voraugesetzt.,Gebraucht,2.160€ (VB) Paketpreis,18 Stück verfügbar,(18 Stück Mindestabnahme),D-40699 Erkrath,,{},2160.0,18.0,2160.0,18.0,2.160€ (VB) Paketpreis,18 Stück verfügbar,0.0,,"['https://restado.de/wp-content/uploads/products/2022/05/21716295-img_5236.jpg', 'https://restado.de/wp-content/uploads/products/2022/05/a37d94c0-img_5239.jpg']",glass partition,Glass,Partition screens,Pr_25_71_57_61,Other,Other,Glass blocks and panels,,0.0
139,139,84227,https://restado.de/baustoff/promat-brandschutztuermodul-stahl-glas-din-r/,"Promat Schallschutztürmodul, Tür mit Zarge, Stahl/Glas (inkl. Aus…",Türen & Zargen,Sonstiges,2023-03-01,,Schallschutztür inkl. Ausbau  Eigenschaften  Farbe: Anthrazitgrau   Zargentyp: Blockzarge  Schlossart: Profizylinderschloss  DIN-Richtung: DIN R  Türband Typ: Zweiteilig  Oberflächenart: Glas Oberfläche  Stärke Türblatt: 80 mm  Zusatzinformationen: T 30 - RS  Garnitur Ausführung: Rosettengarnitur  Lichte Durchgangshöhe: 2160 mm  Lichte Durchgangsbreite: 1215 mm  Ausbau voraussichtlich ab Januar 2022 möglich.,Gebraucht,1.250€ (VB) / Stück,2 Stück verfügbar,(1 Stück Mindestabnahme),D-40213 Düsseldorf,Promat,{},1250.0,2.0,1250.0,2.0,1.250€ (VB) / Stück,2 Stück verfügbar,0.0,,['https://restado.de/wp-content/uploads/products/2021/10/e3536cf2-promat-brandschutztürmodul-stahl-glas-din-r-scaled.jpg'],"Promat soundproof door module , door with frame , steel/glass incl.…",Safety glass,Door frame protectors,Pr_30_36_33_21,"Wall, Barriers, Pannels","Door, Windows, Gates",Glass blocks and panels,,0.0
155,155,83958,https://restado.de/baustoff/glastuer-din-r/,Glastür DIN R,Türen & Zargen,Sonstiges,2023-01-09,,Eigenschaften  Bekleidungsaußenhöhe: 2270 mm  Bekleidungsaußenbreite: 1020 mm  Lichte Durchgangshöhe: 2220 mm  Lichte Durchgangsbreite: 940 mm  Wandstärke: 70 mm  Stärke Türblatt: 8 mm  Zargentyp: Eckzarge  DIN-Richtung: DIN R,Gebraucht,60€ (VB) / Stück,6 Stück verfügbar,(1 Stück Mindestabnahme),D-40213 Düsseldorf,,{},60.0,6.0,60.0,6.0,60€ (VB) / Stück,6 Stück verfügbar,0.0,,['https://restado.de/wp-content/uploads/products/2021/10/4c7b6e7a-glastür-din-l-scaled.jpg'],Glass door,Glass,Frameless glass door leaves,Pr_30_59_23_32,Openings,"Door, Windows, Gates",Glass blocks and panels,,0.0
157,157,84006,https://restado.de/baustoff/glastuere-gestreift-din-l-marke-dorma/,"Glastür mit Zarge, Glas, Tür, Zimmertür, Büro, von Dormakaba (i…",Türen & Zargen,Sonstiges,2023-01-09,,Hochwertige Glastür von dormakaba inkl. Ausbau  Eigenschaften  Bekleidungsaußenhöhe: 2220 mm  Bekleidungsaußenbreite: 1030 mm  Lichte Durchgangshöhe: 1970 mm  Lichte Durchgangsbreite: 935 mm  Wandstärke: 125 mm  Stärke Türblatt: 8 mm  Schlossart: Profizylinderschloss  Zargentyp: Umfassungszarge  DIN-Richtung: DIN L  Türband Typ: Zweiteilig  Zusatzinformationen: Sichtschutz-Streifen,Gebraucht,140€ (VB) / Stück,25 Stück verfügbar,(1 Stück Mindestabnahme),D-40213 Düsseldorf,,{},140.0,25.0,140.0,25.0,140€ (VB) / Stück,25 Stück verfügbar,0.0,,['https://restado.de/wp-content/uploads/products/2021/10/6ae8df4e-glastüredorma-scaled.jpg'],"Glass door with frame , glass , door , room door , office , from Dormakaba in…",Architectural glass,Frameless glass door leaves,Pr_30_59_23_32,Furnishings,"Door, Windows, Gates",Glass blocks and panels,,0.0
165,165,84016,https://restado.de/baustoff/glastuere-gestreift-din-r-marke-dorma/,"Glastür mit Zarge, Glas, Tür, Zimmertür, Büro, von Dormakaba (i…",Türen & Zargen,Sonstiges,2023-01-09,,Eigenschaften  Bekleidungsaußenhöhe: 2220 mm  Bekleidungsaußenbreite: 1030 mm  Lichte Durchgangshöhe: 1970 mm  Lichte Durchgangsbreite: 935 mm  Wandstärke: 125 mm  Stärke Türblatt: 8 mm  Schlossart: Profizylinderschloss  Zargentyp: Umfassungszarge  DIN-Richtung: DIN R  Türband Typ: Zweiteilig  Zusatzinformationen: Sichtschutz-Streifen  Ausbau ab Januar 2022 möglich,Gebraucht,140€ (VB) / Stück,18 Stück verfügbar,(1 Stück Mindestabnahme),D-40213 Düsseldorf,Dormakaba,{},140.0,18.0,140.0,18.0,140€ (VB) / Stück,18 Stück verfügbar,0.0,,"['https://restado.de/wp-content/uploads/products/2021/10/09e12c98-glass-türedoma2-scaled.jpg', 'https://restado.de/wp-content/uploads/products/2021/10/1e4e3fd4-glastüredorma-scaled.jpg']","Glass door with frame , glass , door , room door , office , from Dormakaba in…",Architectural glass,Frameless glass door leaves,Pr_30_59_23_32,Furnishings,"Door, Windows, Gates",Glass blocks and panels,,0.0
169,169,83785,https://restado.de/baustoff/westag-getalit-schallschutztuer-holz-din-l/,Westag & Getalit Schallschutztür Holz DIN L,Türen & Zargen,Sonstiges,2023-01-09,,Eigenschaften  Zargentyp: Umfassungszarge  Schlossart: Profizylinderschloss  Wandstärke: 135 mm  DIN-Richtung: DIN L  Türband Typ: Zweiteilig  Stärke Türblatt: 40 mm  Zusatzinformationen: T30-RS  Garnitur Ausführung: Rosettengarnitur  Bekleidungsaußenhöhe: 2010 mm  Lichte Durchgangshöhe: 1970 mm  Bekleidungsaußenbreite: 1030 mm  Lichte Durchgangsbreite: 940 mm,Gebraucht,90€ (VB) / Stück,1 Stück verfügbar,(1 Stück Mindestabnahme),D-40213 Düsseldorf,,{},90.0,1.0,90.0,1.0,90€ (VB) / Stück,1 Stück verfügbar,0.0,,['https://restado.de/wp-content/uploads/products/2021/10/4b224bd5-westag-getalit-brandschutztür-holz-din-l-scaled.jpg'],Westag & Getalit soundproof door wood,Wood,Wood doorsets,Pr_30_59_24_97,Other,"Door, Windows, Gates",Glass blocks and panels,,0.0
170,170,83792,https://restado.de/baustoff/westag-getalit-brandschutztuer-holz-din-r/,Westag & Getalit Schallschutztür Holz DIN R,Türen & Zargen,Sonstiges,2023-02-19,,Eigenschaften  Zargentyp: Umfassungszarge  Schlossart: Profizylinderschloss  Wandstärke: 135 mm  DIN-Richtung: DIN R  Türband Typ: Zweiteilig  Stärke Türblatt: 40 mm  Zusatzinformationen: T30-RS  Garnitur Ausführung: Rosettengarnitur  Bekleidungsaußenhöhe: 2010 mm  Lichte Durchgangshöhe:1970 mm  Bekleidungsaußenbreite: 1030 mm  Lichte Durchgangsbreite: 940 mm ,Gebraucht,90€ (VB) / Stück,1 Stück verfügbar,(1 Stück Mindestabnahme),D-40213 Düsseldorf,Westag &amp; Getalit,{},90.0,1.0,90.0,1.0,90€ (VB) / Stück,1 Stück verfügbar,0.0,,['https://restado.de/wp-content/uploads/products/2021/10/a67862eb-westag-getalit-brandschutztür-holz-din-r-scaled.jpg'],Westag & Getalit sound insulation door wood,Wood,Timber-lined composite sound-insulating boards,Pr_25_71_18_90,Other,Other,Glass blocks and panels,,0.0
186,186,83424,https://restado.de/baustoff/2x-schallschutztuermodul-stahl-glas-din-r/,2x Schallschutztürmodul Stahl/Glas DIN R,Türen & Zargen,Sonstiges,2023-02-16,,Farbe: Anthrazitgrau Zargentyp: Blockzarge Schlossart: Profizylinderschloss  DIN-Richtung: DIN R Türband Typ: Zweiteilig  Oberflächenart: Glas Oberfläche Stärke Türblatt: 80 mm  Zusatzinformationen T 30 - RS Garnitur Ausführung: Rosettengarnitur  Lichte Durchgangshöhe: 2155 mm Lichte Durchgangsbreite: 1304 mm Bekleidungsaußenbreite: 1676 mm Bekleidungsaußenhöhe: 2620 mm,Neuwertig,2.000€ (VB) / Stück,2 Stück verfügbar,(1 Stück Mindestabnahme),D-40213 Düsseldorf,,{},2000.0,2.0,2000.0,2.0,2.000€ (VB) / Stück,2 Stück verfügbar,0.0,,['https://restado.de/wp-content/uploads/products/2021/10/93a1bfa3-2x-schallschutztuermodul-stahl-glas-din-r-wie-neu.jpg'],x soundproof door module steel/glass,X-ray protective glass,Glass noise barrier panels,Pr_25_71_57_33,Other,"Door, Windows, Gates",Glass blocks and panels,,0.0
187,187,83429,https://restado.de/baustoff/3x-schallschutztuermodul-stahl-glas-din-r/,3x Schallschutztürmodul Stahl/Glas DIN R,Türen & Zargen,Sonstiges,2023-01-09,,Preis pro Tür = 2000€ Farbe: Anthrazitgrau Zargentyp: Blockzarge Schlossart: Profizylinderschloss  DIN-Richtung: DIN R Türband Typ: Zweiteilig Oberflächenart: Glas Oberfläche  Stärke Türblatt: 80 mm  Zusatzinformationen T 30 - RS  Garnitur Ausführung: Rosettengarnitur Lichte Durchgangshöhe: 2150 mm Lichte Durchgangsbreite: 1230 mm,Neuwertig,2.000€ (VB) / Stück,3 Stück verfügbar,(1 Stück Mindestabnahme),D-40213 Düsseldorf,,{},2000.0,3.0,2000.0,3.0,2.000€ (VB) / Stück,3 Stück verfügbar,0.0,,['https://restado.de/wp-content/uploads/products/2021/10/00b94eb6-3x-schallschutztuermodul-stahl-glas-din-r.jpg'],x soundproof door module steel/glass,X-ray protective glass,Glass noise barrier panels,Pr_25_71_57_33,Other,"Door, Windows, Gates",Glass blocks and panels,,0.0
188,188,83433,https://restado.de/baustoff/glastuer-esg-mit-stahlzarge/,Glastür ESG mit Stahlzarge,Türen & Zargen,Sonstiges,2023-01-09,,Oberflächenart: Glas Oberfläche Schlossart: Profizylinderschloss  Bekleidungsaußenhöhe: 2150 mm Bekleidungsaußenbreite: 920 mm Lichte Durchgangshöhe: 2100 mm Lichte Durchgangsbreite: 810 mm  Stärke Türblatt: 8 mm DIN-Richtung: DIN L Türband Typ: Dreiteilig,Gebraucht,200€ (VB) / Stück,1 Stück verfügbar,(1 Stück Mindestabnahme),D-40213 Düsseldorf,,{},200.0,1.0,200.0,1.0,200€ (VB) / Stück,1 Stück verfügbar,0.0,,['https://restado.de/wp-content/uploads/products/2021/10/0bf101f6-glastuer-esg-mit-stahlzarge2.png'],glass door with steel frame,Structural glass,Stainless steel door frames,Pr_30_59_23_84,Other,"Door, Windows, Gates",Glass blocks and panels,,0.0
194,194,83449,https://restado.de/baustoff/glastuer-dusche-1960x780mm/,Glastür Dusche 1960x780mm,Türen & Zargen,Sonstiges,2023-01-09,,"Türband Typ: Dreiteilig DIN-Richtung: DIN R  Oberflächenart: Glas Oberfläche Türblattaußenhöhe gefälzt: 1960 mm Türblattaußenbreite gefälzt: 780 mm Stärke: 8 mm  Zusatzinformationen Edelstahlknauf, Edelstahlpaneel 2100x200x100mm, verschraubt",Gebraucht,80€ (VB) / Stück,7 Stück verfügbar,(1 Stück Mindestabnahme),D-40213 Düsseldorf,,{},80.0,7.0,80.0,7.0,80€ (VB) / Stück,7 Stück verfügbar,0.0,,['https://restado.de/wp-content/uploads/products/2021/10/b289c196-7x-glastuer-dusche-1960x780mm.png'],Glass door shower xmm,Glass,Shower doors,Pr_40_20_06_80,Other,"Door, Windows, Gates",Glass blocks and panels,,0.0
211,211,36312,https://restado.de/baustoff/aluminium-schiebetueren/,Aluminium Schiebetueren,Türen & Zargen,Sonstiges,2023-01-28,,"3 x Aluminium Schiebetueren (neuwertig) ideal fuer Meeting-/Buero Raeume Abmasse: L = 275 cm, H = 288 cm (siehe Foto anbei)  ",Neuwertig,2.400€ Paketpreis,3 Stück verfügbar,(3 Stück Mindestabnahme),Neuwertig,,{},2400.0,3.0,2400.0,3.0,2.400€ Paketpreis,3 Stück verfügbar,0.0,,[],Aluminum sliding doors,Steel-aluminium alloy,Aluminium doorsets,Pr_30_59_24_02,Other,"Door, Windows, Gates",Glass blocks and panels,,0.0
215,215,32570,https://restado.de/baustoff/balkontuerelement-kunststoff-mit-stulpfluegel-3-fach-verglasung-neu-und-abholbereit/,Balkontürelement Kunststoff mit Stulpflügel 3-Fach-Verglasung neu…,Türen & Zargen,Sonstiges,2023-01-09,1690329600000.0,"Neues, falsch bemessenes Balkon-/Terrassenelement (NP 985€) mit 3-fach-Verglasung weiß, zweiflügelig (mit Stulpflügel) anzubieten. Maße: H=240cm; B=185cm. Profilsystem Streamline 76 AD; Beschlag Pilzkopf (ähnl. RC 1N) ",Neu,750€ (VB) / Stück,1 Stück verfügbar,(1 Stück Mindestabnahme),D-10249 Berlin Friedrichshain,,{},750.0,1.0,750.0,1.0,750€ (VB) / Stück,1 Stück verfügbar,1.0,17107200000.0,[],"Plastic balcony door element with double sash , triple glazing , new ...",Polyethylene resin,Composite doorsets,Pr_30_59_24_16,Structural elements,"Door, Windows, Gates",Glass blocks and panels,198.0,0.0
218,218,29870,https://restado.de/baustoff/schiebetuerenrohlinge-aus-massivholz/,Schiebetürenrohlinge aus Massivholz,Türen & Zargen,Sonstiges,2023-01-09,,"Verkaufe original eingepackte holzschiebetüren. 211x98,5x2,7 cm  Ca 25 Stück vorhanden.  Hier ein Link mit Bildern:  https://www.ebay-kleinanzeigen.de/s-anzeige/holzschiebetueren/946902354-87-3387  Bei Abnahme aller Türen lasse ich mit mir sicher gut verhandeln.",Neu,70€ (VB) / Stück,30 Stück verfügbar,(1 Stück Mindestabnahme),D-12359 Berlin,,{},70.0,30.0,70.0,30.0,70€ (VB) / Stück,30 Stück verfügbar,0.0,,[],Sliding door blanks made of solid wood,Wood,Wood door frames,Pr_30_59_23_96,Furnishings,"Door, Windows, Gates",Glass blocks and panels,,0.0
228,228,6113,https://restado.de/baustoff/tuer-mit-metallzarge/,Tür mit Metallzarge,Türen & Zargen,Sonstiges,2023-05-25,,"Holztür mit weißem Lack bestrichen und mit einer Metallzarge. Anschlag: rechts Die Zarge ist nur für Trockenbau geeignet. Die Futtertiefe beträgt 15 cm. Breite:  65,00 cm Höhe:  215,00 cm Länge/Tiefe:    Gewicht / Stk.:  40,00 kg Baujahr (ca.):  2000 Material:  Holz,Metall Farbe:  weiß Herkunft:  ÖffentlichesGebäude Anschlag DIN:  re. Zarge/Blende:  mitZarge Flügel:  1-flügelig Verfügbar ab: sofort", gut,340€ Paketpreis,4 Stk. verfügbar,(4 Stk. Mindestabnahme),gut,,{},340.0,4.0,340.0,4.0,340€ Paketpreis,4 Stk. verfügbar,0.0,,[],Door with metal frame,Metal,Aluminium door frames,Pr_30_59_23_02,Structural elements,"Door, Windows, Gates",Glass blocks and panels,,0.0
235,235,6115,https://restado.de/baustoff/tuer-mit-metallzarge-2/,Tür mit Metallzarge,Türen & Zargen,Sonstiges,2023-01-09,,"Holztür mit weißem Lack bestrichen und mit einer Metallzarge. Anschlag: rechts/ 6 Stück, Anschlag: links/ 8 Stück Die Zarge ist nur für Trockenbau geeignet. Die Futtertiefe beträgt 15 cm. Breite:  90,00 cm Höhe:  215,00 cm Länge/Tiefe:    Gewicht / Stk.:  55,00 kg Baujahr (ca.):  2000 Material:  Holz,Metall Farbe:  weiß Herkunft:  ÖffentlichesGebäude Anschlag DIN:  re. Zarge/Blende:  mitZarge Flügel:  1-flügelig Verfügbar ab: sofort",Neuwertig & Geprüft,1.470€ Paketpreis,14 Stk. verfügbar,(14 Stk. Mindestabnahme),Neuwertig & Geprüft,,{},1470.0,14.0,1470.0,14.0,1.470€ Paketpreis,14 Stk. verfügbar,0.0,,[],Door with metal frame,Metal,Aluminium door frames,Pr_30_59_23_02,Structural elements,"Door, Windows, Gates",Glass blocks and panels,,0.0
266,266,108349,https://restado.de/baustoff/pruem-tuerzargen-9016/,Prüm Türzargen 9016,Türen & Zargen,Zimmertüren,2023-01-09,1692921600000.0,"Wir verkaufen 11 Türzargen für 101cm Türen der Firma Prüm in Ral 9016 Bis auf 2 Zargen (91cm und 77cm) sind alle Zargen für 101 Türen!  6 Zargen sind für 213cm Türen und 5 Türen für 200cm Türen   2x Anschlag rechts Wandstärke 12,5 cm Höhe 211cm Breite: 101 cm  1x Anschlag rechts Wansträrke12,5 cm Breite 77cm Höhe 211 cm  2x Anschlag rechts Wandstärke 24,5 cm Höhe 211 cm Breite 101cm  1x Anschlag links Wandstärke 12,5cm Höhe 211cm Breite 101cm  1x Anschlag rechts Wandstärke 24,5 cm Höhe 198,5 cm Breite 101 cm  1x Anschlag rechts Wandstärke 24,5 cm Höhe 198,5 cm Breite 91 cm  2x Anschlag links Wandstärke 24,5 cm Höhe 198,5 cm Breite 101 cm  1x Anschlag rechts Wandstärke 12,5 cm Höhe 198,5cm Breite 101 cm  Bis auf eine Zarge sind alle noch Original verpackt.",Neu,45€ / Stück,11 Stück verfügbar,(1 Stück Mindestabnahme),D-65606 Villmar,,"{""Material Türzarge"": ""Holz"", ""Farbe Türzarge"": ""Ral 9016"", ""Türzargen-Breite"": ""1,01 m"", ""Türzargen-Höhe"": ""2,135 m""}",45.0,11.0,45.0,11.0,45€ / Stück,11 Stück verfügbar,1.0,19699200000.0,['https://restado.de/wp-content/uploads/products/2022/07/5900672a-da398dd4-81ce-4d2b-b2a0-ff23be31dfd9.jpeg'],Prüm door frames,Architectural glass,Wood door frames,Pr_30_59_23_96,"Wall, Barriers, Pannels","Door, Windows, Gates",Glass blocks and panels,228.0,0.0
274,274,105725,https://restado.de/baustoff/alte-holztueren-u-fenster/,Alte Holztüren u. Fenster,Türen & Zargen,Zimmertüren,2023-01-09,,Altbautüren aus Haus ca 50-110 Jahre alt.,Gebraucht,1€ (VB) / Stück,4 Stück verfügbar,(1 Stück Mindestabnahme),D-39249 Barby,Unbekannt,"{""Material Türblatt"": ""Holz"", ""Anschlag"": ""DIN Rechts"", ""Türblatt-Ausführung"": ""Stumpf"", ""Oberfläche Türblatt"": ""Massivholz"", ""Schlossart"": ""Buntbart"", ""Farbe Türblatt"": ""Weis, braun etc"", ""Türblatt-Breite"": ""Verschiedene Türen und Breiten"", ""Türblatt-Höhe"": ""2,50-2,60""}",1.0,4.0,1.0,4.0,1€ (VB) / Stück,4 Stück verfügbar,0.0,,[],Old wooden doors and windows,Wood,Wood doorsets,Pr_30_59_24_97,Furnishings,"Door, Windows, Gates",Glass blocks and panels,,0.0
275,275,105503,https://restado.de/baustoff/glastuer-planilux-mit-edelstahl-klinke/,Glastür Planilux mit Edelstahl Klinke,Türen & Zargen,Zimmertüren,2023-01-09,, ,Gebraucht,50€ (VB) / Stück,1 Stück verfügbar,(1 Stück Mindestabnahme),D-50321 Brühl,Planilux,"{""Material Türblatt"": ""Glas"", ""Anschlag"": ""DIN Links"", ""Oberfläche Türblatt"": ""Glas"", ""Schlossart"": ""Kein Schloss"", ""Farbe Türblatt"": ""Klar"", ""Türblatt-Breite"": ""83,4"", ""Türblatt-Höhe"": ""197,2""}",50.0,1.0,50.0,1.0,50€ (VB) / Stück,1 Stück verfügbar,0.0,,['https://restado.de/wp-content/uploads/products/2022/05/549498c4-b5a58192-c213-4d16-9b63-ee8648eb44cb.jpeg'],Planilux glass door with stainless steel handle,Lead glass,Stainless steel door frames,Pr_30_59_23_84,Other,"Door, Windows, Gates",Glass blocks and panels,,0.0
281,281,92462,https://restado.de/baustoff/glastueren-mit-motiv/,Glastüren mit Motiv,Türen & Zargen,Zimmertüren,2023-01-09,,"Qualitäts Glastüren mit eingelassenen Motiv (aktueller OVP 959,- bei OBI)",Neuwertig,120€ (VB) / Stück,2 Stück verfügbar,(1 Stück Mindestabnahme),D-74172 Neckarsulm,,"{""Material Türblatt"": ""Glas"", ""Anschlag"": ""DIN Rechts"", ""Oberfläche Türblatt"": ""Glas""}",120.0,2.0,120.0,2.0,120€ (VB) / Stück,2 Stück verfügbar,0.0,,['https://restado.de/wp-content/uploads/products/2022/03/922124e1-15.jpg'],Glass doors with motif,Architectural glass,Wood doorsets,Pr_30_59_24_97,Furnishings,"Door, Windows, Gates",Glass blocks and panels,,0.0
