,Unnamed: 0,Nr,URL,Title,Category,Subcategory,Saved,LastUpOn,Description,Zustand,FirstPrice,FirstAvailable,MinAmount,Location,Hersteller,Properties,FirstPriceNumeric,FirstAvailableNumeric,LastPriceNumeric,LastAvailableNumeric,LastPrice,LastAvailable,Sold,SoldAfter,Imagefile,Title_en,material_emb,German_Raw,German_Code,first_level,second_level,third_level,SoldAfterDays,StockChange
2298,2298,12914,https://restado.de/baustoff/deckoplatten-kellerdeckendaemmung/,Deckoplatten Kellerdeckendämmung,Rohbau,Dämmung,2023-01-09,,"Paketinhalt: 2 m². Wir haben drei Pakete ab zu geben. Preis je Paket  Die Kellerdecken-Dämmelemente sind aus hochwertigem Polystyrol-Hartschaum in der Wärmeleitgruppe 035 gefertigt. Die einzelnen Elemente sind 120 mm stark, 500 x 500 mm groß und haben eine Deckfläche von 488 mm x 488 mm. Eine umlaufende Nut- und Federverbindung ermöglicht die einfache Montage, gefaste Kanten sorgen für eine ansprechende Optik.",Neu,29€ / m²,6 m² verfügbar,(2 m² Mindestabnahme),Neu,,{},29.0,6.0,29.0,6.0,29€ / m²,6 m² verfügbar,0.0,,[],Decko panels basement ceiling insulation,Insulating concrete,Rigid insulation boards and panels,Pr_25_71_70,Other,"Blocks, Panels, Fences, Bricks",Glass blocks and panels,,0.0
2349,2349,116961,https://restado.de/baustoff/sillatherm-daemmplatten/,Sillatherm Dämmplatten,Fassade,Fassadendämmung,2023-02-27,,"NEU UND ORIGINALVERPACKT 3 Paletten, entspricht 36 Platten=18 Quadratmeter Sillatherm WVP 1-035 Mineralwolle Dämmplatten mit einer Stärke von 200mm A1 nicht brennbar",Neu,690€ Paketpreis,3 Palette verfügbar,(3 Palette Mindestabnahme),D-81929 Munich,,{},690.0,3.0,690.0,3.0,690€ Paketpreis,3 Palette verfügbar,0.0,,"['https://restado.de/wp-content/uploads/products/2022/11/413fa022-whatsapp-image-2022-11-29-at-13.39.14-1.jpeg', 'https://restado.de/wp-content/uploads/products/2022/11/ea8fd182-whatsapp-image-2022-11-29-at-13.39.14.jpeg']",Sillatherm insulation panels,Insulating glass,Silica-based insulation boards,Pr_25_71_70_78,"Wall, Barriers, Pannels",Other,Glass blocks and panels,,0.0
2356,2356,106005,https://restado.de/baustoff/polystyrol-hartschaumplatten-fuer-wdvs-d22cm/,polystyrol hartschaumplatten für WDVS D=22cm,Fassade,Fassadendämmung,2023-01-09,, ,Neu,644€ (VB) Paketpreis,46 m² verfügbar,(46 m² Mindestabnahme),D-15827 Blankenfelde-Mahlow,WKI-Isoliertechnik,"{""Wärmeleitgruppe"": ""032"", ""Anwendungsbereich"": ""Vollwärmeschutz""}",644.0,46.0,644.0,46.0,644€ (VB) Paketpreis,46 m² verfügbar,0.0,,[],polystyrene hard foam panels for D=cm,Extruded polystyrene foam (XPS),Polyester foam boards,Pr_25_71_63_69,Other,Other,Glass blocks and panels,,0.0
2359,2359,92816,https://restado.de/baustoff/pu-wandpaneele/,PU-Wandpaneele,Fassade,Fassadendämmung,2023-01-09,1690588800000.0,"Verkaufe PU-Wandpaneele, verschiedene Formate und Farben, laut Liste. Auch nach Wunsch vorbestellbar.",Neu,23€ (VB) / m²,20.000 m² verfügbar,(700 m² Mindestabnahme),AT-4221,,{},23.0,20000.0,23.0,20000.0,23€ (VB) / m²,20.000 m² verfügbar,1.0,17366400000.0,"['https://restado.de/wp-content/uploads/products/2022/03/311f4989-pu-paneele.jpg', 'https://restado.de/wp-content/uploads/products/2022/03/9dc28e5d-paneele_2.jpg', 'https://restado.de/wp-content/uploads/products/2022/03/241d4537-pu-paneele.jpg']",wall panels,Sheet glass,Wall protection panels,Pr_35_90_43_86,"Wall, Barriers, Pannels","Blocks, Panels, Fences, Bricks",Glass blocks and panels,201.0,0.0
2360,2360,91887,https://restado.de/baustoff/daemmplatten-gebraucht-verschiedene-laengen/,Dämmplatten gebraucht verschiedene Längen,Fassade,Fassadendämmung,2023-03-16,1696896000000.0,Gebrauchte dämmplatten verschiedene Längen verschiedener Zustand gg Abholung im Deizisau... beschädigte gibt es gratis dazu,Gebraucht,1€ / Stück,20 Stück verfügbar,(1 Stück Mindestabnahme),D-73779 Deizisau,,{},1.0,20.0,1.0,20.0,1€ / Stück,20 Stück verfügbar,1.0,17971200000.0,['https://restado.de/wp-content/uploads/products/2022/02/107ad041-20220218_170942-scaled.jpg'],Insulation panels are used in different lengths,Insulating glass,Rigid insulation boards and panels,Pr_25_71_70,"Wall, Barriers, Pannels","Blocks, Panels, Fences, Bricks",Glass blocks and panels,208.0,0.0
2363,2363,83178,https://restado.de/baustoff/knauf-steinwolle-daemmplatten/,Knauf Steinwolle Dämmplatten,Fassade,Fassadendämmung,2023-01-09,1687305600000.0,Zu verkaufen stehen cca. 600 pakete KnaufInsulation DPF-50 Steinwolle Dämmplatten.   Hersteller: Knauf  Wärmeleitgruppe: 035 Dämmstarke: 80mm  Material: Steinwolle Brandschutzklasse: A1 (nicht brennbar)    Ware befindet sich in Berlin.  Kontakt: 015254384166,Neu,20€ (VB) / Paket,600 Paket verfügbar,(300 Paket Mindestabnahme),D-10178 Berlin,,{},20.0,600.0,20.0,600.0,20€ (VB) / Paket,600 Paket verfügbar,1.0,14083200000.0,"['https://restado.de/wp-content/uploads/products/2021/10/ee097c7e-c8160685-acbc-4d7b-a7e1-fa5329f55f00.jpeg', 'https://restado.de/wp-content/uploads/products/2021/10/709501c9-fcb9ef31-e503-4907-a75b-41b8d3cb0a93.jpeg']",Knauf rock wool insulation panels,Glass wool,Mineral wool insulation,Pr_25_57_06_53,Other,"Blocks, Panels, Fences, Bricks",Glass blocks and panels,163.0,0.0
2369,2369,65798,https://restado.de/baustoff/eps-wdv-fassaden-daemmplatten/,EPS-WDV-Fassaden Dämmplatten,Fassade,Fassadendämmung,2023-01-09,1687219200000.0,Verkaufe insgesamt 16qm neue EPS-WDV-Fassaden Dämmplatten 16 Pakete a 1qm Wärmeleitgruppe: 035 Materialspezifizierung: EPS (expandiertes Polystyrol) Nutzmaß: 1000*500mm Kantenausprägung: Stumpf Nenndicke: 200mm,Neu,18€ (VB) / Stück,16 Stück verfügbar,(1 Stück Mindestabnahme),D-32547 Bad Oeynhausen,HIRSCH Porozell GmbH,"{""Material"": ""Kunststoff"", ""Wärmeleitgruppe"": ""035"", ""Anwendungsbereich"": ""Wand"", ""Brandschutzklasse"": ""B1 (schwerentflammbar)"", ""Dämmstärke"": ""200 mm""}",18.0,16.0,18.0,16.0,18€ (VB) / Stück,16 Stück verfügbar,1.0,13996800000.0,"['https://restado.de/wp-content/uploads/products/2020/11/b5ff99f1-00012-scaled.jpg', 'https://restado.de/wp-content/uploads/products/2020/11/b124ec06-0001-scaled.jpg']",facade insulation panels,Insulating glass,Faced insulating wall panels,Pr_25_71_14_29,"Wall, Barriers, Pannels","Blocks, Panels, Fences, Bricks",Glass blocks and panels,162.0,0.0
2390,2390,2584,https://restado.de/baustoff/brillux-wdv-system-qju-fassaden-dmmplatten-dmmung/,Brillux WDV-System Qju Fassaden Dämmplatten / Dämmung,Fassade,Fassadendämmung,2023-01-09,,"Brillux WDV-System Qju Fassaden Dämmplatte  150mm dick, 1,5 Meter x 0,50 Meter, insgesamt 7,5 m²  5 Pakete à 3 Platten, original eingeschweißt, für Selbstabholer.  Einkaufspreis: pro m² 17,50 €, Gesamtpreis 131,25 €  nur komplett abzuholen in 47877 Willich",Neu,100€ Paketpreis,5 Stück verfügbar,(5 Stück Mindestabnahme),Neu,,{},100.0,5.0,100.0,5.0,100€ Paketpreis,5 Stück verfügbar,0.0,,[],Brillux system Qju facade insulation panels/insulation,Insulating glass,Concrete structural insulated panels (SIPs),Pr_20_93_85_16,"Wall, Barriers, Pannels","Blocks, Panels, Fences, Bricks",Glass blocks and panels,,0.0
2393,2393,121724,https://restado.de/baustoff/mammut-pvc-kunststoff-paneele/,Mammut PVC Kunststoff Paneele,Fassade,Fassadenverkleidung,2023-01-09,,"Verkauft werden PVC Kunststoff Paneelen Hersteller ""Mammut"", Farbe weiss, Menge: 144 qm, das sind 120 Paneelen, 24 Pakete, 1 Paket= 5 Stk. Masse: 6000 x 200 x 17 mm  Preis ist verhandelbar!  Dank seiner Schlüsseleigenschaften wie Wartungsfreiheit und lange Nutzungsdauer ist es eine perfekte Alternative zu Holz. Kunststoffdielen werden hauptsächlich im Außenbereich (Dachuntersichten, Dachluken, Fassaden, Giebel usw.) sowie im Innenbereich (insbesondere Wandverkleidungen) verwendet. Dielen sind UV-stabil und können daher in der Sonne verwendet werden.  Da es ein Sonderpreis ist, können wir keine Garantie und Rückgaberecht gewähren.",Neu,170€ (VB) / Paket,24 Paket verfügbar,(1 Paket Mindestabnahme),D-46446 Emmerich,,"{""Material"": ""Kunststoff""}",170.0,24.0,170.0,24.0,170€ (VB) / Paket,24 Paket verfügbar,0.0,,"['https://restado.de/wp-content/uploads/products/2023/03/c8a54eec-img_4750-rotated.jpg', 'https://restado.de/wp-content/uploads/products/2023/03/d6293ca7-img_4740-rotated.jpg', 'https://restado.de/wp-content/uploads/products/2023/03/524313a1-img_4741-rotated.jpg', 'https://restado.de/wp-content/uploads/products/2023/03/37cc89cc-img_4749-rotated.jpg']",Mammut plastic panels,Plastics,Plastics panels,Pr_25_71_57_63,"Wall, Barriers, Pannels","Blocks, Panels, Fences, Bricks",Glass blocks and panels,,0.0
2397,2397,117698,https://restado.de/baustoff/verkleidungspaneel-270m-grau/,"Verkleidungspaneel 2,70m grau",Fassade,Fassadenverkleidung,2023-01-09,1673568000000.0,,,,,,,,,,,,,,,1.0,345600000.0,['https://restado.de/wp-content/uploads/products/2022/12/25683cc1-b10junior-grau.jpg'],Cladding panel .m gray,Coloured glass,Cladding and lining panels,Pr_25_71_14,Other,"Blocks, Panels, Fences, Bricks",Glass blocks and panels,4.0,
2398,2398,117694,https://restado.de/baustoff/verkleidungspaneel-270m-weiss/,"Verkleidungspaneel 2,70m weiss",Fassade,Fassadenverkleidung,2023-01-09,1673222400000.0,,,,,,,,,,,,,,,0.0,0.0,['https://restado.de/wp-content/uploads/products/2022/12/3e6e5195-b10junior-weiss.jpg'],Cladding panel .m white,Coloured glass,Cladding and lining panels,Pr_25_71_14,Furnishings,"Blocks, Panels, Fences, Bricks",Glass blocks and panels,0.0,
2399,2399,117677,https://restado.de/baustoff/verkleidungspaneel-grau/,Verkleidungspaneel 6m grau,Fassade,Fassadenverkleidung,2023-01-09,1673481600000.0,,,,,,,,,,,,,,,1.0,259200000.0,"['https://restado.de/wp-content/uploads/products/2022/12/23f69dfd-grau.png', 'https://restado.de/wp-content/uploads/products/2022/12/2b1a5873-b25-jumbo_small.jpg']",Cladding panel m gray,Coloured glass,Cladding and lining panels,Pr_25_71_14,Other,Other,Glass blocks and panels,3.0,
2400,2400,117672,https://restado.de/baustoff/verkleidungspaneel-dekor-golden-oak/,Verkleidungspaneel 6m Dekor golden oak,Fassade,Fassadenverkleidung,2023-01-09,1674432000000.0,,,,,,,,,,,,,,,1.0,1209600000.0,['https://restado.de/wp-content/uploads/products/2022/12/c1725b64-goldenoak.png'],Cladding panel m decor golden oak,American white oak,Cladding and lining panels,Pr_25_71_14,Furnishings,Furnishings,Glass blocks and panels,14.0,
2401,2401,117578,https://restado.de/baustoff/baukulit-vox-verkleidungspaneel-jumbo-16-mm-stark/,Verkleidungspaneel 3m grau,Fassade,Fassadenverkleidung,2023-01-09,1673913600000.0,,,,,,,,,,,,,,,1.0,691200000.0,"['https://restado.de/wp-content/uploads/products/2022/12/7f364cbd-b25-jumbo_small.jpg', 'https://restado.de/wp-content/uploads/products/2022/12/88a2d6f0-grau.png']",Cladding panel m gray,Coloured glass,Cladding and lining panels,Pr_25_71_14,Other,Other,Glass blocks and panels,8.0,
2402,2402,117588,https://restado.de/baustoff/verkleidungspaneel-golden-oak-16-mm-stark/,Verkleidungspaneel 3m golden oak,Fassade,Fassadenverkleidung,2023-01-09,1674345600000.0,,,,,,,,,,,,,,,1.0,1123200000.0,"['https://restado.de/wp-content/uploads/products/2022/12/9fe361e5-b25-jumbo_small.jpg', 'https://restado.de/wp-content/uploads/products/2022/12/e2eecd93-goldenoak.png']",Cladding panel m golden oak,American white oak,Cladding and lining panels,Pr_25_71_14,Other,Other,Glass blocks and panels,13.0,
2418,2418,80143,https://restado.de/baustoff/schieferplatten/,Natur Schieferplatten,Fassade,Fassadenverkleidung,2023-01-09,,Zum Verkauf stehen 10 Jahre alte Natur Schieferplatten mit ca. 200 m².  1m² = 20 Platten entspricht 10€  Die Platten sind in einem sehr guten Zustand. ,Gebraucht,10€ / m²,200 m² verfügbar,(10 m² Mindestabnahme),D-51061 Cologne,,"{""Material"": ""Naturstein""}",10.0,200.0,10.0,200.0,10€ / m²,200 m² verfügbar,0.0,,['https://restado.de/wp-content/uploads/products/2021/08/24696de0-img_1507-scaled.jpg'],Natural slate tiles,Slate,Natural slates,Pr_25_93_72_56,"Roof, Slabs, Stairs",Other,Glass blocks and panels,,0.0
2465,2465,13635,https://restado.de/baustoff/schieferplatten-zur-wandverkleidung-mit-lochung/,Schieferplatten zur Wandverkleidung mit Lochung,Fassade,Fassadenverkleidung,2023-01-09,,Verkaufe eine Menge Schieferplatten in guter gebrauchter Qualität.,Gebraucht,10€ (VB) / Stück,100 Stück verfügbar,(50 Stück Mindestabnahme),Gebraucht,,{},10.0,100.0,10.0,100.0,10€ (VB) / Stück,100 Stück verfügbar,0.0,,[],Slate panels for wall cladding with perforations,Slate,Cladding and lining panels,Pr_25_71_14,"Wall, Barriers, Pannels","Blocks, Panels, Fences, Bricks",Glass blocks and panels,,0.0
2498,2498,43207,https://restado.de/baustoff/fassadenplatten/,Fassadenplatten,Fassade,Sonstiges Fassadenmaterial,2023-01-09,,"Wir schneiden die Sandsteinplatten auf erwünschtes Maß und schleifen die Sichtflächen glatt ab. Auf Anfrage können wir auch andere Formen der Oberflächen anbieten.  Platten 60/40/3 cm: 45,00 EUR brutto/1m2  Sie finden bei uns Treppenbeläge, Vollstufen, Terrassenplatten, Fensterbänke sowie Bordsteine aus Sandstein in diversen Längen und Stärken.   Die Transportkosten werden hier immer für jeden Kunden individuell ausgerechnet.",Neu,45€ / m²,50 m² verfügbar,(10 m² Mindestabnahme),PL-59-620 Gryfów Śląski,Abi-Pol ,{},45.0,50.0,45.0,50.0,45€ / m²,50 m² verfügbar,0.0,,[],Facade panels,Architectural glass,Mesh panels,Pr_25_71_50_51,"Roof, Slabs, Stairs","Blocks, Panels, Fences, Bricks",Glass blocks and panels,,0.0
2507,2507,8524,https://restado.de/baustoff/holzplatte-ple11/,Holzplatte PLE11,Fassade,Sonstiges Fassadenmaterial,2023-01-09,,"Holzplatte PLE11 ist eine beliebte Fassadendekoration, die bei uns für günstige Preise verfügbar ist. Die Holzplatte wird dem Haus einen Charakter geben und die Visitenkarte des Hauses schaffen. Da die Fassadenverkleidung aus Styropor ein relativ geringes Gewicht hat, läuft die Montage sehr schnell und einfach und die Holzimitation ist ein weiterer Vorteil.    Material : Styropor mit harter Beschichtung, beständig gegen Risse und extreme Wetterbedingungen. Ist bereit zum Bemalen.   Größe Dicke [cm] : 1.2 Breite [cm] : 16.6 Länge [cm] : 120",Neu,"14,16€ / Stück",1 Stück verfügbar,(inkl. 19% MwSt.),12 Monate Gewährleistung,,{},14.16,1.0,14.16,1.0,"14,16€ / Stück",1 Stück verfügbar,0.0,,[],Wooden panel,Wood,Wood frames,Pr_20_85_32_96,Furnishings,"Blocks, Panels, Fences, Bricks",Glass blocks and panels,,0.0
2508,2508,8526,https://restado.de/baustoff/fassadenverkleidung-platten-ple12/,Fassadenverkleidung Platten PLE12,Fassade,Sonstiges Fassadenmaterial,2023-01-09,,"Fassadenverkleidung Platten PLE12 ist ein wichtiger Teil der Fassadengestaltung. Die dunkle Farbe selbst gibt eine ungewöhnliche Wirkung von echtem Holzbrett. Die Fasasdenverkleidung Platte hat ein geringes Gewicht. Die Fassadenverkleidung PLE12 sieht visuell wie echte Holzfassade aus.    Material : Styropor mit harter Beschichtung, beständig gegen Risse und extreme Wetterbedingungen. Ist bereit zum Bemalen.  Größe Dicke [cm] : 1.2 Breite [cm] ; 16.6 Länge [cm] : 120",Neu,"14,16€ / Stück",1 Stück verfügbar,(inkl. 19% MwSt.),12 Monate Gewährleistung,,{},14.16,1.0,14.16,1.0,"14,16€ / Stück",1 Stück verfügbar,0.0,,[],Facade cladding panels,Architectural glass,Cladding and lining panels,Pr_25_71_14,"Wall, Barriers, Pannels","Blocks, Panels, Fences, Bricks",Glass blocks and panels,,0.0
2557,2557,120016,https://restado.de/baustoff/design-boden-vinyl-platten/,"Design- Boden, Vinyl Platten",Innenausbau,Bodenbeläge,2023-01-09,,Design Vinyl Platten LVT 30 zum Verkleben. Grösse 15.3x 91.5cm 657 Platten sind vorhanden Nutzschicht 0.3cm Design Holz Eiche,Neu,10€ (VB) / m²,90 m² verfügbar,(10 m² Mindestabnahme),D-42279 Wuppertal,JAB ANSTOETZ,{},10.0,90.0,10.0,90.0,10€ (VB) / m²,90 m² verfügbar,0.0,,"['https://restado.de/wp-content/uploads/products/2023/02/351b46d5-image_25e9587c-0e3f-4ddb-a87a-18544b175b1b-scaled.jpg', 'https://restado.de/wp-content/uploads/products/2023/02/03d3f37e-image_60f8652d-c251-4aca-967d-c6338b8e19fa-scaled.jpg']","Design floor , vinyl panels",Vinyl ester resin,Raised access floor panels with finish,Pr_25_71_42_71,"Roof, Slabs, Stairs","Floors, Ceiling",Glass blocks and panels,,0.0
2570,2570,106871,https://restado.de/baustoff/lithotherm-formplatten-15-qm-1-ganze-palette-trockenfussboden-2/,"Lithotherm Formplatten, 15 qm (1 ganze Palette)-Trockenfußboden",Innenausbau,Bodenbeläge,2023-01-09,1673222400000.0,,,,,,,,,,,,,,,0.0,0.0,"['https://restado.de/wp-content/uploads/products/2022/06/3a4fef49-9c9d-4f42-87fe-cbb745c64ee5-2.jpg', 'https://restado.de/wp-content/uploads/products/2022/06/d4ff0731-c1be-4f48-8294-b706489ef452-1.jpg']","Lithotherm molded panels , sqm whole pallet dry floor",Expanded glass aggregates,Glazed floorlight panels,Pr_30_59_61_32,Other,"Blocks, Panels, Fences, Bricks",Glass blocks and panels,0.0,
2732,2732,121222,https://restado.de/baustoff/glaswolle-wlg-032-dichte-ca-28-kg-m3/,"Glaswolle WLG 032, Dichte ca. 28 kg/m3",Innenausbau,Trockenbau,2023-01-09,1673654400000.0,,,,,,,,,,,,,,,1.0,432000000.0,['https://restado.de/wp-content/uploads/products/2023/02/52b51d09-img-20230222-wa0004.jpg'],"Glass wool , density approx . kg/m",Glass wool,Glass fibres,Pr_20_31_01_32,Other,Other,Glass blocks and panels,5.0,
2749,2749,111608,https://restado.de/baustoff/dano-akustik-lochplatte-streulochung-rund-8-15-20-r/,DANO Akustik Lochplatte Streulochung rund 8/15/20 R,Innenausbau,Trockenbau,2023-01-09,, ,Neu,391€ (VB) Paketpreis,17 Stück verfügbar,(17 Stück Mindestabnahme),D-84089 Aiglsbach,DANO,"{""Format"": ""2000 x 1250 mm"", ""Kantenausbildung"": ""Volle Kante (VK)"", ""Anwendungsbereich"": ""Schallschutz"", ""Plattenstärke"": ""12,5 mm""}",391.0,17.0,391.0,17.0,391€ (VB) Paketpreis,17 Stück verfügbar,0.0,,[],acoustic perforated panel scattered holes round //,Loose surfacing decorative aggregates,Profiled metal acoustic panels,Pr_35_93_13_65,Other,Other,Glass blocks and panels,,0.0
2755,2755,109131,https://restado.de/baustoff/osb-platten-2/,OSB Platten,Innenausbau,Trockenbau,2023-01-09,, ,Neu,1€ (VB) / Stück,10 Stück verfügbar,(1 Stück Mindestabnahme),D-72531 Hohenstein,,{},1.0,10.0,1.0,10.0,1€ (VB) / Stück,10 Stück verfügbar,0.0,,[],panels,Sheet glass,Window panels,Pr_30_59_97,"Wall, Barriers, Pannels","Blocks, Panels, Fences, Bricks",Glass blocks and panels,,0.0
2756,2756,106865,https://restado.de/baustoff/lithotherm-formplatten-15-qm-1-ganze-palette-trockenfussboden/,"Lithotherm Formplatten, 15 qm (1 ganze Palette)-Trockenfußboden",Innenausbau,Trockenbau,2023-01-09,1673568000000.0,,,,,,,,,,,,,,,1.0,345600000.0,['https://restado.de/wp-content/uploads/products/2023/03/62d417ad-img_9152-scaled.jpg'],"Lithotherm molded panels , sqm whole pallet dry floor",Expanded glass aggregates,Glazed floorlight panels,Pr_30_59_61_32,Other,"Blocks, Panels, Fences, Bricks",Glass blocks and panels,4.0,
2761,2761,88251,https://restado.de/baustoff/akustik-paneele-deckenabsorber/,Akustik-Paneele Deckenabsorber,Innenausbau,Trockenbau,2023-01-09,,"Akustikabsorber aus gelochtem Metall, die aus einer Abhangdecke gerettet wurden. Sie sind also gebraucht und staubig. Größe 60x60x3,5cm. Man kann daraus Wand- oder Deckenabsorber bauen (Holz-UK und mit Mineralwolle füllen). Sehr hochwertige Teile - wahrscheinlich von renz Solution - superhochwertig verarbeitet, daher lassen sie sich auch gut reinigen und tolle Absorber draus bauen! 27 Stück vorhanden, entspricht einer Fläche von ca. 10qm / 3x3m. Geschätzte Anschaffungskosten ca. 2.000 €.",Gebraucht,10€ (VB) / Stück,27 Stück verfügbar,(1 Stück Mindestabnahme),D-38116 Brunswick,,{},10.0,27.0,10.0,27.0,10€ (VB) / Stück,27 Stück verfügbar,0.0,,['https://restado.de/wp-content/uploads/products/2021/12/5fe7997e-e6178b04-62bf-4b1d-804c-69822f3f3d3c.jpeg'],Acoustic panels ceiling absorbers,Heat-absorbing glass,Profiled metal acoustic panels,Pr_35_93_13_65,"Wall, Barriers, Pannels",Other,Glass blocks and panels,,0.0
2772,2772,73970,https://restado.de/baustoff/knauf-insulation-trennwand-daemmplatten-tp-115/,Knauf Insulation Trennwand Dämmplatten tp 115,Innenausbau,Trockenbau,2023-02-16,,"Trennwand-Dämmplatte TP 115 aus Glaswolle mit ECOSE® Technology in der WLS 038    Zur Schall- und Wärmedämmung von Zwischen- und Trennwänden in Trockenbauweise von Natur aus nicht brennbar   Maße: L 62,5 x B 125 x H 4 cm Paketinhalt: 14 Platten = 10,94 m2   Verkauf wegen eines nicht durchgeführten Bauvorhabens. Abholung in Berlin Kreuzberg.",Neuwertig,13€ (VB) / Stück,50 Stück verfügbar,(10 Stück Mindestabnahme),D-10997 Berlin,Knauf Insulation,{},13.0,50.0,13.0,50.0,13€ (VB) / Stück,50 Stück verfügbar,0.0,,['https://restado.de/wp-content/uploads/products/2021/04/addffba3-knaufinsulation_ki_gw_trennwand_tp_115_print.jpg'],Knauf Insulation partition insulation panels tp,Insulating glass,Rigid insulation boards and panels,Pr_25_71_70,Other,Other,Glass blocks and panels,,0.0
2792,2792,40737,https://restado.de/baustoff/mdf-platten/,MDF Platten,Innenausbau,Trockenbau,2023-01-09,,Wir verkaufen 45 MDF Holzplatten mit den Maßen 270 x 120 x 4 cm an Selbstabholer.,Neuwertig,45€ (VB) / Stück,45 Stück verfügbar,(10 Stück Mindestabnahme),D-58566 Kierspe,,{},45.0,45.0,45.0,45.0,45€ (VB) / Stück,45 Stück verfügbar,0.0,,[],panels,Sheet glass,Window panels,Pr_30_59_97,"Wall, Barriers, Pannels","Blocks, Panels, Fences, Bricks",Glass blocks and panels,,0.0
2794,2794,40422,https://restado.de/baustoff/mineralwolle-platten/,Mineralwolle Platten,Innenausbau,Trockenbau,2023-01-09,,"20 Packungen a 6 Platten, Ursa GEO DF Mineralwolle-Trennwandplatten, Klemmfilz, RD m² K/W 2,25, Maße: 1250X625X80mm. Das Material lagert trocken auf einem Dachboden in der 1. Etage und ist originalverpackt. Nur an Selbstabholer.",Neu,120€ Paketpreis,20 Stück verfügbar,(20 Stück Mindestabnahme),D-47589 Uedem,URSA GEO,{},120.0,20.0,120.0,20.0,120€ Paketpreis,20 Stück verfügbar,0.0,,[],Mineral wool panels,Mineral wool,Resin-bonded mineral wool infill panels,Pr_25_71_42_72,Structural elements,"Blocks, Panels, Fences, Bricks",Glass blocks and panels,,0.0
2810,2810,14166,https://restado.de/baustoff/9-isolierglas-fensterscheiben-sehr-guter-zustand-ohne-schaeden-verschiedene-masse/,9 Isolierglas Fensterscheiben sehr guter zustand ohne Schäden Ver…,Innenausbau,Trockenbau,2023-01-09,,"Zum Verkauf stehen hier wegen Neuanschaffung 9 Diverse Isolier Doppel Verglaste Fensterscheiben In sehr guten Zwar staubigen Zustand ohne Schäden.!! 1 x 79 cm X 109 cm 2 x 119,5 cm X 68 cm 1 x 71,5 cm X 104 cm 1 x 78 cm X 88 cm 2 x 84 cm X 91,5 cm 1 x 79,5 X 109,5 cm 1 x 84 cm X 124,5 cm Alle Scheiben 200 Vb .",Neuwertig,200€ (VB) / Stück,9 Stück verfügbar,(1 Stück Mindestabnahme),Neuwertig,,{},200.0,9.0,200.0,9.0,200€ (VB) / Stück,9 Stück verfügbar,0.0,,[],insulating glass window panes in very good condition with no damage .,Insulating glass,Glazed security window panels,Pr_30_59_97_16,Other,Other,Glass blocks and panels,,0.0
2812,2812,8254,https://restado.de/baustoff/owacoustic-premium-dmmplatten-cosmus-n-2/,Dämmplatten T90 OWAcoustic Premium Cosmus N,Innenausbau,Trockenbau,2023-01-09,,T90 OWAcoustic Premium Dämmplatten Cosmus N  Preis: 640 VHB ca. 160 qm  OWAcoustic Premium Deckenplatten weiß Mineralwolle Decken Kante 1b T90 Originalverpackt Nur an Selbstabholer Bei Fragen bitte melden,Neu,4€ (VB) / m²,160 m² verfügbar,(inkl. 19% MwSt.),Neu,,{},4.0,160.0,4.0,160.0,4€ (VB) / m²,160 m² verfügbar,0.0,,[],Insulation panels OWAcoustic Premium Cosmus,Insulating glass,Rigid insulation boards and panels,Pr_25_71_70,Other,Other,Glass blocks and panels,,0.0
2821,2821,106854,https://restado.de/baustoff/lithotherm-formplatten-15-qm-1-ganze-palette/,"Lithotherm - Formplatten, 13 qm (fast 1 ganze Palette)",Innenausbau,Estrich,2023-04-21,,,,,,,,,{},0.0,0.0,0.0,0.0,,,0.0,,"['https://restado.de/wp-content/uploads/products/2022/06/3a4fef49-9c9d-4f42-87fe-cbb745c64ee5.jpg', 'https://restado.de/wp-content/uploads/products/2023/03/b8ae38d4-img_9152-scaled.jpg', 'https://restado.de/wp-content/uploads/products/2022/06/d4ff0731-c1be-4f48-8294-b706489ef452.jpg']","Lithotherm - molded plates , sqm almost whole pallet",Plate glass,Glass patch plates,Pr_20_29_34_35,Other,Other,Glass blocks and panels,,0.0
2845,2845,107986,https://restado.de/baustoff/decorpaneele-natuerliche-eiche/,Decorpaneele NATÜRLICHE EICHE,Innenausbau,Sonstiges,2023-01-09,,"Top Design Lösung  +Unsere Decorpaneele, gibt es nicht im Baumarkt !  Lammelen schritt 1,2cm , 2,7cm Breite Lameelen und Dicke ist 1,3cm  +Haus, Wohnung, Büro, Musikstudio, Einzelhandel, Hotels. +Einfache Montage Wand, Decke. +Super Ergebnis  Produktbeschreibung   Size: 600x2400mm 1.44m2  Ca.2 Wochen Lieferzeit auf Bestellung  Besuchen Sie unsere Webseite und erfahren Sie mehr:  https://www.akustik-paneele.com/",Neu,120€ (VB) / Stück,106 Stück verfügbar,(1 Stück Mindestabnahme),D-47226 Duisburg,Lettland,"{""Produkt"": ""Decorpaneele NATÜRLICHE EICHE""}",120.0,106.0,120.0,106.0,120€ (VB) / Stück,106 Stück verfügbar,0.0,,['https://restado.de/wp-content/uploads/products/2022/06/82fdfb64-natureiche.jpg'],Decor panels,Decorative aggregates,Decorative metal panels,Pr_25_71_50_24,Furnishings,"Blocks, Panels, Fences, Bricks",Glass blocks and panels,,0.0
