,Unnamed: 0,Nr,URL,Title,Category,Subcategory,Saved,LastUpOn,Description,Zustand,FirstPrice,FirstAvailable,MinAmount,Location,Hersteller,Properties,FirstPriceNumeric,FirstAvailableNumeric,LastPriceNumeric,LastAvailableNumeric,LastPrice,LastAvailable,Sold,SoldAfter,Imagefile,Title_en,material_emb,German_Raw,German_Code,first_level,second_level,third_level,SoldAfterDays,StockChange
780,780,62411,https://restado.de/baustoff/kunststofffenster-24/,Kunststofffenster,Fenster,Aussenfenster,2023-01-09,1677369600000.0,"DIN-L, D/K, Falz, Dichtung, Ornamentglas (Bad), Wsg., Fenster waren mit Außenrollo bestückt, erhalten sind die Schienen die als Führung für die Lamellen dienten, Regal 8/1.  Material: Kunststoff Farbe: weiß Baujahr: 2005 Höhe: 140,50 cm Breite: 127,50 cm Länge/Tiefe: 7,00 cm Gewicht: 50,00 kg  Lieferung nach Absprache.",Neuwertig,140€ / Stück,1 Stück verfügbar,(1 Stück Mindestabnahme),D-28217 Bremen,,{},140.0,1.0,140.0,1.0,140€ / Stück,1 Stück verfügbar,1.0,4147200000.0,,Plastic windows,Plastics,Plastics window films,Pr_25_57_51_60,"Wall, Barriers, Pannels","Door, Windows, Gates",Glass blocks and panels,48.0,0.0
781,781,62405,https://restado.de/baustoff/kunststofffenster-21/,Kunststofffenster,Fenster,Aussenfenster,2023-01-09,1676937600000.0,"DIN-L, D/K, Falz, Dichtung, Wsg., Fenster waren mit Außenrollo bestückt, erhalten sind die Schienen die als Führung für die Lamellen dienten, Regal 8/2.  Material: Kunststoff Farbe: weiß Baujahr: 2006 Höhe: 140,00 cm Breite: 153,00 cm Länge/Tiefe: 7,00 cm Gewicht: 60,00 kg  Lieferung nach Absprache.",Neuwertig,140€ / Stück,1 Stück verfügbar,(1 Stück Mindestabnahme),D-28217 Bremen,,{},140.0,1.0,140.0,1.0,140€ / Stück,1 Stück verfügbar,1.0,3715200000.0,,Plastic windows,Plastics,Plastics window films,Pr_25_57_51_60,"Wall, Barriers, Pannels","Door, Windows, Gates",Glass blocks and panels,43.0,0.0
782,782,62407,https://restado.de/baustoff/kunststofffenster-22/,Kunststofffenster,Fenster,Aussenfenster,2023-01-09,1675900800000.0,"DIN-L, D/K, Falz, Dichtung, Wsg., Fenster waren mit Außenrollo bestückt, erhalten sind die Schienen die als Führung für die Lamellen dienten, Regal 8/2.  Material: Kunststoff Farbe: weiß Baujahr: 2006 Höhe: 140,00 cm Breite: 152,00 cm Länge/Tiefe: 7,00 cm Gewicht: 60,00 kg  Lieferung nach Absprache.",Neuwertig,140€ / Stück,1 Stück verfügbar,(1 Stück Mindestabnahme),D-28217 Bremen,,{},140.0,1.0,140.0,1.0,140€ / Stück,1 Stück verfügbar,1.0,2678400000.0,,Plastic windows,Plastics,Plastics window films,Pr_25_57_51_60,"Wall, Barriers, Pannels","Door, Windows, Gates",Glass blocks and panels,31.0,0.0
783,783,62413,https://restado.de/baustoff/kunststofffenster-mit-schallschutzglas/,Kunststofffenster mit Schallschutzglas,Fenster,Aussenfenster,2023-01-09,1676764800000.0,"DIN-rechts angeschlagenes Kunststofffenster mit Schallschutzglas. Zu finden in Regal 8/2.  Material: Kunststoff/Glas Farbe: weiß Baujahr: 1996 Höhe: 142,00 cm Breite: 105,00 cm Länge/Tiefe: 6,00 cm Gewicht: 60,00 kg  Lieferung nach Absprache.",Neuwertig,90€ / Stück,1 Stück verfügbar,(1 Stück Mindestabnahme),D-28217 Bremen,,{},90.0,1.0,90.0,1.0,90€ / Stück,1 Stück verfügbar,1.0,3542400000.0,,Plastic windows with soundproof glass,Safety glass,Plastics window films,Pr_25_57_51_60,Other,"Door, Windows, Gates",Glass blocks and panels,41.0,0.0
784,784,60586,https://restado.de/baustoff/fenster-52/,Fenster,Fenster,Aussenfenster,2023-04-26,1687651200000.0,Preise variieren je nach Fenster.... 7 Stück zu verkaufen  2x 1020 x 1000 : 280 € pro Fenster  3x 2020x 1020: 570 € pro Fenster  1x 1500x 1020 : 470€ 1x 3010x 1020 : 840 €,Neu,840€ (VB) / Stück,7 Stück verfügbar,(1 Stück Mindestabnahme),D-96528 Schalkau,,"{""Material Fensterflügel"": ""Kunststoff"", ""Verglasungs-Art"": ""2-fach"", ""Öffnungsart"": ""Dreh-/Kippflügel"", ""Material Fensterrahmen"": ""Kunststoff"", ""Farbe Fensterrahmen"": ""Außen:Nussbaum innen: weiß""}",840.0,7.0,840.0,7.0,840€ (VB) / Stück,7 Stück verfügbar,1.0,5184000000.0,['https://restado.de/wp-content/uploads/products/2020/10/2b7fc11b-20201004_200742-scaled.jpg'],Window,Glass,Window walls,Pr_30_59_99,Openings,"Door, Windows, Gates",Glass blocks and panels,60.0,0.0
785,785,60244,https://restado.de/baustoff/holzfenster-10/,Holzfenster,Fenster,Aussenfenster,2023-01-09,1677888000000.0, ,Gebraucht,1€ / Stück,8 Stück verfügbar,(1 Stück Mindestabnahme),D-21029 Hamburg,,"{""Anschlag"": ""siehe Bilder"", ""Element-Breite"": ""unterschiedlich"", ""Element-Höhe"": ""unterschiedlich"", ""Material Fensterflügel"": ""Holz"", ""Farbe Fensterflügel"": ""weiß"", ""Verglasungs-Art"": ""2-fach"", ""Öffnungsart"": ""Kipp- und Drehflügel"", ""Material Fensterrahmen"": ""Holz"", ""Farbe Fensterrahmen"": ""weiß gestrichen""}",1.0,8.0,1.0,8.0,1€ / Stück,8 Stück verfügbar,1.0,4665600000.0,['https://restado.de/wp-content/uploads/products/2020/10/3b8b57bc-img_20200818_112855-scaled.jpg'],Wooden windows,Wood,Wood window walls,Pr_30_59_99_96,Furnishings,"Door, Windows, Gates",Glass blocks and panels,54.0,0.0
786,786,59836,https://restado.de/baustoff/fenster-51/,Fenster,Fenster,Aussenfenster,2023-01-09,1677542400000.0,"Unterschiedliche Fensterbreiten mit Alu Jalousien, teilweise elektrisch",Gebraucht,1€ (VB) / Stück,10 Stück verfügbar,(1 Stück Mindestabnahme),D-36100 Petersberg,,"{""Material Fensterflügel"": ""Kunststoff"", ""Farbe Fensterflügel"": ""Weiß"", ""Verglasungs-Art"": ""2-fach"", ""Öffnungsart"": ""Dreh-/Kippflügel"", ""Ausführung"": ""1, 2 flügelig und Fensterfront mit Tür"", ""Material Fensterrahmen"": ""Kunststoff"", ""Farbe Fensterrahmen"": ""Weiß""}",1.0,10.0,1.0,10.0,1€ (VB) / Stück,10 Stück verfügbar,1.0,4320000000.0,[],Window,Glass,Window walls,Pr_30_59_99,Openings,"Door, Windows, Gates",Glass blocks and panels,50.0,0.0
787,787,59616,https://restado.de/baustoff/josko-serie-safir/,"JOSKO, Serie Safir Kunststoff/Alu Fenster",Fenster,Aussenfenster,2023-01-09,1677369600000.0,"Ich biete 4 Kunststoff/Alu Fenster aus der Serie Safir Pure der Firma Josko Fenster & Türen. Alle Fenster sind aus Kunststoff; innen in der Farbe Weiß; außen mit Aludeckschale in RAL7016. Die Fenster sind innen und auch außen bündig. Die Fenster wurden nie eingebaut, weil sie falsch geliefert wurden. Sie lagern seit ca. 1,5 Jahren trocken, abgedeckt und unbeschädigt.  Informationen zur Serie Safir finden Sie unter folgendem Link: https://www.josko.de/de/produkte/fenster/safir-pure-23/  Zu den Bildern: 151.0 ist ein Festelement. 150.0 besteht aus einem Festelement und einem Dreh-Kipp-Element. Die Maße bitte den Bildern entnehmen. Einzelpreis 800,00 €.  161.0 ist ein Festelement. 160.0 besteht aus einem Festelement und einem Dreh-Kipp-Element. Die Maße bitte den Bildern entnehmen. Einzelpreis 800,00 €.  191.0 ist ein Festelement. 190.0 besteht aus einem Festelement und einem Dreh-Kipp-Element. Die Maße bitte den Bildern entnehmen. Einzelpreis 800,00 €.  220.0 besteht aus einem Festelement und einem Dreh-Kipp-Element. Maße bitte den Bildern entnehmen. Einzelpreis 600,00 €.  WICHTIG: Aufgrund der Fenstergröße ist das Glas nicht in den Rahmen eingesetzt. Der Einbau des Glases und auch der Einbau der Fenster ist im Preis nicht dabei. Auch sind keine Griffe inklusive. Es handelt sich um einen Privatverkauf. Deshalb kein Umtausch/keine Rücknahme. Es ist nur Selbstabholung möglich.  Die Fenster können vor dem Kauf selbstverständlich alle besichtigt werden.",Neuwertig,800€ / Stück,4 Stück verfügbar,(1 Stück Mindestabnahme),D-92339 Beilngries,JOSKO Fenster und Türen,"{""Farbe Fensterflügel"": ""Innen weiß / Außen RAL7016"", ""Verglasungs-Art"": ""3-fach"", ""Material Fensterrahmen"": ""Kunststoff"", ""Farbe Fensterrahmen"": ""Innen weiß / Außen RAL7016"", ""U-Wert"": ""0,71W/m2K""}",800.0,4.0,800.0,4.0,800€ / Stück,4 Stück verfügbar,1.0,4147200000.0,"['https://restado.de/wp-content/uploads/products/2020/09/268b18fb-0f52b1ae-cdb9-4bd8-b192-e2069560a428.jpeg', 'https://restado.de/wp-content/uploads/products/2020/09/59e29c5e-6bf15a29-3d0c-4df2-8a52-cae00a7f3eba.jpeg', 'https://restado.de/wp-content/uploads/products/2020/09/159e1f6d-0c7f5804-8c2a-42ff-959e-60c6873bf57e.jpeg', 'https://restado.de/wp-content/uploads/products/2020/09/ebd47fa0-30ade171-eda5-40ec-bfd1-0f977c1ddb5f.jpeg', 'https://restado.de/wp-content/uploads/products/2020/09/4dabb930-5b3570cf-07e3-4161-8b4e-71d546d09ff9.jpeg', 'https://restado.de/wp-content/uploads/products/2020/09/6888a465-9538e8b2-f546-43fd-97be-363e2850e2a9.jpeg']",", Safir series plastic/aluminium windows",Aluminium,Aluminium window walls,Pr_30_59_99_02,Other,"Door, Windows, Gates",Glass blocks and panels,48.0,0.0
788,788,59649,https://restado.de/baustoff/8-grossfenster/,4 Großfenster,Fenster,Aussenfenster,2023-01-09,1677888000000.0,"Die Fenster liegen auf der Seite. Das heißt oben ist ein Lüftungskippfenster. Maße ungefähr B/H 190/220.  Die anderen 4 Fenster waren normale Terrassentüren, die aber nun leider schon abgeholt worden sind. Ich weiß nur nicht, wie ich die Fotos löschen kann.",Gebraucht,1€ (VB) / Stück,4 Stück verfügbar,(1 Stück Mindestabnahme),D-33689 Bielefeld,keine Ahnung,"{""Material Fensterflügel"": ""Holz"", ""Farbe Fensterflügel"": ""dunkel, siehe Foto"", ""Material Fensterrahmen"": ""Holz""}",1.0,4.0,1.0,4.0,1€ (VB) / Stück,4 Stück verfügbar,1.0,4665600000.0,['https://restado.de/wp-content/uploads/products/2020/09/73ed0408-img_20200925_082304146-scaled.jpg'],large windows,Prismatic glass,Window panels,Pr_30_59_97,Other,"Door, Windows, Gates",Glass blocks and panels,54.0,0.0
789,789,59492,https://restado.de/baustoff/inoutic-3-fach-verglasung-kunststofffenster/,Inoutic 3-fach Verglasung Kunststofffenster,Fenster,Aussenfenster,2023-01-09,1677110400000.0, ,Neu,200€ (VB) / Stück,3 Stück verfügbar,(1 Stück Mindestabnahme),D-92729 Weiherhammer,Inoutic,"{""Material Fensterflügel"": ""Kunststoff"", ""Farbe Fensterflügel"": ""Weiß"", ""Verglasungs-Art"": ""3-fach"", ""Öffnungsart"": ""Dreh-/Kippflügel"", ""Ausführung"": ""2-flügelig"", ""Material Fensterrahmen"": ""Kunststoff"", ""Farbe Fensterrahmen"": ""Weiß"", ""U-Wert"": ""0,6""}",200.0,3.0,200.0,3.0,200€ (VB) / Stück,3 Stück verfügbar,1.0,3888000000.0,['https://restado.de/wp-content/uploads/products/2020/09/73633373-fenster-1.jpg'],Inoutic triple glazing plastic window,Prismatic glass,Glazing plastics framed panels,Pr_25_71_57_35,Other,"Door, Windows, Gates",Glass blocks and panels,45.0,0.0
790,790,59214,https://restado.de/baustoff/2-fenster-2-verglast-mit-rolladen/,2 Fenster 2 verglast mit Rolladen,Fenster,Aussenfenster,2023-01-09,1677628800000.0,2 zweifach verglaste Außenfenster günstig abzugeben,Gebraucht,50€ (VB) / Stück,2 Stück verfügbar,(1 Stück Mindestabnahme),D-70563 Stuttgart,Weru,"{""Anschlag"": ""Rechts wie Links"", ""Element-Breite"": ""kleines Fenster 1,17m, großes Fenster 1,47m"", ""Element-Höhe"": ""beide Fenster 1,60m inklsv. Rolladen"", ""Material Fensterflügel"": ""Kunststoff"", ""Farbe Fensterflügel"": ""weiß"", ""Verglasungs-Art"": ""2-fach"", ""Öffnungsart"": ""Dreh-/Kippflügel"", ""Ausführung"": ""1-flügelig"", ""Material Fensterrahmen"": ""Kunststoff"", ""Farbe Fensterrahmen"": ""weiß""}",50.0,2.0,50.0,2.0,50€ (VB) / Stück,2 Stück verfügbar,1.0,4406400000.0,"['https://restado.de/wp-content/uploads/products/2020/09/da6b7ee2-img-20200922-wa0009-rotated.jpg', 'https://restado.de/wp-content/uploads/products/2020/09/7347cc68-20200913_125831_resized.jpg']",windows glazed with shutters,Mosaic glass,Glazed security window panels,Pr_30_59_97_16,Other,Other,Glass blocks and panels,51.0,0.0
791,791,58890,https://restado.de/baustoff/ema-therm-climalit-fenster/,"CLIMALIT 14 Kunststoff Fenster & 1 Terrassentür, 92/93, Doppelverg…",Fenster,Aussenfenster,2023-01-09,1677024000000.0,"Ausbau-Datum: 16.09.2020  !! Bei Gesamtabnahme, gebe ich kostenlos ab. !!  CLIMALIT  Doppelverglasung BJ 92/93 Gebraucht Teilweise auch mit Jalousien   8 mal: 0,96 x 0,75 2 mal: 1,14 x 0,93 3 mal: 1,25 x 0,93 (+ Jalousie) 1 mal: Doppel (insgesamt) 1,23 x 2,10 (+ Jalousie) 1 mal Terrassen-Tür: 2,10 x 1,04 (+Jalousie)  Größenangabe in ca. und inkl. Rahmen (ohne Gewähr) Nur Abholung! Besichtigung auf Anfrage möglich.",Gebraucht,10€ (VB) / Stück,15 Stück verfügbar,(1 Stück Mindestabnahme),D-42781 Haan,CLIMALIT,"{""Material Fensterflügel"": ""Kunststoff"", ""Farbe Fensterflügel"": ""Weiß"", ""Verglasungs-Art"": ""2-fach"", ""Öffnungsart"": ""Dreh-/Kippflügel"", ""Material Fensterrahmen"": ""Kunststoff"", ""Farbe Fensterrahmen"": ""Weiß""}",10.0,15.0,10.0,15.0,10€ (VB) / Stück,15 Stück verfügbar,1.0,3801600000.0,"['https://restado.de/wp-content/uploads/products/2020/09/024108c1-img_6292-scaled.jpg', 'https://restado.de/wp-content/uploads/products/2020/09/5ceb68ca-img_6294.jpg', 'https://restado.de/wp-content/uploads/products/2020/09/feb7f4b4-img_6290-scaled.jpg']","plastic windows & patio door , / , double glazed…",Coloured glass,Glazed enclosures,Pr_20_65_34_34,"Roof, Slabs, Stairs","Door, Windows, Gates",Glass blocks and panels,44.0,0.0
792,792,58765,https://restado.de/baustoff/fenster-46/,Fenster,Fenster,Aussenfenster,2023-01-09,1677369600000.0,Wurden aus ein Rohbau ausgebaut...und müssteh schnell abgeholt werden...,Neu,95€ (VB) / Stück,150 Stück verfügbar,(1 Stück Mindestabnahme),D-10178 Berlin,,"{""Element-Breite"": ""1,26 m"", ""Element-Höhe"": ""1,01 m"", ""Material Fensterflügel"": ""Kunststoff"", ""Verglasungs-Art"": ""2-fach"", ""Öffnungsart"": ""Dreh-/Kippflügel"", ""Ausführung"": ""2-flügelig"", ""Material Fensterrahmen"": ""Kunststoff""}",95.0,150.0,95.0,150.0,95€ (VB) / Stück,150 Stück verfügbar,1.0,4147200000.0,"['https://restado.de/wp-content/uploads/products/2020/09/3dc647f1-img_1599462021057_38237.jpg', 'https://restado.de/wp-content/uploads/products/2020/09/bdadd0e2-img_1599222995515_83334.jpg']",Window,Glass,Window walls,Pr_30_59_99,Openings,"Door, Windows, Gates",Glass blocks and panels,48.0,0.0
793,793,58459,https://restado.de/baustoff/fenster-45/,Fenster,Fenster,Aussenfenster,2023-01-09,1677024000000.0, ,Gebraucht,20€ / Stück,9 Stück verfügbar,(1 Stück Mindestabnahme),D-33330 Gütersloh,,"{""Anschlag"": ""DIN Rechts"", ""Material Fensterflügel"": ""Kunststoff"", ""Farbe Fensterflügel"": ""Weiß"", ""Verglasungs-Art"": ""2-fach"", ""Öffnungsart"": ""Dreh-/Kippflügel"", ""Ausführung"": ""1-flügelig"", ""Material Fensterrahmen"": ""Kunststoff"", ""Farbe Fensterrahmen"": ""Weiss""}",20.0,9.0,20.0,9.0,20€ / Stück,9 Stück verfügbar,1.0,3801600000.0,[],Window,Glass,Window walls,Pr_30_59_99,Openings,"Door, Windows, Gates",Glass blocks and panels,44.0,0.0
794,794,58426,https://restado.de/baustoff/holzfenster-9/,Holzfenster,Fenster,Aussenfenster,2023-01-09,1677628800000.0,"Maße der Fenster A:152,5cm b X 126,0cm h  B: 174,5cm b X 138,0cm h  C: 185,5cm b X 146,0cm h Je 1 Flügel Dreh/Kipp, 1 Flügel Dreh. Doppelglas",Gebraucht,120€ (VB) / Stück,3 Stück verfügbar,(1 Stück Mindestabnahme),D-21394 Südergellersen,,{},120.0,3.0,120.0,3.0,120€ (VB) / Stück,3 Stück verfügbar,1.0,4406400000.0,"['https://restado.de/wp-content/uploads/products/2020/09/368cbe6a-p1070861-scaled.jpg', 'https://restado.de/wp-content/uploads/products/2020/09/5af25f17-p1070860-scaled.jpg', 'https://restado.de/wp-content/uploads/products/2020/09/a2192728-p1070862-scaled.jpg']",Wooden windows,Wood,Wood window walls,Pr_30_59_99_96,Furnishings,"Door, Windows, Gates",Glass blocks and panels,51.0,0.0
796,796,57914,https://restado.de/baustoff/kunststofffenster-8/,Kunststofffenster,Fenster,Aussenfenster,2023-01-09,1677369600000.0,Anschlag: Links Dreh / Rechts Drehkipp Öffnungsart: Dreh-/Drehkipp Elementbreite: 110cm Elementhöhe: 136cm,Neu,150€ (VB) / Stück,3 Stück verfügbar,(1 Stück Mindestabnahme),D-63667 Nidda,VEKA,"{""Material Fensterflügel"": ""Kunststoff"", ""Farbe Fensterflügel"": ""weiß"", ""Verglasungs-Art"": ""2-fach"", ""Ausführung"": ""2-flügelig"", ""Material Fensterrahmen"": ""Kunststoff"", ""Farbe Fensterrahmen"": ""weiß"", ""U-Wert"": ""1,3""}",150.0,3.0,150.0,3.0,150€ (VB) / Stück,3 Stück verfügbar,1.0,4147200000.0,"['https://restado.de/wp-content/uploads/products/2020/08/8eb0f3cb-img_0564-scaled.jpg', 'https://restado.de/wp-content/uploads/products/2020/08/78ab1f41-img_0567-scaled.jpg.webp']",Plastic windows,Plastics,Plastics window films,Pr_25_57_51_60,"Wall, Barriers, Pannels","Door, Windows, Gates",Glass blocks and panels,48.0,0.0
797,797,57942,https://restado.de/baustoff/fenster-44/,Fenster,Fenster,Aussenfenster,2023-01-09,1677196800000.0, ,Neu,270€ (VB) / Stück,3 Stück verfügbar,(1 Stück Mindestabnahme),D-06456 Sandersleben,Veka,"{""Material Fensterflügel"": ""Kunststoff"", ""Farbe Fensterflügel"": ""weiss"", ""Verglasungs-Art"": ""2-fach"", ""Öffnungsart"": ""Dreh-/Kippflügel"", ""Ausführung"": ""2-flügelig"", ""Material Fensterrahmen"": ""Kunststoff"", ""U-Wert"": ""1,1""}",270.0,3.0,270.0,3.0,270€ (VB) / Stück,3 Stück verfügbar,1.0,3974400000.0,['https://restado.de/wp-content/uploads/products/2020/08/3ff5b799-20200823_164537-scaled.jpg'],Window,Glass,Window walls,Pr_30_59_99,Openings,"Door, Windows, Gates",Glass blocks and panels,46.0,0.0
798,798,57792,https://restado.de/baustoff/fenster-43/,fenster,Fenster,Aussenfenster,2023-01-09,1678579200000.0, ,Neuwertig,70€ / Stück,1 Stück verfügbar,(1 Stück Mindestabnahme),D-53332 Bornheim,Salamander,"{""Anschlag"": ""DIN Rechts"", ""Material Fensterflügel"": ""Kunststoff"", ""Farbe Fensterflügel"": ""anthrazit 7016"", ""Verglasungs-Art"": ""3-fach"", ""Öffnungsart"": ""Dreh-/Kippflügel"", ""Ausführung"": ""1-flügelig"", ""Material Fensterrahmen"": ""Kunststoff"", ""U-Wert"": ""0,6""}",70.0,1.0,70.0,1.0,70€ / Stück,1 Stück verfügbar,1.0,5356800000.0,"['https://restado.de/wp-content/uploads/products/2020/08/b138fae6-img_50561-scaled.jpg.webp', 'https://restado.de/wp-content/uploads/products/2020/08/c3a63e02-fenster1.png']",window,Glass,Window walls,Pr_30_59_99,Openings,"Door, Windows, Gates",Glass blocks and panels,62.0,0.0
801,801,57007,https://restado.de/baustoff/fenster-42/,Fenster,Fenster,Aussenfenster,2023-05-07,1686787200000.0, ,Neu,446€ (VB) / Stück,1 Stück verfügbar,(1 Stück Mindestabnahme),D-01968 Senftenberg,Drutex,"{""Material Fensterflügel"": ""Kunststoff"", ""Farbe Fensterflügel"": ""Weiß"", ""Verglasungs-Art"": ""2-fach"", ""Öffnungsart"": ""Dreh-/Kippflügel"", ""Ausführung"": ""2-flügelig"", ""Material Fensterrahmen"": ""Kunststoff"", ""Farbe Fensterrahmen"": ""Weiß""}",446.0,1.0,446.0,1.0,446€ (VB) / Stück,1 Stück verfügbar,1.0,3369600000.0,"['https://restado.de/wp-content/uploads/products/2020/08/7074fea6-628dd8ed-8f10-482a-9de3-c2d2aa3732af.png', 'https://restado.de/wp-content/uploads/products/2020/08/6dd7de6f-545f0c75-d6ff-49eb-910b-f0308206b125.jpeg']",Window,Glass,Window walls,Pr_30_59_99,Openings,"Door, Windows, Gates",Glass blocks and panels,39.0,0.0
802,802,56464,https://restado.de/baustoff/fenster-dreifachverglast-incl-aussenjalousie/,Fenster dreifachverglast incl. Außenjalousie,Fenster,Aussenfenster,2023-01-09,1676505600000.0,"Das Fenster wurde bei unserem Bauvorhaben fälschlicherweise eingebaut. Es ist quasi wie neu, lediglich einmal ein- und wieder ausgebaut.  Innen weiß, Außen anthrazit (RAL 7016) ohne Fenstergriff Marke: Wirus Abmessungen (inkl. Rolladenkasten): BxH 124x136 cm Rolladenfarbe: weiß Rolladen elektrisch",Neuwertig,175€ (VB) / Stück,1 Stück verfügbar,(1 Stück Mindestabnahme),D-68723 Oftersheim,Wirus,"{""Anschlag"": ""DIN Links"", ""Material Fensterflügel"": ""Kunststoff"", ""Farbe Fensterflügel"": ""Außen anthrazit RAL 7016 / Innen weiß"", ""Verglasungs-Art"": ""3-fach"", ""Öffnungsart"": ""Dreh-/Kippflügel"", ""Ausführung"": ""1-flügelig"", ""Material Fensterrahmen"": ""Kunststoff"", ""Farbe Fensterrahmen"": ""Außen anthrazit RAL 7016 / Innen weiß""}",175.0,1.0,175.0,1.0,175€ (VB) / Stück,1 Stück verfügbar,1.0,3283200000.0,['https://restado.de/wp-content/uploads/products/2020/07/579f0812-fenster1.jpg'],Triple glazed window including external blinds,Mosaic glass,External venetian blinds,Pr_30_59_07_27,Other,"Door, Windows, Gates",Glass blocks and panels,38.0,0.0
804,804,53470,https://restado.de/baustoff/fenster-41/,Fenster,Fenster,Aussenfenster,2023-01-09,1677196800000.0, ,Neuwertig,150€ (VB) / Stück,11 Stück verfügbar,(1 Stück Mindestabnahme),D-54456 Tawern,,"{""Anschlag"": ""DIN Links"", ""Material Fensterflügel"": ""Kunststoff"", ""Verglasungs-Art"": ""3-fach"", ""Öffnungsart"": ""Dreh-/Kippflügel"", ""Ausführung"": ""2-flügelig"", ""Material Fensterrahmen"": ""Kunststoff""}",150.0,11.0,150.0,11.0,150€ (VB) / Stück,11 Stück verfügbar,1.0,3974400000.0,"['https://restado.de/wp-content/uploads/products/2020/05/834cbcc8-img_1757.jpg.webp', 'https://restado.de/wp-content/uploads/products/2020/05/98857fa4-img_1760.jpg.webp']",Window,Glass,Window walls,Pr_30_59_99,Openings,"Door, Windows, Gates",Glass blocks and panels,46.0,0.0
805,805,53417,https://restado.de/baustoff/internorm-kv440-fenster/,Internorm KV440 Fenster,Fenster,Aussenfenster,2023-01-09,1675468800000.0,Biete hier 4 neue Internorm Fenster an. Es handelt sich um das Modell KV440 mit innenliegenden photovoltaik Jalousien.  Günstig abzugeben.  3 Fenster haben die Maße 1290 x 965 1 Fenster hat das Maß 1090 x 965  2 Mückengitter wären inklusive.,Neu,450€ (VB) / Stück,4 Stück verfügbar,(1 Stück Mindestabnahme),D-87437 Kempten (Allgäu),Internorm,"{""Material Fensterflügel"": ""Kunststoff"", ""Verglasungs-Art"": ""3-fach"", ""Öffnungsart"": ""Drehflügel"", ""Ausführung"": ""1-flügelig"", ""Material Fensterrahmen"": ""Stahl""}",450.0,4.0,450.0,4.0,450€ (VB) / Stück,4 Stück verfügbar,1.0,2246400000.0,['https://restado.de/wp-content/uploads/products/2020/05/72d61b52-img_20191212_144118-scaled.jpg.webp'],Internorm window,Architectural glass,Window panels,Pr_30_59_97,Other,"Door, Windows, Gates",Glass blocks and panels,26.0,0.0
806,806,53122,https://restado.de/baustoff/weru-kunststoff-fenster-mit-rollladen-und-fensterbank/,WERU Kunststoff Fenster mit Rollladen und Fensterbank,Fenster,Aussenfenster,2023-04-09,1685318400000.0,"Verkaufen ein einflügliges weißes Kunststoff - Fenster der Firma WERU (System K27 Fe9)  Zweifach-Verglasung, Dreh-Kipp-Bedienung, Anschlag rechts Maße Breite 97 cm Höhe 149cm integrierter Rollladen mit Kurbelbedienung (siehe Beispielbild 2) Rollladenkasten ist innen (siehe Beispielbild 3). Außenfensterbank aus Aluminium.. Das Fenster ist in einem guten Zustand und wurde nur wegen Umbaumaßnahmen ausgebaut.",Gebraucht,180€ (VB) / Stück,1 Stück verfügbar,(1 Stück Mindestabnahme),D-79410 Badenweiler,WERU,"{""Material Fensterflügel"": ""Kunststoff"", ""Farbe Fensterflügel"": ""weis"", ""Verglasungs-Art"": ""2-fach"", ""Öffnungsart"": ""Dreh-/Kippflügel"", ""Ausführung"": ""1-flügelig"", ""Material Fensterrahmen"": ""Kunststoff"", ""Farbe Fensterrahmen"": ""weis""}",180.0,1.0,180.0,1.0,180€ (VB) / Stück,1 Stück verfügbar,1.0,4320000000.0,"['https://restado.de/wp-content/uploads/products/2020/05/26d9d0a4-p1020970-scaled.jpg.webp', 'https://restado.de/wp-content/uploads/products/2020/05/050467a1-p1020967-scaled.jpg.webp', 'https://restado.de/wp-content/uploads/products/2020/05/154dc5a6-p1020971-scaled.jpg.webp']",plastic window with roller shutters and window sill,Rolled glass,Plastics window films,Pr_25_57_51_60,Other,Other,Glass blocks and panels,50.0,0.0
808,808,49375,https://restado.de/baustoff/3-fachverglaste-schiebetuere/,3-Fachverglaste Schiebetüre,Fenster,Aussenfenster,2023-01-09,1676851200000.0,Die Schiebetüre war 3 Wochen eingebaut (vermessen) VK Preis war 8900 € Die Schutzfolie an der Schwelle ist noch vorhanden,Neuwertig,500€ (VB) / Stück,1 Stück verfügbar,(1 Stück Mindestabnahme),D-73614 Schorndorf,Aluplast Profil ,"{""Anschlag"": ""DIN Rechts"", ""Material Fensterflügel"": ""Kunststoff"", ""Farbe Fensterflügel"": ""Innen Weis ,Außen Alu Ral 7016"", ""Verglasungs-Art"": ""3-fach"", ""Öffnungsart"": ""Dreh-/Kippflügel"", ""Ausführung"": ""1-flügelig"", ""Material Fensterrahmen"": ""Kunststoff"", ""Farbe Fensterrahmen"": ""Weiß""}",500.0,1.0,500.0,1.0,500€ (VB) / Stück,1 Stück verfügbar,1.0,3628800000.0,['https://restado.de/wp-content/uploads/products/2021/02/e9e4b1a7-fenster.jpg'],Triple glazed sliding door,Mosaic glass,Pneumatic sliding door mechanisms,Pr_30_36_59_62,Furnishings,"Door, Windows, Gates",Glass blocks and panels,42.0,0.0
809,809,49388,https://restado.de/baustoff/diverse-fenster-u-rahmen/,Diverse Fenster u. Rahmen,Fenster,Aussenfenster,2023-06-02,1690761600000.0,"Diverse Fenster in vielen Größen, alle Weiß Kunststoff 2 Fach verglast.Es ist Auch ein kompletter Wintergarten dabei. 2 sehr große Massive Kasettenholztüren etc. Ideal Besichtigung vor Ort, wenn möglich komplett oder mehrere Posten abzugeben.  TEL. 017631338687",Gebraucht,1.234€ (VB) Paketpreis,1.234 Stück verfügbar,(1.234 Stück Mindestabnahme),D-16348 Wandlitz,Diverse,"{""Anschlag"": ""DIN Links"", ""Material Fensterflügel"": ""Kunststoff"", ""Farbe Fensterflügel"": ""Weiß"", ""Verglasungs-Art"": ""2-fach"", ""Material Fensterrahmen"": ""Kunststoff"", ""Farbe Fensterrahmen"": ""Weiß""}",1234.0,1234.0,1234.0,1234.0,1.234€ (VB) Paketpreis,1.234 Stück verfügbar,1.0,5097600000.0,[],Various windows and frames,Architectural glass,Window panels,Pr_30_59_97,Other,"Door, Windows, Gates",Glass blocks and panels,59.0,0.0
