,Category,Category_1,Subcategory,URL,Title,ID,Imagefile,Bredde,Bredde_unit,Højde,Højde_unit,Tykkelse,Tykkelse_unit,Quantity,LastPrice,Saved,LastUpOn,Store,Country,Language,material_emb,Danish_Raw,Danish_Code,first_level,second_level,third_level,SoldAfterDays,Sold
5237,Miscellaneous Used Items,Restpartier fra byggepladser,Restpartier fra byggepladser,/diverse-brugt/restpartier-fra-byggepladser/268323/akustikplader-4-stk-1370x1177-mm,Akustikplader stk x mm,268323,[],,,,,,,1.0,2000.0,2023-08-18,2023-10-19,Genbyg,DK,dk,Metal,Profiled metal acoustic panels,Pr_35_93_13_65,Technical elements,Other,Wire structure and general products,62.0,1.0
5238,Miscellaneous Used Items,Restpartier fra byggepladser,Restpartier fra byggepladser,/diverse-brugt/restpartier-fra-byggepladser/268326/akustikplader-4-stk-1410x1177-mm,Akustikplader stk x mm,268326,[],,,,,,,2.0,2000.0,2023-08-02,2023-10-05,Genbyg,DK,dk,Metal,Profiled metal acoustic panels,Pr_35_93_13_65,Technical elements,Other,Wire structure and general products,64.0,1.0
5239,Miscellaneous Used Items,Restpartier fra byggepladser,Restpartier fra byggepladser,/diverse-brugt/restpartier-fra-byggepladser/268328/akustikplader-1485x1177-mm,Akustikplader x mm,268328,[],,,,,,,3.0,500.0,2023-09-05,2023-10-18,Genbyg,DK,dk,Metal,Profiled metal acoustic panels,Pr_35_93_13_65,Technical elements,Other,Glass blocks and panels,43.0,1.0
5240,Miscellaneous Used Items,Restpartier fra byggepladser,Restpartier fra byggepladser,/diverse-brugt/restpartier-fra-byggepladser/268324/akustikplader-4-stk-1520x1177-mm,Akustikplader stk x mm,268324,[],,,,,,,3.0,2000.0,2023-07-24,2023-10-29,Genbyg,DK,dk,Metal,Profiled metal acoustic panels,Pr_35_93_13_65,Technical elements,Other,Wire structure and general products,97.0,1.0
5642,Miscellaneous Used Items,Restpartier fra byggepladser,Restpartier fra byggepladser,/diverse-brugt/restpartier-fra-byggepladser/268433/aflastningsprofil-59-cm-tilbehoer-til-akustikplader,Aflastningsprofil cm . Tilbehør til akustikplader,268433,[],,,,,,,2.0,500.0,2023-09-18,2023-10-05,Genbyg,DK,dk,"Base, bed and fill fine aggregates",Profiled metal acoustic panels,Pr_35_93_13_65,Technical elements,"Floors, Ceiling",Sanitary fittings and accessories,17.0,1.0
5644,Miscellaneous Used Items,Restpartier fra byggepladser,Restpartier fra byggepladser,/diverse-brugt/restpartier-fra-byggepladser/268430/u-profil-264-m-tilbehoer-til-akustikplader,"U-profil , m. Tilbehør til akustikplader ,",268430,[],,,,,,,1.0,500.0,2023-09-29,2023-10-18,Genbyg,DK,dk,Sitka spruce,Profiled metal acoustic panels,Pr_35_93_13_65,Technical elements,"Stairs, Ramps, Lift, Hardware",Sanitary fittings and accessories,19.0,1.0
5650,Miscellaneous Used Items,Restpartier fra byggepladser,Restpartier fra byggepladser,/diverse-brugt/restpartier-fra-byggepladser/268431/tvaerprofil-t24-37-m-tilbehoer-til-akustikplader,"Tværprofil , m Tilbehør til akustikplader",268431,[],,,,,,,18.0,650.0,2023-09-21,2023-10-25,Genbyg,DK,dk,Metal,Profiled metal acoustic panels,Pr_35_93_13_65,Technical elements,Other,Sanitary fittings and accessories,34.0,1.0
